title,salary,location,employer,employer_rating,summary,search_city,search_role
Data Scientist/ Senior Modelling Analyst,"£55,000 - £55,001 a year",Huddersfield,Oscar Technology,3.9,"Ensure that data from all sources are stored correctly allowing easy access for current needs as well as future use.
Salary - Up to £55,000 plus 10% bonus.",Manchester,data scientist
Senior Deep Learning / Ai Engineer,"Up to £100,000 a year",Manchester•Remote,Warman O'Brien,5.0,"You will be designing and applying Deep Learning Algorithms and models to increase the accuracy, throughput, and reproducibility of genome interpretation.",Manchester,data scientist
,,Manchester M1,Peak AI,,Experience working as a Data Scientist or other applied “AI” data role is preferable however evidence of working closely with these teams will be considered.,Manchester,data scientist
Principal Technology Advisor - Ai,"£49,549 - £63,200 a year",Wilmslow SK9,Information Commissioner's Office,3.1,"The ICO’s technology group deals with some of the most complex privacy, data rights, data protection and emerging technology issues that society faces.",Manchester,data scientist
Lead Data Scientist (Technical Lead And Team Lead),"£52,051 - £63,175 a year",Manchester,Home Office,,"Ideally you will have a background in working with big data challenges and cloud-based technologies, and you will have some knowledge of creating apps, APIs or…",Manchester,data scientist
Senior Devops Engineer,,Manchester,Brambles Group,3.4,"Installed, operated, and managed several data science and machine learning frameworks, or developed own data science methodologies.
Job Type: Regular Full-Time.",Manchester,data scientist
,"£40,057 - £45,839 a year",St Helens,St Helens & Knowsley Teaching Hospitals,4.0,"Have a thorough understanding of NHS data sources, data definitions and data flows.
Utilise traditional data and wider resources including published literature,…",Manchester,data analyst
Marketing Data Analyst,"£30,000 - £40,000 a year",Manchester•Temporarily Remote,Alex James Digital,,"Highly analytical with the ability to turn data into actionable results.
_Seek important data trends from product, category and brand sales performance_.",Manchester,data analyst
,"£60,000 - £70,000 a year",Stockport,Burns Sheehan,,"This will be a new role in the business that will play a pivotal role in helping to evolve the business intelligence, data architecture and data management…",Manchester,data analyst
Commercial Finance Analyst,,Manchester,NC Associates,,"Provide store performance data & analytics to assist in strategic property decision making.
Previous experience working within a similar role as a finance…",Manchester,data analyst
Senior Digital Analyst,,Manchester Airport,MAG,3.8,"AWS Certification (if needed) / online training/ exam vouchers/ tickets to events etc.
Working with internal teams, you will be analysing data such as website…",Manchester,data analyst
,"£32,000 a year",Warrington,Customer Management Resourcing (CMR),,Our Client Is the largest energy distributor in the North West and are currently recruiting for a Resource Analyst To drive effective and efficient utilization…,Manchester,data analyst
Service Analyst,,Blackburn,Promethean,3.8,"Utilising Prometheans current data and reports.
Engage with other support teams to drive better processes through accurate reporting and data analytics to…",Manchester,data analyst
Fp&A Analyst / Finance Business Partner,"£35,000 - £40,000 a year",Manchester•Remote,Butler Rose Ltd,,"Using data to the organisation’s best advantage, telling the story behind the numbers & being able to translate this into future plans.",Manchester,data analyst
Senior Consultant - Business Analyst - Insurance Technology,,Manchester M2,EY,4.0,Our UK Insurance Technology practice empowers some of the biggest Insurance clients to solve their most complex business problems and transform their…,Manchester,data analyst
Customer Pricing Analyst,,Macclesfield,GPW Recruitment,4.0,"Analyse large sets of data, draw conclusions and make recommendations where appropriate.
Maintain existing customer pricing data for long term contracts,…",Manchester,data analyst
Business Analyst,"£45,000 - £50,000 a year",Bury•Remote,Remarkable Jobs,,"Experienced with data modelling techniques.
Salary: £45k - £50k - depending on experience + excellent benefits.*.
Degree educated or equivalent qualification.",Manchester,data analyst
Graduate Fp&A Analyst / Finance Business Partner,"£23,000 - £25,000 a year",Manchester•Remote,Butler Rose Ltd,,"Advanced Excel / data modelling skills.
Previous experience of data analysis / manipulation would be useful.
Using data to the organisation’s best advantage to…",Manchester,data analyst
Hr And Payroll Analyst,£14.50 - £15.00 an hour,Northwich CW8,Driver Support Services,,"Identifies appropriate reporting solutions to ensure data is provided, using tools to validate data between systems.
Monitors absence and holiday utilisation.",Manchester,data analyst
"Senior Consultant, Senior Data Engineer (Aws), Data & Analyt...",,Manchester,Deloitte,4.0,"Contributing to the designing of an enterprise data lake to cater to a client's data storage needs for structured and unstructured data, to enable analytics…",Manchester,data analyst
Business Analyst - 12 Month Ftc,,Salford,Dentsu Aegis Network,3.7,"Understanding of data and ETL processes.
Experience in supporting media and data platforms.
The business analyst role will be responsible for onboarding clients…",Manchester,data analyst
Senior Data Science Engineer,"£50,000 - £75,000 a year",Manchester,Searchability,4.3,"Techniques and toolkits for data cleansing, data processing and data preparation.
Any experience with techniques and toolkits for combining data or analysing…",Manchester,data scientist
Senior Data Scientist,"£70,000 - £80,000 a year",United Kingdom,Metrica Recruitment,,"You will be involved in the data-mining, machine learning and graph analysis techniques for a variety of modelling problems involving customers, their…",Manchester,data scientist
Big Data Scientist,"£75,000 - £90,000 a year",Manchester,Nexus Recruitment,,"Model using advanced statistical/ mathematical models, predict and segment data to hypothesize/ evolve uses cases to monetize data and generate other business…",Manchester,data scientist
Artificial Intelligence Engineer,"£55,000 - £65,000 a year",Manchester•Remote,Nigel Frank International Limited,2.9,"Creating and utilising algorithms and models to mine big data stores, improve models, and clean data for uniformity and accuracy.",Manchester,data scientist
"Senior Manager, Analytics & Data Science",,Manchester,Datatech Analytics,,Designing and driving an Analytics & Data Science strategy and roadmap to improve the level of analytics capability across Finance based on establishing the…,Manchester,data scientist
Senior Lecturer In Data Science,"£53,348 - £69,557 a year",Manchester M13 9PL,The University of Manchester,4.2,"The School of Social Sciences is seeking a Senior Lecturer in Data Science.
It is essential that all teaching staff on the programme are research active and…",Manchester,data scientist
Machine Learning And Ai Engineer,"£45,000 - £60,000 a year",Manchester,Nigel Frank International Limited,2.9,"Create and utilise algorithms and models to mine big data stores, perform data and error analysis to improve models, and clean and validate data for uniformity…",Manchester,data scientist
Integrated Care Analytics Services Lead Developer (Uk Wide),,Manchester,KPMG,3.9,Advanced analytics including exploiting modern data science techniques like machine learning and applied statistics to extract valuable data insights.,Manchester,data scientist
Axa Insurance Lead Data Scientist,,Bolton,Axa,3.9,"Lead a team of data scientists; develop data scientists through the competency framework.
This programme is designed to embed data-driven, intelligence-led…",Manchester,data scientist
Head Of Data Science – Manchester - £70-120K,"£100,000 a year",Manchester,Consult RPM,,"The Head of Data Science will play a key roll in growing the business using a plethora of data science skills.
Team Development and management of junior staff.",Manchester,data scientist
Data Scientist/ Senior Modelling Analyst,"£55,000 - £55,001 a year",Huddersfield,Oscar Technology,3.9,"Ensure that data from all sources are stored correctly allowing easy access for current needs as well as future use.
Salary - Up to £55,000 plus 10% bonus.",Manchester,data scientist
Senior Deep Learning / Ai Engineer,"Up to £100,000 a year",Manchester•Remote,Warman O'Brien,5.0,"You will be designing and applying Deep Learning Algorithms and models to increase the accuracy, throughput, and reproducibility of genome interpretation.",Manchester,data scientist
,,Manchester M1,Peak AI,,Experience working as a Data Scientist or other applied “AI” data role is preferable however evidence of working closely with these teams will be considered.,Manchester,data scientist
Principal Technology Advisor - Ai,"£49,549 - £63,200 a year",Wilmslow SK9,Information Commissioner's Office,3.1,"The ICO’s technology group deals with some of the most complex privacy, data rights, data protection and emerging technology issues that society faces.",Manchester,data scientist
Senior Devops Engineer,,Manchester,Brambles Group,3.4,"Installed, operated, and managed several data science and machine learning frameworks, or developed own data science methodologies.
Job Type: Regular Full-Time.",Manchester,data scientist
,,Manchester•Remote,Robert Walters,3.6,They are a Microsoft company and are in the early stages of gathering requirements to move across to an Azure Data Lake for their data.,Manchester,data analyst
Senior Credit Risk Analyst,,Manchester,Secure Trust Bank,3.4,"Highly proficient in Excel, and experience of creating insightful reports.
You will take ownership of credit risk strategies for the consumer lending portfolio,…",Manchester,data analyst
,"£25,000 a year",Manchester•Remote,Momentum Security Recruitment,,"Understanding of data creation and manipulation for testing.
Generate the necessary test data for different stages of testing.
Job Types: Full-time, Permanent.",Manchester,data analyst
Bi Developer,,Manchester,Freshfields Bruckhaus Deringer LLP,4.1,"Development of new and existing data models.
Maintain accurate documentation of data models and processes.
Gain subject matter expertise on the Enterprise data…",Manchester,data analyst
Business Analyst,,Haydock,Speedy Hire PLC,3.1,"Hybrid working model- homebased, expected to travel 1-2 days per week or less.
This role will support the Head of Digital and Project Managers to oversee full…",Manchester,data analyst
"Senior Consultant, Senior Data Engineer (Azure), Data & Anal...",,Manchester,Deloitte,4.0,"Designing an enterprise data lake to cater to a client's data storage needs for structured and unstructured data, to enable analytics across global clients.",Manchester,data analyst
Lead Growth Analyst,"£60,000 - £70,000 a year",Manchester,Harnham,4.6,Using your own expertise to come up with innovative solutions to solve potential problems on the data that is gathered.,Manchester,data analyst
Business Intelligence Analyst,"£28,000 - £30,000 a year",Heald Green,Jobwise,4.0,"Proven experience working with Power BI (or equivalent data visualisation tool).
Work with marketing team to develop, monitor and interpret data and ongoing…",Manchester,data analyst
Senior Market Analyst,,Manchester M2 1HW,CoStar Group,3.0,"Strong data and analysis skills, including Excel and SQL data manipulation skills.
Analyse market data and draw insightful conclusions.",Manchester,data analyst
Data Analyst,"£45,000 a year",Manchester,Searchability,4.3,"You will play a key part in the wider businesses understanding of data, including stakeholders from across the business.",Manchester,data analyst
Senior Data Analyst,"£35,000 - £50,000 a year",St Helens,kdr Recruitment,,The need and want to develop and improve yourself whilst growing alongside a company that has no plans to sit still.,Manchester,data analyst
Customer Insight Analyst,"£30,000 - £35,000 a year",Manchester,Harnham,4.6,Having a clear scope to use your own expertise to come up with innovative solutions to solve potential problems on the data that is gathered.,Manchester,data analyst
Senior Insight Analyst,"£35,000 - £45,000 a year",Manchester,Harnham,4.6,Working closely with advanced analysts including data scientists to help predict customer behaviour to optimise customer targeting strategies.,Manchester,data analyst
Business Analyst,"£40,000 - £50,000 a year",Manchester,Nigel Frank International Limited,2.9,"For this exciting new role, we are looking for experienced Business Analyst's with expert level SQL experience; building scripts using data, and using…",Manchester,data analyst
Data Analytics Engineer,"£55,000 a year",Manchester•Temporarily Remote,Adria Solutions,,"Develop solutions that connect to a variety of on and off-premise data sources, ensuring data is optimized to meet requirements for business and technical use…",Manchester,data analyst
Senior Data Science Engineer,"£50,000 - £75,000 a year",Manchester,Searchability,4.3,"Techniques and toolkits for data cleansing, data processing and data preparation.
Any experience with techniques and toolkits for combining data or analysing…",Manchester,data scientist
Big Data Scientist,"£75,000 - £90,000 a year",Manchester,Nexus Recruitment,,"Model using advanced statistical/ mathematical models, predict and segment data to hypothesize/ evolve uses cases to monetize data and generate other business…",Manchester,data scientist
Artificial Intelligence Engineer,"£55,000 - £65,000 a year",Manchester•Remote,Nigel Frank International Limited,2.9,"Creating and utilising algorithms and models to mine big data stores, improve models, and clean data for uniformity and accuracy.",Manchester,data scientist
"Senior Manager, Analytics & Data Science",,Manchester,Datatech Analytics,,Designing and driving an Analytics & Data Science strategy and roadmap to improve the level of analytics capability across Finance based on establishing the…,Manchester,data scientist
Senior Lecturer In Data Science,"£53,348 - £69,557 a year",Manchester M13 9PL,The University of Manchester,4.2,"The School of Social Sciences is seeking a Senior Lecturer in Data Science.
It is essential that all teaching staff on the programme are research active and…",Manchester,data scientist
Machine Learning And Ai Engineer,"£45,000 - £60,000 a year",Manchester,Nigel Frank International Limited,2.9,"Create and utilise algorithms and models to mine big data stores, perform data and error analysis to improve models, and clean and validate data for uniformity…",Manchester,data scientist
Integrated Care Analytics Services Lead Developer (Uk Wide),,Manchester,KPMG,3.9,Advanced analytics including exploiting modern data science techniques like machine learning and applied statistics to extract valuable data insights.,Manchester,data scientist
Axa Insurance Lead Data Scientist,,Bolton,Axa,3.9,"Lead a team of data scientists; develop data scientists through the competency framework.
This programme is designed to embed data-driven, intelligence-led…",Manchester,data scientist
Head Of Data Science – Manchester - £70-120K,"£100,000 a year",Manchester,Consult RPM,,"The Head of Data Science will play a key roll in growing the business using a plethora of data science skills.
Team Development and management of junior staff.",Manchester,data scientist
Data Scientist/ Senior Modelling Analyst,"£55,000 - £55,001 a year",Huddersfield,Oscar Technology,3.9,"Ensure that data from all sources are stored correctly allowing easy access for current needs as well as future use.
Salary - Up to £55,000 plus 10% bonus.",Manchester,data scientist
Senior Deep Learning / Ai Engineer,"Up to £100,000 a year",Manchester•Remote,Warman O'Brien,5.0,"You will be designing and applying Deep Learning Algorithms and models to increase the accuracy, throughput, and reproducibility of genome interpretation.",Manchester,data scientist
,,Manchester M1,Peak AI,,Experience working as a Data Scientist or other applied “AI” data role is preferable however evidence of working closely with these teams will be considered.,Manchester,data scientist
Senior Data Scientist,"£70,000 - £80,000 a year",United Kingdom,Metrica Recruitment,,"You will be involved in the data-mining, machine learning and graph analysis techniques for a variety of modelling problems involving customers, their…",Manchester,data scientist
Principal Technology Advisor - Ai,"£49,549 - £63,200 a year",Wilmslow SK9,Information Commissioner's Office,3.1,"The ICO’s technology group deals with some of the most complex privacy, data rights, data protection and emerging technology issues that society faces.",Manchester,data scientist
Senior Devops Engineer,,Manchester,Brambles Group,3.4,"Installed, operated, and managed several data science and machine learning frameworks, or developed own data science methodologies.
Job Type: Regular Full-Time.",Manchester,data scientist
Senior Insight Analyst,"£35,000 - £45,000 a year",Manchester,Harnham,4.6,Working closely with advanced analysts including data scientists to help predict customer behaviour to optimise customer targeting strategies.,Manchester,data analyst
Business Analyst,"£40,000 - £50,000 a year",Manchester,Nigel Frank International Limited,2.9,"For this exciting new role, we are looking for experienced Business Analyst's with expert level SQL experience; building scripts using data, and using…",Manchester,data analyst
Data Analytics Engineer,"£55,000 a year",Manchester•Temporarily Remote,Adria Solutions,,"Develop solutions that connect to a variety of on and off-premise data sources, ensuring data is optimized to meet requirements for business and technical use…",Manchester,data analyst
Technical Data Analyst - Home - Based - Gbp40 - 45K,"£40,000 - £45,000 a year",Manchester•Remote,Nigel Frank International Limited,2.9,"This role is highly technical as you will work with large data-sets from a variety of different sources utilising your strong experience with SQL Server, MS…",Manchester,data analyst
Bi Developer,"£55,000 a year",Manchester•Temporarily Remote,Adria Solutions,,"Understanding of data warehouse structures.
Strong knowledge of reporting data structures and design.
Providing expertise in using and developing the reporting…",Manchester,data analyst
Fp&A / Analyst,£300 a week,Altrincham,axonmoore,,"Responding to financial inquiries by gathering and interpreting data.
Predominantly this will consist of reviewing the current processes and procedures and…",Manchester,data analyst
Senior Value Analyst He,,Bollington SK10 5JB•Remote,Omnicom Health Group,,Data has been sourced from appropriate places and is recorded in a data extraction document with sufficient information to for the reviewer to assess the…,Manchester,data analyst
Pricing Analyst,,Manchester,The Ardonagh Group,,You will help monitor our portfolio and deliver innovative pricing solutions within the Retail Pricing team for Atlanta Group.,Manchester,data analyst
Senior Product Analyst,"£40,000 - £70,000 a year",Manchester•Remote,Harnham,4.6,"You will benefit from fantastic ownership, development/learning, collaborative environment, and plus they offer very good equity options within the business.",Manchester,data analyst
Emea Food Industry Analyst - Food Ingredients,,Manchester•Remote,RecruitmentRevolution.com,4.0,"You will be responsible for supporting Head of Marketing and Technical Sales (HoM), EMEA and HoM, North America, in conducting market mapping of food…",Manchester,data analyst
Senior Risk Analyst,,Manchester,NC Associates,,"Coordinate and contribute to the development of Key Risk Measures, including data sourcing.
As a Senior Risk Analyst, you will manage a team of risk analysts…",Manchester,data analyst
Bi Developer,"£50,000 - £55,000 a year",Halifax,Harnham,4.6,"Formulate techniques to ensure data within the data asset is consistently maintained, ensuring high levels of data quality.",Manchester,data analyst
Power Bi Developer,"£31,627 - £35,000 a year",Wythenshawe•Remote,ATC Recruitment,,"Knowledge of data architecture and data warehouses.
ATC Recruitment is currently looking for a *BI Developer* for a 12 month fixed term contract.",Manchester,data analyst
Hr And Payroll Analyst,£14.50 - £15.00 an hour,Northwich CW8,Driver Support Services,,"Identifies appropriate reporting solutions to ensure data is provided, using tools to validate data between systems.
Monitors absence and holiday utilisation.",Manchester,data analyst
Commercial Data Analyst,"£27,000 - £35,000 a year",St Helens,Paul Boardman Associates,,"They wish to appoint a Commercial Data Analyst (Excel Guru) to join their growing team.*.
Supporting the Sales teams with quotes and pricing.",Manchester,data analyst
Senior Data Science Engineer,"£50,000 - £75,000 a year",Manchester,Searchability,4.3,"Techniques and toolkits for data cleansing, data processing and data preparation.
Any experience with techniques and toolkits for combining data or analysing…",Manchester,data scientist
Big Data Scientist,"£75,000 - £90,000 a year",Manchester,Nexus Recruitment,,"Model using advanced statistical/ mathematical models, predict and segment data to hypothesize/ evolve uses cases to monetize data and generate other business…",Manchester,data scientist
Artificial Intelligence Engineer,"£55,000 - £65,000 a year",Manchester•Remote,Nigel Frank International Limited,2.9,"Creating and utilising algorithms and models to mine big data stores, improve models, and clean data for uniformity and accuracy.",Manchester,data scientist
"Senior Manager, Analytics & Data Science",,Manchester,Datatech Analytics,,Designing and driving an Analytics & Data Science strategy and roadmap to improve the level of analytics capability across Finance based on establishing the…,Manchester,data scientist
Senior Lecturer In Data Science,"£53,348 - £69,557 a year",Manchester M13 9PL,The University of Manchester,4.2,"The School of Social Sciences is seeking a Senior Lecturer in Data Science.
It is essential that all teaching staff on the programme are research active and…",Manchester,data scientist
Machine Learning And Ai Engineer,"£45,000 - £60,000 a year",Manchester,Nigel Frank International Limited,2.9,"Create and utilise algorithms and models to mine big data stores, perform data and error analysis to improve models, and clean and validate data for uniformity…",Manchester,data scientist
Integrated Care Analytics Services Lead Developer (Uk Wide),,Manchester,KPMG,3.9,Advanced analytics including exploiting modern data science techniques like machine learning and applied statistics to extract valuable data insights.,Manchester,data scientist
Axa Insurance Lead Data Scientist,,Bolton,Axa,3.9,"Lead a team of data scientists; develop data scientists through the competency framework.
This programme is designed to embed data-driven, intelligence-led…",Manchester,data scientist
Head Of Data Science – Manchester - £70-120K,"£100,000 a year",Manchester,Consult RPM,,"The Head of Data Science will play a key roll in growing the business using a plethora of data science skills.
Team Development and management of junior staff.",Manchester,data scientist
Data Scientist/ Senior Modelling Analyst,"£55,000 - £55,001 a year",Huddersfield,Oscar Technology,3.9,"Ensure that data from all sources are stored correctly allowing easy access for current needs as well as future use.
Salary - Up to £55,000 plus 10% bonus.",Manchester,data scientist
Senior Deep Learning / Ai Engineer,"Up to £100,000 a year",Manchester•Remote,Warman O'Brien,5.0,"You will be designing and applying Deep Learning Algorithms and models to increase the accuracy, throughput, and reproducibility of genome interpretation.",Manchester,data scientist
,,Manchester M1,Peak AI,,Experience working as a Data Scientist or other applied “AI” data role is preferable however evidence of working closely with these teams will be considered.,Manchester,data scientist
Principal Technology Advisor - Ai,"£49,549 - £63,200 a year",Wilmslow SK9,Information Commissioner's Office,3.1,"The ICO’s technology group deals with some of the most complex privacy, data rights, data protection and emerging technology issues that society faces.",Manchester,data scientist
Lead Data Scientist (Technical Lead And Team Lead),"£52,051 - £63,175 a year",Manchester,Home Office,,"Ideally you will have a background in working with big data challenges and cloud-based technologies, and you will have some knowledge of creating apps, APIs or…",Manchester,data scientist
Senior Devops Engineer,,Manchester,Brambles Group,3.4,"Installed, operated, and managed several data science and machine learning frameworks, or developed own data science methodologies.
Job Type: Regular Full-Time.",Manchester,data scientist
Credit Risk Support Analyst,,Manchester M3,FIS Global,3.4,"Ensuring that files are assigned to the correct analyst for review.
Experienced (relevant combo of work and education).",Manchester,data analyst
Business Insight Analyst,"£28,000 - £31,000 a year",Warrington WA1 1HL•Remote,Agility Resourcing,,"Build data models to improve personalisation and engagement across online and offline channels.
Using industry knowledge to help interpret data and improve…",Manchester,data analyst
