title,salary,location,employer,employer_rating,summary,search_city,search_role
Head Algorithmic Trader - Interest Rates,,"Chicago, IL 60661 (Near West Side area)+1 location",Eagle Seven,,The Head Trader will be responsible for leveraging the firm’s proprietary technology to build and manage all aspects of the trading team’s operations.,Chicago,data scientist
Senior Algorithmic Trader,,"Chicago, IL",TransMarket Group,3.0,"Build and maintain trading quantitative model tools and analytics.
Develop expertise in market microstructure, tick data, and automated trading systems.",Chicago,data scientist
Otter.Ai | Speaker Identification Engineer,,"Chicago, IL 60601 (Loop area)+2 locations•Remote",Recruiting From Scratch,,"Receive the benefits of comprehensive health, dental, vision and disability insurance.
Familiarity with the state of the art in deep learning.",Chicago,data scientist
"Senior Software Engineer, Natural Language Processing / Nlp",,"Evanston, IL 60208+1 location",Recruiting From Scratch,,"End-to-end System Design and Implementation: Gather training data; train, deploy, evaluate, and iteratively improve production-grade machine learning systems;…",Chicago,data scientist
Business Analyst- Adobe Experience Platform,,"Chicago, IL",Merkle,3.4,"Company Description: Merkle is a leading data-driven, technology-enabled, global performance marketing agency that specializes in the delivery of unique,…",Chicago,data analyst
Bi Technical Analyst,,"Rolling Meadows, IL 60008",Gallagher,3.2,"Description - External Gallagher is a global leader in insurance, risk management and consulting services. We help businesses grow, communities thrive and…",Chicago,data analyst
Business Analyst,,"Chicago, IL+2 locations",Wolters Kluwer,3.6,This is an exciting opportunity to join a healthcare information technology business in the role of Business Analyst. The Business Analyst will work closely…,Chicago,data analyst
Data Analyst,,"Glenview, IL",North American Corporation,3.0,"Envoy Solutions, a diversified distribution company with over $1.5 billion in revenue, is bringing together leading brands from the facility supplies,…",Chicago,data analyst
Lead Him Analyst,,"Munster, IN 46321","Community Foundation of Northwest Indiana, Inc.",3.0,"Responsible for providing decision and application support to three vital clerical areas: SJ Clinic HIM, Document Processing Scanning and Indexing and Record…",Chicago,data analyst
"Senior Associate, Data Scientist, Financial Services Statist...",,"Chicago, IL 60601 (The Loop area)",KPMG,3.9,"You'll be an important part of our high-energy, unique, fast-paced, and innovative culture that delivers with the agility of a tech startup and the backing of…",Chicago,data analyst
Financial Services - Insurance Data & Analytics Senior Manag...,,"Chicago, IL",PRICE WATERHOUSE COOPERS,4.0,"A career within Finance Consulting services, will provide the opportunity to work alongside CEOs, CFOs, controllers and treasurers to optimise the structure…",Chicago,data analyst
Technical Business Analyst,,"Chicago, IL 60637 (Woodlawn area)",The University of Chicago,4.1,Department BSD DIV - Center for Translational Data Science: Administration: GDC Project Management About the Department The Center for Translational Data…,Chicago,data analyst
"Senior Analyst, Marketing Science",,"Chicago, IL",M1 Holdings,,"Who we are M 1 Finance has created a personal wealth-building platform made for the modern era, uniting personal perspective and automated ease. We…",Chicago,data analyst
Senior Business Analyst,,"Naperville, IL 60563",Berkley,3.9,"Company Details: At Berkley Program Specialists, we are dedicated exclusively to program business and excel at partnering with program administrators who…",Chicago,data analyst
Incentive Compensation Analyst (Contract),,"Chicago, IL 60606 (The Loop area)+1 location",Crowe,3.6,"Your Journey at Crowe Starts Here: At Crowe, you have the opportunity to deliver innovative solutions to today’s complex business issues. Crowe’s accounting,…",Chicago,data analyst
Business Insights Analyst - B2B Marketing,,"Chicago, IL",Early Warning Services,2.9,"Come build the next-gen fintech at Zelle®, where we’re relentlessly focused on empowering prosperity in all its forms. From fast money movement for over 100…",Chicago,data analyst
Audit Analytics Senior - Data Analytics Support Specialist,,"Chicago, IL 60606 (The Loop area)",Deloitte,4.0,"Are you an individual with strong programming and analytical skills? Do you enjoy everything around data-coding, database structures, data transformations,…",Chicago,data analyst
Emissions Compliance Data Analyst,,"Burr Ridge, IL",CNH Industrial,3.8,Overview: CNH Industrial is a global leader in industrial goods. We provide farmers with cutting-edge technologies to help them feed a growing world…,Chicago,data analyst
Principal Business Intelligence Engineering - Manager,,"Chicago, IL•Remote work available",Kraft Heinz Company,3.6,"About Us The Kraft Heinz Company is one of the largest food and beverage companies in the world, with eight $1 billion+ brands and global sales of…",Chicago,data analyst
Junior Algorithmic Trader,,"Chicago, IL",TransMarket Group,3.0,"Build and maintain trading quantitative model tools and analytics.
Develop expertise in market microstructure, tick data, and automated trading systems.",Chicago,data scientist
Machine Learning Infrastructure Engineer,,"Chicago, IL",Tempus,,"Comfortable working with scientists and researchers on machine learning applications.
Use your experience, deep technical knowledge, and creativity to simplify…",Chicago,data scientist
Machine Learning Engineer,,"Chicago, IL 60654 (Loop area)",CDL 1000 Inc.,,"Partner with data scientists and data engineers to build high-performance, efficient feature pipelines from backend data sources to train models and serve…",Chicago,data scientist
Client Success Zendesk Lead,,"Chicago, IL",M1 Finance,,"Comprehensive health, dental, vision, disability, and life insurance.
This will be accomplished by supporting day-to-day operations and establishing a strategic…",Chicago,data scientist
Senior Statistical Programmer,,"Chicago, IL•Remote work available","CTI Clinical Trial Services, Inc",3.9,Work with the lead statistician to manage projects to ensure statistical programming tasks are performed within the entire project timeline.,Chicago,data scientist
Software Engineer (Machine Learning Systems),,"Chicago, IL",Venmo,3.2,You will join the team that partners with data scientists and data engineers to transform machine learning models into algorithm-driven services.,Chicago,data scientist
"Data Engineer, Data & Analytics",,"Deerfield, IL 60015",Fortune Brands,4.3,"Create high quality certified data sources that analysts and data scientists will leverage to discover insights ultimately driving revenue, growth, and…",Chicago,data scientist
,,"Chicago, IL+1 location",Credera Experienced Hiring Job Board,,Our ideal candidate is excited about leading project-based teams in a client facing role to analyze large data sets to derive insights through machine learning …,Chicago,data scientist
,,"Chicago, IL•Remote",Nav,,"Familiarity with data science principles, Python, benchmarking, data standardization, data visualization, machine learning, and SQL.
401k and HSA Company Match.",Chicago,data scientist
Statistical Arbitrage Quant Analyst,,"Evanston, IL 60201 (Downtown area)•Temporarily Remote",Magnetar,,"Broad statistical toolkit including machine learning, econometrics, and non-parametric methods.
While working remotely, our employees can take advantage of…",Chicago,data scientist
"Sr Architect, Data & Analytics",,"Deerfield, IL 60015",Fortune Brands,4.3,"10+ years of experience with data & analytics toolsets, including data engineering and data management platforms.
Bachelor’s degree in IT or related discipline.",Chicago,data scientist
Head Algorithmic Trader - Interest Rates,,"Chicago, IL 60661 (Near West Side area)+1 location",Eagle Seven,,The Head Trader will be responsible for leveraging the firm’s proprietary technology to build and manage all aspects of the trading team’s operations.,Chicago,data scientist
Senior Algorithmic Trader,,"Chicago, IL",TransMarket Group,3.0,"Build and maintain trading quantitative model tools and analytics.
Develop expertise in market microstructure, tick data, and automated trading systems.",Chicago,data scientist
Otter.Ai | Speaker Identification Engineer,,"Chicago, IL 60601 (Loop area)+2 locations•Remote",Recruiting From Scratch,,"Receive the benefits of comprehensive health, dental, vision and disability insurance.
Familiarity with the state of the art in deep learning.",Chicago,data scientist
"Senior Software Engineer, Natural Language Processing / Nlp",,"Evanston, IL 60208+1 location",Recruiting From Scratch,,"End-to-end System Design and Implementation: Gather training data; train, deploy, evaluate, and iteratively improve production-grade machine learning systems;…",Chicago,data scientist
Senior Contract Compliance Analyst,,"Downers Grove, IL 60515",Illinois Tollway,3.5,"Gather and analyze data for creating reports on ethnicity participation percentages, payments and work hours of minorities on contracts.",Chicago,data analyst
Business Analyst,,"Bannockburn, IL 60015",Biolife Plasma Services,3.4,"Develop new and improve existing data models or reports.
Accountable and responsible to maintain the US network expansion data by updating multiple files and…",Chicago,data analyst
Oracle Analytics Specialist,,"Chicago, IL 60606 (The Loop area)",Deloitte,4.0,"Implement large-scale data ecosystems including data management, governance and the integration of structured and unstructured data to generate insights…",Chicago,data analyst
"Auto, Transportation, Hospitality Data & Analytics Dev Ops S...",,"Chicago, IL 60606 (The Loop area)",Deloitte,4.0,"We provide flexible, long-term, staffing models that allow us to optimize the data life cycle, drive agility and scale and put data in the hands of decision…",Chicago,data analyst
"Sr Analyst, Developer Data Quality",,"Oak Brook, IL 60523",Chamberlain Group,3.7,"3 years of experience with SAP Customer data (SD).
3 years of experience with Informatica Data Quality or data profiling tool.",Chicago,data analyst
"Manager, Business Analysis - Credit Risk Management",,"Chicago, IL (The Loop area)+1 location",Capital One - US,3.9,"At least 3 years of experience in quantitative analysis.
At least 3 years of experience in qualitative analysis.
5+ years of experience in qualitative analysis.",Chicago,data analyst
Ba,,"Chicago, IL","Blue Cross Blue Shield of IL, MT, NM, OK & TX",3.9,Bachelor Degree and 2 years Information Technology experience OR Technical Certification and/or College Courses and 4 year Information Technology experience OR…,Chicago,data analyst
"Manager, Data Performance And Business Intelligence",,"Chicago, IL 60607 (Near West Side area)•Remote work available",GroupM Services,,Perform data QA and help develop automated QA processes to ensure data accuracy and timeliness while working with vendors in troubleshooting.,Chicago,data analyst
Global Onboarding Senior Business Analyst,,"Chicago, IL",Wolters Kluwer,3.6,"Client-facing role to onboard global clients to CT’s services through strong project management, problem solving, and a thorough understanding (or ability to…",Chicago,data analyst
Senior Data & Reporting Analyst,,"Riverwoods, IL 60015",Discover,3.8,"Data governance and data education design and processes for managing data.
Research and locate systems and data.
Deliver solution to business partners.",Chicago,data analyst
Tax Rpa Business Analyst - Senior,,"Chicago, IL 60606 (The Loop area)+1 location",Deloitte,4.0,"Working knowledge of robotics process automation, analytics, data management, statistics, accounting and computer applications.",Chicago,data analyst
Business Intelligence Data Analytics Consultant Ii,,"Northbrook, IL•Remote",Allstate,3.7,"The position is also responsible for developing standards of practice around data retrieval, data manipulation, data reporting and data analytics.",Chicago,data analyst
Senior Crm Business Analyst,,"Oak Brook, IL+1 location",BDO,3.6,"Performs gap and data analysis in support of identifying solution improvement opportunities.
Three (3) or more years of experience with CRM customizations,…",Chicago,data analyst
Eprocurement Systems Administrator/Business Analyst,,"Chicago, IL 60637 (Woodlawn area)",The University of Chicago,4.1,"Three years of experience in data reporting and analysis.
Minimum requirements include knowledge and skills developed through 2-5 years of work experience in a…",Chicago,data analyst
Business Analyst (Ocr) Sr Associate,,"Downers Grove, IL",Grant Thornton,3.7,"Partner with architecture, technology, and back office organizations to drive solution and design, be familiar with data engineering and data architecture.",Chicago,data analyst
Junior Algorithmic Trader,,"Chicago, IL",TransMarket Group,3.0,"Build and maintain trading quantitative model tools and analytics.
Develop expertise in market microstructure, tick data, and automated trading systems.",Chicago,data scientist
Machine Learning Infrastructure Engineer,,"Chicago, IL",Tempus,,"Comfortable working with scientists and researchers on machine learning applications.
Use your experience, deep technical knowledge, and creativity to simplify…",Chicago,data scientist
Machine Learning Engineer,,"Chicago, IL 60654 (Loop area)",CDL 1000 Inc.,,"Partner with data scientists and data engineers to build high-performance, efficient feature pipelines from backend data sources to train models and serve…",Chicago,data scientist
Client Success Zendesk Lead,,"Chicago, IL",M1 Finance,,"Comprehensive health, dental, vision, disability, and life insurance.
This will be accomplished by supporting day-to-day operations and establishing a strategic…",Chicago,data scientist
Senior Statistical Programmer,,"Chicago, IL•Remote work available","CTI Clinical Trial Services, Inc",3.9,Work with the lead statistician to manage projects to ensure statistical programming tasks are performed within the entire project timeline.,Chicago,data scientist
Software Engineer (Machine Learning Systems),,"Chicago, IL",Venmo,3.2,You will join the team that partners with data scientists and data engineers to transform machine learning models into algorithm-driven services.,Chicago,data scientist
"Data Engineer, Data & Analytics",,"Deerfield, IL 60015",Fortune Brands,4.3,"Create high quality certified data sources that analysts and data scientists will leverage to discover insights ultimately driving revenue, growth, and…",Chicago,data scientist
,,"Chicago, IL+1 location",Credera Experienced Hiring Job Board,,Our ideal candidate is excited about leading project-based teams in a client facing role to analyze large data sets to derive insights through machine learning …,Chicago,data scientist
,,"Chicago, IL•Remote",Nav,,"Familiarity with data science principles, Python, benchmarking, data standardization, data visualization, machine learning, and SQL.
401k and HSA Company Match.",Chicago,data scientist
Statistical Arbitrage Quant Analyst,,"Evanston, IL 60201 (Downtown area)•Temporarily Remote",Magnetar,,"Broad statistical toolkit including machine learning, econometrics, and non-parametric methods.
While working remotely, our employees can take advantage of…",Chicago,data scientist
"Sr Architect, Data & Analytics",,"Deerfield, IL 60015",Fortune Brands,4.3,"10+ years of experience with data & analytics toolsets, including data engineering and data management platforms.
Bachelor’s degree in IT or related discipline.",Chicago,data scientist
Head Algorithmic Trader - Interest Rates,,"Chicago, IL 60661 (Near West Side area)+1 location",Eagle Seven,,The Head Trader will be responsible for leveraging the firm’s proprietary technology to build and manage all aspects of the trading team’s operations.,Chicago,data scientist
Senior Algorithmic Trader,,"Chicago, IL",TransMarket Group,3.0,"Build and maintain trading quantitative model tools and analytics.
Develop expertise in market microstructure, tick data, and automated trading systems.",Chicago,data scientist
Otter.Ai | Speaker Identification Engineer,,"Chicago, IL 60601 (Loop area)+2 locations•Remote",Recruiting From Scratch,,"Receive the benefits of comprehensive health, dental, vision and disability insurance.
Familiarity with the state of the art in deep learning.",Chicago,data scientist
"Senior Software Engineer, Natural Language Processing / Nlp",,"Evanston, IL 60208+1 location",Recruiting From Scratch,,"End-to-end System Design and Implementation: Gather training data; train, deploy, evaluate, and iteratively improve production-grade machine learning systems;…",Chicago,data scientist
"Senior Systems Analyst, Quantitative Risk",,"Chicago, IL 60616 (South Loop area)",Intercontinental Exchange,3.3,Must have more than 5 years prior experience in business / systems analysis and worked as a liaison between Business and Technology teams.,Chicago,data analyst
Sr It Analyst,,"Bolingbrook, IL 60440",Ulta Beauty,3.4,Experience providing day to day support for Payroll data and systems with knowledge of payroll and business flows.,Chicago,data analyst
Senior Manager – Data Analytics - Nationwide,,"Chicago, IL",BDO,3.6,"IOT and or Streaming data ingestion tools.
Designs and implements best in class data ingestion strategies, data warehouse and data mart structures, semantic…",Chicago,data analyst
Business Analyst With Life And Annuity Insurance Industry Ex...,,"Chicago, IL+2 locations•Remote",iknowvate technologies,,"Creates data maps and data models.
Data profiling and client-facing business analyst experience.
Our client is looking Business Analyst with Life and Annuity…",Chicago,data analyst
Cloud Compliance Senior Analyst,,"Chicago, IL 60606 (The Loop area)",Deloitte,4.0,"Analyze data and provide reporting tailored to various audiences according to complexity, risk and stakeholder reporting requirements.",Chicago,data analyst
"Sr Business Analyst, Commercial Systems",,"Deerfield, IL",Horizon,3.7,"Minimum 5 years of relevant experience in IT project management/business analysis.
Highly proficient analytical and software skills aimed at data analysis and…",Chicago,data analyst
Business Analyst,,"Lisle, IL 60532",Georgia-Pacific,3.4,"Financial / Business Analysis experience – gathering data, understanding business drivers, performing analysis, originating ideas, and presenting a point of…",Chicago,data analyst
,,"Bolingbrook, IL 60440+1 location",Ulta Beauty,3.4,"The Assortment Analytics Senior Analyst will partner with the Merchants to execute strategies, refine data outputs and translate data into visual communicative…",Chicago,data analyst
Info Governance & Privacy - Data Analytics Manager,,"Chicago, IL",PRICE WATERHOUSE COOPERS,4.0,"Having the ability to identify and process critical data (e.g. internal client data, external public data, and new sources of data) to challenge the status quo…",Chicago,data analyst
State Health Technology Data Analytics,,"Chicago, IL 60606 (The Loop area)",Deloitte,4.0,"Interpret the rules for data integration and conversion.
Analyze, support and develop data warehouse objects, data quality processes, design and develop fact…",Chicago,data analyst
Us Tech Senior Business Analyst,,"Rosemont, IL 60018+3 locations",PRICE WATERHOUSE COOPERS,4.0,"Move easily between big picture thinking and managing relevant detail.
You’ll focus on managing the design and implementation of technology infrastructure…",Chicago,data analyst
Project Management Business Analyst,,"Downers Grove, IL",Grant Thornton,3.7,"This includes data integrations, infrastructure and operations projects.
In all cases the Grant Thornton business analyst is accountable for the accuracy and…",Chicago,data analyst
Business Analyst Ii,,"Bannockburn, IL 60015",Stericycle,3.2,Conduct data mining and analysis for ad hoc projects by leveraging exploratory data analysis and data visualization.,Chicago,data analyst
Acord Life And Annuity Txlife Data Schemas Technical Analyst...,,"Chicago, IL",iknowvate technologies,,"Expected Deliverables: Data schemas and data maps.
Our client is looking ACORD Life and Annuity TX Life data schemas Technical Analyst in long term project in…",Chicago,data analyst
"It - Technical Business Analyst - Chicago, Il",,"Chicago, IL",iknowvate technologies,,"Bachelor's degree in Computer science or equivalent, with minimum 10+ Years of relevant experience.
Business Analysis of Insurance requirements and writing…",Chicago,data analyst
Junior Algorithmic Trader,,"Chicago, IL",TransMarket Group,3.0,"Build and maintain trading quantitative model tools and analytics.
Develop expertise in market microstructure, tick data, and automated trading systems.",Chicago,data scientist
Machine Learning Infrastructure Engineer,,"Chicago, IL",Tempus,,"Comfortable working with scientists and researchers on machine learning applications.
Use your experience, deep technical knowledge, and creativity to simplify…",Chicago,data scientist
Machine Learning Engineer,,"Chicago, IL 60654 (Loop area)",CDL 1000 Inc.,,"Partner with data scientists and data engineers to build high-performance, efficient feature pipelines from backend data sources to train models and serve…",Chicago,data scientist
Client Success Zendesk Lead,,"Chicago, IL",M1 Finance,,"Comprehensive health, dental, vision, disability, and life insurance.
This will be accomplished by supporting day-to-day operations and establishing a strategic…",Chicago,data scientist
Senior Statistical Programmer,,"Chicago, IL•Remote work available","CTI Clinical Trial Services, Inc",3.9,Work with the lead statistician to manage projects to ensure statistical programming tasks are performed within the entire project timeline.,Chicago,data scientist
Software Engineer (Machine Learning Systems),,"Chicago, IL",Venmo,3.2,You will join the team that partners with data scientists and data engineers to transform machine learning models into algorithm-driven services.,Chicago,data scientist
"Data Engineer, Data & Analytics",,"Deerfield, IL 60015",Fortune Brands,4.3,"Create high quality certified data sources that analysts and data scientists will leverage to discover insights ultimately driving revenue, growth, and…",Chicago,data scientist
,,"Chicago, IL+1 location",Credera Experienced Hiring Job Board,,Our ideal candidate is excited about leading project-based teams in a client facing role to analyze large data sets to derive insights through machine learning …,Chicago,data scientist
,,"Chicago, IL•Remote",Nav,,"Familiarity with data science principles, Python, benchmarking, data standardization, data visualization, machine learning, and SQL.
401k and HSA Company Match.",Chicago,data scientist
Statistical Arbitrage Quant Analyst,,"Evanston, IL 60201 (Downtown area)•Temporarily Remote",Magnetar,,"Broad statistical toolkit including machine learning, econometrics, and non-parametric methods.
While working remotely, our employees can take advantage of…",Chicago,data scientist
"Sr Architect, Data & Analytics",,"Deerfield, IL 60015",Fortune Brands,4.3,"10+ years of experience with data & analytics toolsets, including data engineering and data management platforms.
Bachelor’s degree in IT or related discipline.",Chicago,data scientist
Head Algorithmic Trader - Interest Rates,,"Chicago, IL 60661 (Near West Side area)+1 location",Eagle Seven,,The Head Trader will be responsible for leveraging the firm’s proprietary technology to build and manage all aspects of the trading team’s operations.,Chicago,data scientist
Senior Algorithmic Trader,,"Chicago, IL",TransMarket Group,3.0,"Build and maintain trading quantitative model tools and analytics.
Develop expertise in market microstructure, tick data, and automated trading systems.",Chicago,data scientist
Otter.Ai | Speaker Identification Engineer,,"Chicago, IL 60601 (Loop area)+2 locations•Remote",Recruiting From Scratch,,"Receive the benefits of comprehensive health, dental, vision and disability insurance.
Familiarity with the state of the art in deep learning.",Chicago,data scientist
"Senior Software Engineer, Natural Language Processing / Nlp",,"Evanston, IL 60208+1 location",Recruiting From Scratch,,"End-to-end System Design and Implementation: Gather training data; train, deploy, evaluate, and iteratively improve production-grade machine learning systems;…",Chicago,data scientist
Senior Data Analyst,,"Chicago, IL 60606 (The Loop area)",wpromote,4.4,"This individual will contribute to data mining, data cleansing, data analysis, and visualization initiatives.
Learning how to automate data gathering, blending,…",Chicago,data analyst
Creative Design Specialist (On-Call) - Data Visualization,,"Chicago, IL",Mathematica Policy Research,3.8,Candidates must have a portfolio representing experience in interactive and static data visualization for user interfaces and documents.,Chicago,data analyst
"Analyst, Analytics And Business Intelligence",,"Chicago, IL 60637 (Woodlawn area)",The University of Chicago,4.1,"Extracts, maintains and analyzes data from third-party data sources, joining it with Phoenix (the University's Donor Relationship Management System) data to…",Chicago,data analyst
Senior Servicing Analyst,,"Chicago, IL",BMO Harris Bank,3.5,"Analyzes data and information to provide insights and recommendations.
Provides loan servicing and monitoring support for corporate and commercial lending…",Chicago,data analyst
