title,salary,location,employer,employer_rating,summary,search_city,search_role
Data Scientist Analyst,,"Newark, NJ 07102 (Central Business District area)",MARS,3.9,"Driving competitive advantage from data through analytics and data science.
Nice to have – professional qualifications in advanced analytics or data science.",Chicago,data analyst
,,"Chicago, IL 60606 (Loop area)",Group1001,,"Implements data quality rules to ensure that all data sources are consistent and accurate.
The role will focus on managing the current data warehouse, including…",Chicago,data analyst
Data Analyst-Entry Level - Remote,,"Chicago, IL•Remote",Medline Industries Inc,3.3,"Monitor for data accuracy, timeliness and integrity in data used in analysis and reporting.
Identify data and reporting tools necessary to/and perform business,…",Chicago,data analyst
Data Collection Analyst,,"Chicago, IL",Stats Perform,,"Data collection analyst will assist in obtaining and collecting tracking data for basketball via AutoSTATS, Stats Perform's patented player tracking technology…",Chicago,data analyst
"Business Intelligence Analyst, Finance Data And Analytics",,"Chicago, IL (West Town area)",Google,4.3,"Knowledge of conceptual, logical, and physical data modeling and data architecture.
Partner closely with the Finance teams, understand their data needs, and…",Chicago,data analyst
Data Analyst,,"Chicago, IL 60604 (The Loop area)",Wolverine Trading,4.2,"Analyze large data sets of historical market data and trading statistics.
Create and clean new data sources.
Experience gathering, cleaning and analyzing large…",Chicago,data analyst
Data And Reporting Analyst,,"Chicago, IL 60623 (Archer Heights area)",Lawndale Christian Health Center,,*Data Integration*: Will use ETL tools such as SSIS to design and implement data management processes that import and export data into our data warehouse from…,Chicago,data analyst
Qualitative Data Analyst,,"Chicago, IL 60637 (Woodlawn area)+2 locations",The University of Chicago,4.1,"Experience working with longitudinal data, network data, or other clustered data structures.
Participate in regular meetings with CCHE research staff and data…",Chicago,data analyst
Customer Experience Analyst (Work From Home) - Mdlive,,"Chicago, IL 60661 (Near West Side area)•Remote",Cigna,3.7,"Resourcefulness-ability to procure detailed data and information.
Lead analysis of UI and platform engagement data by bringing together various data sources to…",Chicago,data analyst
Data Analyst,,"Chicago, IL 60611 (Streeterville area)+1 location",Shirley Ryan Ability Lab,3.5,Analyzes data and generates reports that ensure data integrity by applying statistical and data science methods.,Chicago,data analyst
,,"Chicago, IL 60611 (Streeterville area)+1 location•Remote",Shirley Ryan Ability Lab,3.5,"A minimum of 5 years of progressively responsible experience using skills as a seasoned analyst to collect, analyze and present data and provide diverse…",Chicago,data analyst
Calling All Business Analysts!!,,"Chicago, IL 60601 (Loop area)+1 location",United Airlines Inc.,4.0,"Analyzes data and collaborates with insights teams to ensure feature alignment with desired outcome.
Calling all Business Analysts for Digital Products - United…",Chicago,data analyst
Litigation Data Analyst - 2Nd Shift (Remote Opportunity),,"Chicago, IL•Remote",KLDiscovery,3.6,"Serving clients for over 30 years, KLDiscovery offers data collection and forensic investigation, early case assessment, electronic discovery and data…",Chicago,data analyst
Data Analyst,,"Chicago, IL+1 location","Blue Cross Blue Shield of IL, MT, NM, OK & TX",3.9,This position is responsible for designing operational and client reports for Utilization and Medical Quality Management division; coordinating data…,Chicago,data analyst
,,"Chicago, IL (The Loop area)+2 locations",CIBC,3.8,"3-5 years of related work experience in Risk Management or Data Governance - Disciplined self-starter with strong analytical, logical, reasoning and problem…",Chicago,data analyst
Data Scientist Analyst,,"Newark, NJ 07102 (Central Business District area)",MARS,3.9,"Must have - Degree level in scientific, mathematical subject.
Driving competitive advantage from data through analytics and data science.",Chicago,data scientist
,,"Chicago, IL 60611 (Near North Side area)+1 location",Northwestern Medicine,3.9,"The data engineers/scientists use their broad knowledge of applied mathematics and statistics to create new algorithms to interpret, manipulate, and derive…",Chicago,data scientist
Data Scientist,,"Chicago, IL 60661 (West Loop Gate area)+4 locations",TransUnion,3.8,You will contribute to research and innovation initiatives in collaboration with other DSA peers and may lead small analytic research teams or manage research…,Chicago,data scientist
Data Scientist - Remote,,"Chicago, IL•Remote",Harley-Davidson,3.7,"Effectively analyze and distill data into patterns, trends, and insights.
This role may be expected to assist other data scientists on larger ad hoc projects…",Chicago,data scientist
Data Scientist (Machine Learning),,"Chicago, IL•Remote",Decision Spot,,"0-3 years of industry experience in analyzing large data, building visualizations, and building and deploying machine learning models.",Chicago,data scientist
Data Scientist,,"Chicago, IL 60607 (West Loop Gate area)+2 locations",WALGREENS,3.5,Responsible for applying advanced data analysis tools and techniques to provide insights and actionable recommendations for the business.,Chicago,data scientist
Data Scientist,,"Chicago, IL 60654 (Loop area)",Pareto Intelligence,,"1-3 years of experience working in a data analytics capacity.
Practical ability to visualize data, communicate about the data, and utilize it effectively.",Chicago,data scientist
Data Scientist,,"Chicago, IL+6 locations","Blue Cross Blue Shield of IL, MT, NM, OK & TX",3.9,"Bachelor’s degree and 3 years of work experience in a mathematical, statistical, computer science, engineering, physics, economics or related quantitative field…",Chicago,data scientist
Data Scientist - Nationwide Opportunities,,"Chicago, IL","Amazon Web Services, Inc.",3.5,Experience in an ML engineer or data scientist role building and deploying ML models or hands on experience developing deep learning models.,Chicago,data scientist
,,"Chicago, IL+4 locations",Facebook App,4.1,"Contribute towards advancing the Data Science discipline at Meta, including but not limited to driving data best practices (e.g. analysis, goaling,…",Chicago,data scientist
Machine Learning Data Scientist,,"Chicago, IL 60610 (Near North Side area)•Remote work available",Ascension,3.6,Articulate business questions and select appropriate statistical and machine learning methods to provide an answer given available data and problem specific…,Chicago,data scientist
Data Scientist,,"Chicago, IL 60601 (Loop area)+2 locations",Cognizant Technology Solutions,3.9,"'• Perform exploratory data analysis and generate insights.
Coordinates in communicating the data needs with both technology and business teams to ensure that…",Chicago,data scientist
,,"Chicago, IL 60611 (Streeterville area)•Remote",Shirley Ryan Ability Lab,3.5,"Analyzes large Revenue Cycle data sets to determine trends or issues, and to provide actionable, data-driven recommendations.",Chicago,data scientist
Sr. Data Scientist,,"Chicago, IL 60622 (West Town area)+1 location",Caterpillar,3.8,"Experience creating data solutions as well as conceptual and logical data models.
Experience with metadata managers, data profiling tools, data cataloging tools…",Chicago,data scientist
,,"Chicago, IL 60647 (Avondale area)",Coyote Logistics,3.5,"3+ years of experience in machine learning and predictive modeling at a professional level.
Create solutions to manage and consume various models and predictive…",Chicago,data scientist
,,"Chicago, IL 60625 (Albany Park area)+2 locations","Swedish Hospital, Part of NorthShore",,"Acquire data from all data sources, including EPIC, and maintain databases/data systems.
Data Collection Assist with design of data collection, development and…",Chicago,data analyst
Data Analyst 2- Enterprise Inventory Services,,"Chicago, IL+1 location",Nordstrom Inc,3.9,A day in the life… Partner with key stakeholders on data analysis problems Mine complex digital behavioral data and transform it into actionable information…,Chicago,data analyst
Data Analyst,,"Chicago, IL 60602 (The Loop area)",Adler University,3.3,"Experience in data collection and management, and data analytics tool, Tableau preferred.
Facilitates program data collection, monitoring and outcome…",Chicago,data analyst
"Data Analyst, Epidemiology",,"Chicago, IL 60602 (The Loop area)+6 locations",Chicago Public Schools,3.8,Support data collection systems and other strategies that optimize statistical efficiency and data quality including surveys and data management systems.,Chicago,data analyst
Data Analyst Ii,,"Chicago, IL+2 locations•Remote work available",Meridian Illinois,3.2,"O Internal data cleansing and data reconciliation analysis.
Handle complex data requests, reports, and predictive data modeling.",Chicago,data analyst
Data Analyst,,"Chicago, IL+2 locations",M1 Holdings,,"Acquire data from primary or secondary data sources and maintain databases/data systems.
Technical expertise regarding data models, database design development,…",Chicago,data analyst
Data Analyst,,"Chicago, IL•Remote",Superpedestrian,3.7,"Build dashboards to facilitate data-driven decision making across the company.
Prepare data from different sources for analysis and make recommendations based…",Chicago,data analyst
Junior Data Analyst,,"Chicago, IL 60601 (The Loop area)",TracyLocke,4.1,"This includes acquiring data from primary or secondary data sources and maintaining databases.
Interpreting data, analyzing results and providing on-going…",Chicago,data analyst
Analyst - Digital Personalization,,"Chicago, IL 60601 (Loop area)",United Airlines Inc.,4.0,"Analyzes data to ensure product features are aligned with objectives.
Assists team leader(s) with development of presentations, reporting and data…",Chicago,data analyst
,,"Chicago, IL•Remote",Nordstrom Card Services Inc,,"Ability to take ambiguous data questions, translate them into a clear analytical plan, and produce concise summary output that includes recommendations based…",Chicago,data analyst
Data Analyst,,"Chicago, IL 60601 (Loop area)",Aon,3.7,"Wrangle data to present meaningful and insightful data visualizations.
Partner with Technology to understand the current data model and work on building towards…",Chicago,data analyst
Data Support Analyst,,"Chicago, IL",UBS,3.8,"Ensure data integrity of vendor data feeding internal systems.
Intellectually curious, accountable and data driven.",Chicago,data analyst
,,"Chicago, IL 60654 (River North area)+2 locations",Salesforce,4.3,"Build alliances with the central data, analytics, and data science teams at Tableau to facilitate the above outcomes.",Chicago,data analyst
Electronic Medical Records Analyst,,"Chicago, IL 60604 (The Loop area)",Computer Forensics Experts,,"Experience working as a healthcare or hospital data analyst.
Experience as a healthcare provider or healthcare data analyst.",Chicago,data analyst
Project Associate (Data Analytics),,"Chicago, IL 60637 (Woodlawn area)•Remote",Chapin Hall at the University of Chicago,4.0,"Develops and maintains programs that convert data into analyzable formats and/or that can be utilized for data analysis.
Must be able to travel locally.",Chicago,data analyst
,,"Downers Grove, IL",Syngenta,4.1,"The Syngenta Analytics and Data Sciences team is seeking a Genomics Data Scientist who will play a major role in defining, designing, experimenting, and…",Chicago,data scientist
,,"Downers Grove, IL",Syngenta,4.1,"The Syngenta Analytics and Data Sciences team is seeking a Deep Learning Scientist with a passion for defining, designing, experimenting, and evaluating product…",Chicago,data scientist
Senior Data Scientist,,"Chicago, IL•Remote",Arrive Logistics,3.1,"Prepare, clean, and wrangle large data sets to identify patterns and develop machine learning models to automate decision-making and generate insights.",Chicago,data scientist
,,"Chicago, IL+1 location",Appcast Inc.,2.8,"Advanced analytics and SQL skills.
2+ years of experience in a data science leadership position.
Proven ability to translate business requirements into…",Chicago,data scientist
Data Scientist Associate,,"Warrenville, IL 60555",Edward-Elmhurst Health,3.8,"Responsible for modeling problems, discovering clinical insights and identifying opportunities using statistical, algorithmic, mining, and visualization…",Chicago,data scientist
Data Scientist,,"Chicago, IL 60601 (Loop area)+1 location",Anthem,3.7,"Requires a Bachelor's degree in Statistics, Computer Science, Mathematics, Machine Learning, Econometrics, Physics, Biostatistics or related Quantitative…",Chicago,data scientist
Junior Machine Learning Software Engineer,,"Chicago, IL","JPMorgan Chase Bank, N.A.",3.9,"As a junior level Machine Learning Software Engineer in the Corporate & Investment Bank, you will be responsible for modeling complex problems, discover…",Chicago,data scientist
Data Scientist,,"Chicago, IL 60606 (The Loop area)+1 location",Walker & Dunlop,4.0,At 180 days – You’ll be able to use a scientific approach to identify and propose new features or improvements that would benefit the project and collaborate…,Chicago,data scientist
Senior Applied Data Scientist,,"Chicago, IL 60654 (River North area)",dunnhumby,3.8,"Degree in a relevant subject.
Using big data, deep expertise and AI-driven platforms to decode the 21st century human experience – then redefine it in…",Chicago,data scientist
,,"Chicago, IL",Credera,4.1,"Minimum 8 years of hands on development experience with Business Intelligence technologies and ground in data visualization, data science, or data management.",Chicago,data scientist
,,"Chicago, IL 60654 (Goose Island area)+2 locations",Groupon,3.6,"We use industry standard data technologies, data science methods, and machine learning models to build real-time solutions that tune an inventory of merchants…",Chicago,data scientist
Data Scientist,,"Chicago, IL",NICE,3.9,"As a Data Scientist, you will be working on machine learning solutions that identify who the best representative is for a given caller.",Chicago,data scientist
"Data Scientist, Zoro",,"Chicago, IL 60603 (Loop area)+1 location",Zoro Tools,3.6,"Prior experience assisting complex business decision-making through data mining and machine learning.
Familiarity with Python or R for statistical modeling,…",Chicago,data scientist
Senior Data Scientist - Nationwide Opportunities,,"Chicago, IL","Amazon Web Services, Inc.",3.5,Experience in an ML engineer or data scientist role building and deploying ML models or hands on experience developing deep learning models.,Chicago,data scientist
"Senior Manager - Data Scientist, Card Acquisitions",,"Chicago, IL (The Loop area)+2 locations",Capital One - US,3.9,"Bachelor’s Degree plus 7 years of experience in data analytics, or Master’s Degree plus 5 years of experience in data analytics, or PhD plus 2 years of…",Chicago,data scientist
Client Data Analyst,,"Chicago, IL+2 locations","JPMorgan Chase Bank, N.A.",3.9,"Excellent analytical skills with close attention to detail.
As a Business Process Analyst, you'll provide support on a variety of initiatives by analyzing…",Chicago,data analyst
Data Management Analyst,,"Chicago, IL 60606 (Loop area)",Koch Business Solutions,3.6,"Intermediate understanding of the data development life cycle and data management principles (ETL/ELT process, SDLC, metadata management, data quality, etc.).",Chicago,data analyst
Claims Data Analyst,,"Chicago, IL 60608",Local 4 SEIU Health & Welfare Fund,,"Minimum of 3 years related experience in data analytics, preferably experienced with medical claims strongly preferred.",Chicago,data analyst
Associate Classification & Compensation Analyst,,"Chicago, IL",City of Chicago,4.1,"Previous work experience in designing and conducting data and salary surveys.
Previous work experience analyzing and interpreting statistical data in order to…",Chicago,data analyst
"Data Analyst / Sr Analyst - Strategy, Analytics & Insights",,"Chicago, IL 60607 (Near West Side area)",Uber,3.8,"3 + years experience in analytics, business intelligence, data engineering, or a within a similar role.
We have three broad purposes - (1) Own CommOps' data…",Chicago,data analyst
,,"Chicago, IL",Legal & General America,3.6,"3-5 years of relevant experience.
Monitor queues and daily reports to fill in missing data fields and resolve data inconsistencies.",Chicago,data analyst
,,"Chicago, IL",CME Group,4.1,"With supervision from an analysis project lead, the IT Business Analyst I contributes to the detailed analysis and solution validation for small projects or…",Chicago,data analyst
"Sales Administration Analyst - Chicago, Il (Remote, Work Fro...",,"Chicago, IL 60661 (Near West Side area)•Remote",Cigna,3.7,"Ability to run reports and analyze data.
Ability to analyze data and complete summary reports of findings.
The Sales Administration Analyst will provide a range…",Chicago,data analyst
Clinical Data Analyst,,"Chicago, IL 60612 (Illinois Medical District area)",Rush University Medical Center,4.0,"The analyst will have a direct reporting relationship to the Knowledge Management Team, Medical Director, and Chief Analytics Officer, who are the subject…",Chicago,data analyst
Gis And Data Analyst,,"Chicago, IL",US Cellular,3.7,"Evaluates large data sets, synthesizes data, develops analysis, and communicates strategic recommendations.
Experience working effectively with large data files…",Chicago,data analyst
Data Analyst,,"Chicago, IL 60654 (Goose Island area)",Groupon,3.6,"Develop a deep understanding of and continuously improve the fraud & payments data ETL processes.
Build dashboards in order to share historical data pivots with…",Chicago,data analyst
Data Analytics And Business Analyst - Future Of Trust,,"Chicago, IL 60606 (The Loop area)+2 locations",Deloitte,4.0,"Experience with data visualization tools (e.g. Tableau).
At least 3 years of experience.
Leverage analytical approaches to identify, prioritize, and structure…",Chicago,data analyst
Business Analyst,,"Chicago, IL",Imperium Dynamics,,The ideal candidate is a team player who will be responsible for working with the Director of Product on building company IP on top of customer relationship…,Chicago,data analyst
,,"Chicago, IL",Moody Bible Institute,,"Strong analytical skills and the ability to organize and package data with attention to detail and accuracy.
Under the direction of the Director of Admissions,…",Chicago,data analyst
Data Analyst,,"Chicago, IL",RaiseRight,,"You have 2+ years of professional experience in a data analytics or analyst role.
Develop a strong understanding of how customers behave through data and…",Chicago,data analyst
"Lead Data Scientist, Enterprise Analytics",,"Chicago, IL",JLL,3.7,The lead data scientist is responsible for leading projects by selecting appropriate machine learning and data science technologies to solve business problems.,Chicago,data scientist
Early Careers | Financial Modeling & Research | Chicago,,"Chicago, IL 60606 (The Loop area)",Goldman Sachs,4.0,"0-3 years of prior work experience in a relevant field.
Accounting and financial planning teams across the firm embody strong analytical skills, attention to…",Chicago,data scientist
Data Scientist,,"Chicago, IL 60612 (East Garfield Park area)",Waystar,2.9,"Works closely with Application Engineering, Product Management, and Operational teams in designing, experimenting-with, and implementing machine learning and…",Chicago,data scientist
Data Scientist,,"Chicago, IL 60604 (The Loop area)",Federal Reserve Bank of Chicago,3.5,"Raise awareness of advanced analytics (AI/ML) techniques in analytics community across the organization.
Experience with data/analytics related services in aws…",Chicago,data scientist
Venmo Risk Decision Scientist,,"Chicago, IL 60654 (Loop area)",PayPal,3.9,"Risk Decision Scientists apply their analytical and technical skills to researching data, monitoring, and creating logics that stop fraudulent activity on Venmo…",Chicago,data scientist
Data Scientist,,"Chicago, IL 60601 (Loop area)",Farmers Insurance Group,3.6,"Leverages customer information such as macro and micro (transactional) behavioral data to influence strategic business decisions while using complex, innovative…",Chicago,data scientist
Staff Sr. Manager - Data Scientist,,"Chicago, IL•Remote work available",Kraft Heinz Company,3.6,Work with the data scientists on your team to develop- own- implement and deploy state of the art machine learning algorithms and other predictive models which…,Chicago,data scientist
Surveillance Data Scientist,,"Chicago, IL",IMC Financial Markets,4.5,"2-3 Years SQL or Equivalent Experience querying large datasets and answering data driven problems.
Their insight into global events, market shifts and pricing…",Chicago,data scientist
Data Scientist - Remote,,"Chicago, IL 60603 (Loop area)+1 location•Remote",Grainger,3.7,Conduct exploratory data analysis and apply deep business/pricing knowledge to customer and product data to uncover new pricing insights.,Chicago,data scientist
Health Care Data Scientist,,"Chicago, IL 60606 (Loop area)","Vizient, Inc.",3.8,"Serve as the resident data expert and share best practices/approaches for statistics, machine learning techniques, data modeling, simulation and advanced…",Chicago,data scientist
Senior Data Scientist,,"Chicago, IL 60602 (The Loop area)",ActiveCampaign,4.0,"You can see more of the details here, but some of our most popular benefits include our comprehensive health and wellness benefits (including no premiums for…",Chicago,data scientist
Data Scientist - Central,,"Chicago, IL+1 location",Dataiku,,An ideal candidate is excited to learn complex new technologies and modeling techniques while being able to explain their work to other data scientists and…,Chicago,data scientist
Data Scientist,,"Chicago, IL 60606 (The Loop area)+11 locations",Deloitte,4.0,"Demonstrated ability to develop novel machine learning methods that go beyond putting together of existing code, and to apply problem-solving skills to complex…",Chicago,data scientist
Data Scientist - Chicago,,"Chicago, IL",Shift Technology,,"AI-savvy, either by having a degree in machine learning and/or statistics or be looking to work on those subjects.",Chicago,data scientist
Data Scientist Ii,,"Chicago, IL 60611 (Near North area)",American Medical Association,3.7,"Experience with machine learning techniques including but not limited to deep learning / neural networks, decision trees, random forests, gradient boosting,…",Chicago,data scientist
Quantitative Data Analyst,,"Chicago, IL 60614 (Park West area)",Polaris7,,"Acquire data and manage data in the SQL server and PostgreSQL database.
Provide analytical support to traders on data.",Chicago,data analyst
Senior Policy Analyst/Policy Fellow (Youth Data Collaborativ...,,"Chicago, IL 60637 (Woodlawn area)•Remote",Chapin Hall at the University of Chicago,4.0,"Ideal candidates will have experience initiating or managing change initiatives at youth-serving organizations, consuming and critically evaluating data and…",Chicago,data analyst
Fixed Income Data Analyst,,"Chicago, IL 60606 (The Loop area)",Piper Sandler,3.9,"This includes data management, data analysis, enforcing data standards, database administration and development delivery.",Chicago,data analyst
Product Data Analyst - Remote/Work From Home Opportunity For...,,"Oak Brook, IL 60523•Remote",Elkay Manufacturing,3.3,"Provide data governance and ensure data integrity by coordinating data management efforts across the organization.
Develop and document global data standards.",Chicago,data analyst
Business Analyst Career,,"Chicago, IL 60607 (The Loop area)",Caxy Interactive,,"Excellent oral and written communications skills - the ability to interact with the team and clients.
EXPERT COMMUNICATOR - with clients and team members to…",Chicago,data analyst
,,"Chicago, IL 60606 (The Loop area)+5 locations",Deloitte,4.0,"Minimum of 3 years of combined experience operating in environment delivering to customers in a business analyst, product management or project management…",Chicago,data analyst
Sr Data Analyst,,"Chicago, IL",AT&T,3.7,"Focus on the development of meaningful data, collection of data (both automated and from human input), aggregation and insight development, analysis of data,…",Chicago,data analyst
Data Analyst - Inventory Deployment,,"Chicago, IL+2 locations",Nordstrom Inc,3.9,"As an integral part of our Inventory Deployment team, the data analyst 1 is responsible for collecting, analyzing and presenting data to improve decision making…",Chicago,data analyst
,,"Chicago, IL",BMO Harris Bank,3.5,"Analyzes data and information to provide insights and recommendations.
Typically between 2 - 3 years of relevant experience and post-secondary degree in related…",Chicago,data analyst
Business Data Analyst,,"Northbrook, IL 60062•Remote",Underwriters Laboratories Inc.,3.6,"Aggregates data to test hypotheses, prepares and analyzes data to meet the needs of efficient data analysis, using technical experience and judgement.",Chicago,data analyst
Bi Analyst,,"Chicago, IL•Remote",Zippin,,"Experience analyzing customer data or other behavioral data.
Maintaining external data sources and models.
Analyzing customer data and making recommendations.",Chicago,data analyst
