title,salary,location,employer,employer_rating,summary,search_city,search_role
"Finance Analyst, Aws Ai And Machine Learning, Aws Ai-Ml Serv...",,"Chicago, IL",Amazon.com Services LLC,3.5,"This role requires a self-starter with a strong financial modeling background, problem solving skills, a keen attention to detail, ability to work in a fast…",Chicago,data scientist
Customer Transformation Data Scientist - Senior Associate,,"Rosemont, IL 60018+2 locations",PRICE WATERHOUSE COOPERS,4.0,"Applying statistical modelling, algorithms, data mining and machine learning algorithms problem solving;
You’ll make impactful decisions by mixing mind and…",Chicago,data scientist
Ai Automation -Process Analyst- Encore Consultant,,"Chicago, IL 60606 (The Loop area)+2 locations",Deloitte,4.0,"The Analytics & Cognitive team leverages the power of AI, machine learning, data, analytics, RPA, science and other cognitive technologies to uncover hidden…",Chicago,data scientist
Senior Data Analyst,,"Rolling Meadows, IL 60008",Gallagher,3.2,"Provides ad-hoc support to internal clients for data mining and other analytics.
3 years of experience using statistical modeling and/or machine learning…",Chicago,data scientist
"Manager, Customer Data Science",,"Chicago, IL+4 locations",McDonald's Corporate,3.5,"Develop and manage sophisticated methods of analyzing our customer data, including creating proper hypotheses and measurement strategies across our Paid…",Chicago,data scientist
Director Of Data Science (Client Role),,"Chicago, IL",Maven Advisors,,"Technical Knowledge: Experience working with and implementing one or more key technologies / platforms including: Python, R, SQL, SAS, Spark, Hadoop/HDFS, NoSQL…",Chicago,data scientist
"Senior Associate, Data Modeler (Blockchain)",,"Chicago, IL 60601 (The Loop area)+2 locations",KPMG,3.9,"Minimum three years of recent work experience involving: modeling (regression, machine learning, feature selection, dimension reduction, validation); data …",Chicago,data scientist
Amats Sales Analyst,,"Chicago, IL 60601 (The Loop area)",Aon,3.7,"Prepare spreadsheets and analyze data.
Strong Analytical skills and ability to work with large data sets.
0-3 years of relevant work experience.",Chicago,data analyst
Digital Data Analyst,,"Deerfield, IL",Lundbeck,3.9,"Expertise with data modelling and data visualizations.
This role will develop expertise with data across digital and non-digital platforms, understand how data…",Chicago,data analyst
Data And Research Analyst,,"Cicero, IL 60804",Morton College,4.1,"Ability to assess data integrity.
Proficiency in statistical analyses software and data management in Excel, data visualization tools, web based data…",Chicago,data analyst
,,"Chicago, IL 60603 (The Loop area)+2 locations",Northern Trust Corp.,3.8,"Experience in reviewing detailed data and drive for accuracy.
Two to three years of experience in the financial services industry or data driven experience.",Chicago,data analyst
"Consultant, Data & Analytics",,"Chicago, IL 60603 (The Loop area)+1 location",One Six Solutions,,"Participate in the full lifecycle of data engineering implementations, taking on roles beyond that of a developer when necessary.",Chicago,data analyst
Data Analyst,,"Oakbrook Terrace, IL 60181","Darwill, Inc.",,"Our diverse product offering includes data acquisition, email appends, integrated marketing services, production workflows, custom print production, direct mail…",Chicago,data analyst
,,"Bloomingdale, IL 60108•Remote",First American Bank,3.2,"Minimum of two years of experience in data maintenance and data reporting/analytics.
Experience in data maintenance required, including manual maintenance and…",Chicago,data analyst
"Analyst - Academy, Data Center Transformation (Dct)",,"Elk Grove Village, IL 60007","Sirius Computer Solutions, Inc.",3.5,"Other data privacy and data security related regulatory training may be required based on your role or assignment.
Self-development and certification courses.",Chicago,data analyst
Behavior Analyst- Clinic,,"Countryside, IL 60525",Helping Hand Center,3.3,"Summarize and graph raw data.
Thoroughly collect and analyze data.
O Apply the most efficient and appropriate method(s) of data collection to capture relevant…",Chicago,data analyst
Senior Data Management Analyst,,"Chicago, IL 60604 (The Loop area)",CNA Insurance,3.6,"Analyze data for reasonableness and accuracy, determining causes of inaccuracies and proposing solutions for improved data capture and data quality.",Chicago,data analyst
Senior Business Analyst - Remote,,"Chicago, IL 60684 (Near West Side area)•Remote",HUB International,3.2,"Required Experience: 5-7 years of relevant experience.
Strong organizational skills and attention to detail.
This experienced contributor is expected to develop…",Chicago,data analyst
Data Analyst Consultant,,"Wood Dale, IL 60191",C.H Robinson,3.4,"Understands data structures and guides the implementation of additional data points into data domains.
Collaboration with Domain teams to ensure data points…",Chicago,data analyst
Business Analyst Ii,,"Chicago, IL 60611 (Near North area)",American Medical Association,3.7,"Maintain data on competitor pricing, product and market trends on monthly basis.
Communicates clearly to both business and technical audiences at all levels,…",Chicago,data analyst
Tax Analyst,,"Chicago, IL 60603 (The Loop area)",Northern Trust Corp.,3.8,"Analytical, accounting, and computer skills are needed to analyze and process tax cost data.
1-3 years of tax related experience or B.S. in Accounting.",Chicago,data analyst
Commercial Banking - Data Visualization Manager - Vp,,"Chicago, IL","JPMorgan Chase Bank, N.A.",3.9,"Ensure downstream users have quality user experience and are adequately securing data and adopting best practices.
SQL knowledge and Database/Hadoop experience.",Chicago,data analyst
Retail/Consumer Data Management/Advanced Analytics Manager,,"Chicago, IL 60606 (The Loop area)",Deloitte,4.0,"Advanced knowledge in at least one of the following: machine learning, deep learning, time-series modeling, propensity and prediction, behavioral nudges,…",Chicago,data scientist
Senior Statistician,,"Chicago, IL",Abbvie,4.0,"Provide statistical expertise for design, analysis and reporting of clinical or scientific research studies.
Works collaboratively with multi-function teams to…",Chicago,data scientist
"Data Analytics Engineer /Bi Engineer, Senior, Us (Azure)",,"Chicago, IL 60607 (Near West Side area)",EY,4.0,"EY delivers unparalleled tech consulting services in data strategy, big data engineering, business intelligence, digital, machine learning and Artificial…",Chicago,data scientist
Senior Machine Learning Engineer - Applied Intelligence (Rem...,,"Chicago, IL 60290+1 location•Remote",New Relic,3.3,Our ideal candidate is someone who can strengthen our team with their knowledge and passion for data science and machine learning to build outstanding products…,Chicago,data scientist
"Product Manager, Analytics",,"Chicago, IL+1 location",Riskonnect Inc.,3.3,The goal is to deliver a best in class effective and intelligent analytics solution which provides a simple and engaging experience for customers providing…,Chicago,data scientist
Principal Software Engineer - Machine Learning,,"Chicago, IL•Temporarily Remote",Zynga,3.8,"Experience in analytics and big data is a plus.
Our business intelligence system enables game teams to discover and gather players' insights to make data-driven…",Chicago,data scientist
Lead Data Scientist,,"Chicago, IL",Appcast Inc.,2.8,"Manage and mentor a growing team of data scientists.
Advanced analytics and SQL skills.
5+ years of experience in a data science leadership position.",Chicago,data scientist
"Senior Manager, Enablement Data Science",,"Chicago, IL 60654 (River North area)",Salesforce,4.3,"Lead a high-achieving, innovative, fast-paced team of data scientists and machine learning engineers that partner with cross-functional teams to understand the…",Chicago,data scientist
Sr. System Data Analyst/Tableau Developer,,"Maywood, IL 60153",Trinity Health,3.3,Leads and participates in project teams associated with the further development and/or implementation of electronic health records and/or other Finance-IT…,Chicago,data scientist
Environmental Data Manager/Data Scientist (Mid-Senior Level),,"Rolling Meadows, IL",ERM Group,3.3,Perform and manage multiple tasks within scope/budget/schedule expectations and ensure quality standards on project deliverables.,Chicago,data scientist
Senior Data Scientist,,"Chicago, IL 60606 (The Loop area)",Walker & Dunlop,4.0,At 180 days – You’ll be able to use a scientific approach to identify and propose new features or improvements that would benefit the project and collaborate…,Chicago,data scientist
Experienced Manager Data Analytics - Nationwide,,"Chicago, IL+1 location",BDO,3.6,"Identifies and researches new trends and tools, understands the data analytics marketplace while working in a dedicated data analytics lab on client engagements…",Chicago,data scientist
Senior Machine Learning Engineer,,"Chicago, IL 60607 (West Loop Gate area)+1 location",WALGREENS,3.5,"Collaborates with AI/ML scientists and data scientists to prepare data for model development, and to deploy models to production.",Chicago,data scientist
Statistical Arbitrage Quant Analyst,,"Evanston, IL 60201 (Downtown area)•Temporarily Remote",Magnetar Capital,,"Broad statistical toolkit including machine learning, econometrics, and non-parametric methods.
While working remotely, our employees can take advantage of…",Chicago,data scientist
Machine Learning Architect -Location Open,,"Chicago, IL 60606 (The Loop area)+5 locations",Deloitte,4.0,"Collaborate with data scientists, data engineers and other key stakeholders in a fast-paced cross-functional and diverse environment.",Chicago,data scientist
Advisory Business Analyst,,"Chicago, IL 60637 (East Hyde Park area)",Hatch,3.9,"2-5 years of industry experience relevant to mining, metals, energy, or infrastructure.
Strong data analytics skills, including experience with business…",Chicago,data analyst
,,"Chicago, IL 60611 (Near North area)•Remote work available",STORCK USA,4.7,"A curiosity for data and finding selling stories with data.
Knowledge of either IRI, or Nielsen data and software.
Customer and Class-of-Trade Performance.",Chicago,data analyst
Sr. Data Analyst,,"Chicago, IL 60606 (The Loop area)",RSM US LLP,3.6,"2+ years minimum in a data management, data quality or data operations role.
Seek data quality feedback from IMC and CRM users to ensure a continuous focus on…",Chicago,data analyst
Sales Analyst,,"Cicero, IL 60804",Breakthru Beverage Group,3.8,"Three years of relevant analytical experience in finance, marketing or business analyst role ideally with a consumer packaged goods company or data provider …",Chicago,data analyst
"Senior Analyst, Sales Reporting And Operations",,"Chicago, IL 60606 (West Loop Gate area)•Remote",Guidehouse,3.4,"This person will be responsible for data collection, data management, and data reporting.
Experience with data visualization tools.",Chicago,data analyst
Sr. Business Analyst,,"Chicago, IL",Softnet Ventures,,"Business readiness activities including data cleaning.
Knowledge of the master data Material Management.
Business readiness activities including data cleaning,…",Chicago,data analyst
Business Analyst,,"Chicago, IL",ACS Group,3.2,"Distributed application development, requirement analysis and design, JIRA, Agile, Story writing, definition of done, ready, spec by example, estimation, scrum…",Chicago,data analyst
Hr Analyst,,"Oak Brook, IL 60523",Athletico,3.7,"Assist with data integrity and lead analysis projects.
Ensure compliance with data privacy regulations and best practices.",Chicago,data analyst
,,"Chicago, IL 60601 (The Loop area)",Kemper,3.2,"Assists in examining data to support effective underwriting and marketing decisions.
One or more years of experience as an actuarial analyst a plus.",Chicago,data analyst
Financial Crimes- Data And Analytics- Sr. Associate,,"Chicago, IL",PRICE WATERHOUSE COOPERS,4.0,"Demonstrates thorough abilities and/or a proven record of success in the application of statistical methods, data mining or data-driven problem solving,…",Chicago,data analyst
Hris Analyst,,"Chicago, IL 60684 (Near West Side area)",HUB International,3.2,"5 years of relevant experience in an HRIS analyst role, Human Resources, or in a similar/equivalent position with a focus on reporting and analysis.",Chicago,data analyst
Senior Analyst - Data Governance,,"Chicago, IL+3 locations•Temporarily Remote",McDonald's Corporate,3.5,"Experience with data classification, data labeling and data access control.
Hands-on experience in data quality, data profiling and data analysis.",Chicago,data analyst
Data Analyst,,"Chicago, IL 60603 (The Loop area)",Engineering USA,,Minimum 5 years of experience in engineering and/or manufacturing processes for design and development of analytic solutions.,Chicago,data analyst
Provider Data Analyst Sr,,"Gary, IN",Anthem,3.7,Requires a BA/BS degree in a related field and a minimum of 5 years data file/reporting experience; experience using analytics and/or relational databases;…,Chicago,data analyst
"Talent Acquisition - Data & Analytics Recruiter, Associate",,"Chicago, IL","JPMorgan Chase Bank, N.A.",3.9,"Must have experience recruiting for data, analytics and/ or technology professionals.
As a Data & Analytics Recruiter, you will be responsible for sourcing D&A…",Chicago,data analyst
Machine Learning Architect -Location Open,,"Chicago, IL 60606 (The Loop area)+5 locations",Deloitte,4.0,"Collaborate with data scientists, data engineers and other key stakeholders in a fast-paced cross-functional and diverse environment.",Chicago,data scientist
Junior Sales Engineer--Ai Cybersecurity--Chicago Or Remote,,"Chicago, IL 60603 (Loop area)",Bundoran Group LLC,,This companys proprietary platform uses AI to detect the threat early and mitigate any threat in the process and allows the smaller more vulnerable companies…,Chicago,data scientist
Blockchain Developer - Ai & Emtech Lab - Labs 2.0,,"Chicago, IL",PRICE WATERHOUSE COOPERS,4.0,"Masters degree or equivalent or PhD; specialization or experience in machine learning, machine reasoning, natural language processing, or data mining…",Chicago,data scientist
Senior Data Analyst - Advanced Analytics - Remote,,"Lisle, IL 60532",Smithfield Foods,3.4,"Develop predictive analytics models to uncover insights about the business, using advanced statistical methods and machine learning.",Chicago,data scientist
Audit & Data Strategy Manager,,"Chicago, IL 60606 (The Loop area)",Deloitte,4.0,"Hands-on experience with data preparation, data management, business intelligence or analytics.
You will define strategic and innovative opportunities to…",Chicago,data scientist
Analytics & Cognitive Consultant,,"Chicago, IL 60606 (The Loop area)+2 locations",Deloitte,4.0,"Drive operational efficiency by maintaining their data ecosystems, sourcing analytics expertise and providing As-a-Service offerings for continuous insights and…",Chicago,data scientist
"Senior Statistical Programmer, Sas",,"Chicago, IL 60606 (Loop area)","Vizient, Inc.",3.8,"In this role, you will provide statistically & methodologically sound analytics to ensure analytic validity regarding hypothesis evaluation, study design…",Chicago,data scientist
Machine Learning - Software Architect,,"Oakbrook Terrace, IL 60181",The Joint Commission,3.8,"Develops and programs integrated software algorithms to structure, analyze and leverage data in product and systems applications in both structured and…",Chicago,data scientist
Sr. Data Architect - Analytics,,"Chicago, IL 60646","CNO Financial Group, Inc.",3.2,"Stays current with Data Analytics technology (IE artificial intelligence, machine learning etc..) providing key insights to CNO leaders.",Chicago,data scientist
Machine Learning Engineer - Opportunity For Working Remotely...,,"Chicago, IL•Remote",VMware,4.1,"Experience doing data science in addition to supporting data science activities.
Familiarity with machine learning frameworks, such as Tensorflow or PyTorch.",Chicago,data scientist
Modern Data Platform Architect,,"Chicago, IL 60290",IBM,3.9,"Modern Data Platform Architect, will be responsible for partnering with the architects and engineers throughout the organization, providing solution governance…",Chicago,data scientist
Data Science Manager,,"Lisle, IL+1 location",KANTAR,3.7,"Experience with database management, dashboard development, simulator development and data visualization tools a plus.
Media agency experience is a plus.",Chicago,data scientist
"Senior Financial Analyst, Aws Ai And Machine Learning",,"Chicago, IL",Amazon.com Services LLC,3.5,"This role requires a self-starter with a strong financial modeling background, problem solving skills, a keen attention to detail, ability to work in a fast…",Chicago,data scientist
Machine Learning Engineer,,"Chicago, IL•Remote work available",Kraft Heinz Company,3.6,"Work in cross-functional agile teams of highly skilled software/machine learning engineers, data scientists, designers, product managers and others to build the…",Chicago,data scientist
Sr. Machine Learning Engineer,,"Chicago, IL 60604 (The Loop area)",Workday,4.0,"Be part of a team of data scientists and software developers.
5+ yrs experience as part of a data science, machine learning software development team or…",Chicago,data scientist
Senior Data Analyst,,"Chicago, IL 60290+2 locations",New Relic,3.3,"Recognize the common challenges with data collection and know how to address.
Responsible for the design and development of compelling data visualizations via…",Chicago,data analyst
Clinical It Business Analyst,,"Chicago, IL 60604 (The Loop area)",Gateway Foundation Inc,3.2,"Ability to use a keyboard and video display terminal to receive, retrieve, and/or audit information and data; and to enter and transform words and data.",Chicago,data analyst
Business Intelligence Analyst,,"Chicago, IL",Green Thumb,2.2,"Drive operational excellence for data ingestion, transformation and publication to ensure confidence in systems.
Great communication and troubleshooting skills.",Chicago,data analyst
,,"Chicago, IL",CVS Health,3.2,"In order to excel in this role, 3 types of skills are required: project management, solution strategist and data analyst.",Chicago,data analyst
Data Analyst - Advanced Analytics,,"Downers Grove, IL 60515",Univar Solutions Inc.,3.3,"Support commercial processes by providing/creating required data.
Primary areas of focus are data analysis for business stakeholders, Data visualization for…",Chicago,data analyst
Marketing Data Sr Analyst,,"Chicago, IL",Avant,3.0,"Collaborate with data science to develop and refine models.
Develop reports/dashboards and provide insights behind the data to help marketing team evaluate…",Chicago,data analyst
Business Analyst,,"Chicago, IL 60601 (Loop area)•Remote",Ascensus,3.1,"This position is responsible for analyzing, gathering, developing and writing requirements, testing /QA, and active engagement in the projects related to the…",Chicago,data analyst
"Financial Analyst, Neurological Sciences",,"Chicago, IL 60612 (Illinois Medical District area)+1 location",Rush University Medical Center,4.0,"Experience in data abstraction and report analysis required.
Assists RUMG departments with provider dashboards monthly to show volumes and RVU data compared to…",Chicago,data analyst
Business Analyst,,"Arlington Heights, IL 60005•Remote",AMERICAN SOCIETY OF PLASTIC SURGEONS,2.9,"Minimum of 5 years of experience in business requirements gathering, documentation and implementation (including development of use cases, test cases, workflow…",Chicago,data analyst
"Business Analyst, Analytics & Research",,"Chicago, IL+2 locations",Alexander Group,,"Create compelling PowerPoint charts and data-driven stories based on client data and industry benchmarks.
You will be working with data in MS Excel on a daily…",Chicago,data analyst
Senior Business Analyst,,"Chicago, IL 60614 (Sheffield Neighbors area)",DePaul University,4.3,"Minimum 5 years experience in financial operations or a closely related field.
Highly organized and detail-oriented in order to track, manage, and resolve…",Chicago,data analyst
Sr. Business Data Analyst,,"Chicago, IL 60607 (West Town area)",BISSELL Homecare,3.5,"Familiarity with data warehouses, data modeling and ETL concepts and statistical software such as R or SAS, scripting languages such as R & Python for data…",Chicago,data analyst
"Senior Data Analyst, Media Analytics",,"Chicago, IL 60606 (The Loop area)",Epsilon,3.4,"1 - 3 years of relevant industry experience.
Complete ad hoc research into complex issues related to Epsilon’ ad server, user profile, and data warehouse…",Chicago,data analyst
Analyst Business Intelligence,,"Chicago, IL 60290",Supply Chain Services,3.9,"Ability to analyze data, employing statistical concepts, and present recommendations based on that data.
Identification of additional data requirements and…",Chicago,data analyst
Ra Sr Analyst Change Impact,,"Chicago, IL",US Cellular,3.7,"Ability to query and analyze data.
Define data collection needs from various system interfaces and determine analysis requirements based on business rules.",Chicago,data analyst
,,"Downers Grove, IL",Syngenta,4.1,"Playing a major role in defining, designing, experimenting, and evaluating product-focused solutions and delivering business insights, utilizing data mining,…",Chicago,data scientist
"Artificial Intelligence, Senior Consultant - Applied Artific...",,"Chicago, IL 60606 (The Loop area)+2 locations",Deloitte,4.0,"Perform data studies and data discovery routines for video, voice, weblog, sensor, machine and social media data sources or mash ups of new and existing data…",Chicago,data scientist
"Senior Statistical Programmer, Python",,"Chicago, IL 60606 (Loop area)","Vizient, Inc.",3.8,"Pull data from data marts and data bases.
Provide computationally complex analysis for leadership team to identify critical issues/questions around clinical…",Chicago,data scientist
"Partner Engineer, Ai/Pytorch",,"Chicago, IL",Facebook App,4.1,"The ideal candidate will have industry experience working on any of the following: deep learning, machine learning, computer vision, natural language processing…",Chicago,data scientist
Data Scientist - Experienced Manager,,"Chicago, IL 60606 (West Loop Gate area)+1 location",Capgemini,3.8,"You are responsible for data related activities such as data extraction, profiling, cleansing, de-duplication, standardization, conversion, transformation and…",Chicago,data scientist
Ai And Dsp Systems Engineer,,"Markham, IL+1 location",Qualcomm Canada ULC,4.1,"The candidate should be motivated and self-driven, and be able to work with multiple teams, to determine and understand requirements and resolve technical…",Chicago,data scientist
Senior Analyst Conversational Ai,,"Deerfield, IL 60015",WALGREENS,3.5,"Bachelor’s Degree and at least 1 year of experience with analyzing and reporting data in order to identify issues, trends, or exceptions to drive improvement of…",Chicago,data scientist
Data Governance Senior Consultant-Analytics & Cognitive,,"Chicago, IL 60606 (The Loop area)+3 locations",Deloitte,4.0,"3+ years of relevant data management consulting or industry experience (master data, metadata, data architecture, data governance, data quality, data modeling…",Chicago,data scientist
,,"Downers Grove, IL 60515",SAP,4.3,The Business Process Consultant shall provide deep subject matter expertise and content around the area of Product Lifecycle Management and Master Data…,Chicago,data scientist
Practice Manager - Data & Ai,,"Chicago, IL 60611 (Streeterville area)","Insight Enterprises, Inc.",3.6,"Responsible for communicating the Data & AI capabilities and solution strategies available to each area through the effective management of Data & AI offerings,…",Chicago,data scientist
Machine Learning Engineer – Chicago,,"Chicago, IL",Object Partners,,"Strong working knowledge of data analytics, data validation, visualization, and governance.
As a Machine Learning Engineer, you’ll be working with the latest…",Chicago,data scientist
Data Scientist (Remote Us),,"Oak Brook, IL 60523•Remote",Infoblox,3.8,Apply data-mining and machine learning techniques for a variety of modeling and relevance problems involving DNS and networking data.,Chicago,data scientist
"Statistician I - Rush Preventive Medicine Research, Full Tim...",,"Chicago, IL 60612 (Illinois Medical District area)",Rush University Medical Center,4.0,"Develop and document computer programs to manage, summarize, maintain, and describe scientific data resulting from biomedical research studies.",Chicago,data scientist
Data Scientist,,"Bolingbrook, IL 60440+1 location",Ulta Beauty,3.4,"The Data Scientist will also act as a subject matter expert, communicating the value and tackling the application of advanced analytics for various use cases…",Chicago,data scientist
Senior Machine Learning Product Manager,,"Chicago, IL+1 location•Temporarily Remote",McDonald's Corporate,3.5,5-7 years of product management experience and have experience defining product roadmaps – ideally for data or analytics products.,Chicago,data scientist
It Business Analyst Ii,,"Chicago, IL",CME Group,4.1,"Creating data flows, messaging specs and mappings between systems.
1-3 years of business systems analysis, architecture, or related area experience.",Chicago,data analyst
