title,salary,location,employer,employer_rating,summary,search_city,search_role
Statistical Arbitrage Quant Analyst,,"Evanston, IL 60201 (Downtown area)•Temporarily Remote",Magnetar,,"Broad statistical toolkit including machine learning, econometrics, and non-parametric methods.
While working remotely, our employees can take advantage of…",Chicago,data scientist
"Sr Architect, Data & Analytics",,"Deerfield, IL 60015",Fortune Brands,4.3,"10+ years of experience with data & analytics toolsets, including data engineering and data management platforms.
Bachelor’s degree in IT or related discipline.",Chicago,data scientist
Head Algorithmic Trader - Interest Rates,,"Chicago, IL 60661 (Near West Side area)+1 location",Eagle Seven,,The Head Trader will be responsible for leveraging the firm’s proprietary technology to build and manage all aspects of the trading team’s operations.,Chicago,data scientist
Senior Algorithmic Trader,,"Chicago, IL",TransMarket Group,3.0,"Build and maintain trading quantitative model tools and analytics.
Develop expertise in market microstructure, tick data, and automated trading systems.",Chicago,data scientist
Otter.Ai | Speaker Identification Engineer,,"Chicago, IL 60601 (Loop area)+2 locations•Remote",Recruiting From Scratch,,"Receive the benefits of comprehensive health, dental, vision and disability insurance.
Familiarity with the state of the art in deep learning.",Chicago,data scientist
"Senior Software Engineer, Natural Language Processing / Nlp",,"Evanston, IL 60208+1 location",Recruiting From Scratch,,"End-to-end System Design and Implementation: Gather training data; train, deploy, evaluate, and iteratively improve production-grade machine learning systems;…",Chicago,data scientist
Lis Beaker Analyst,,"Arlington Heights, IL 60005",Northwest Community Healthcare,3.0,"Maintains data integrity for all supported systems.
Designs and conducts periodic data audits with users.
Ensures that data coming across an interface into an…",Chicago,data analyst
Financial Services - Data & Analytics Technology Director,,"Chicago, IL",PRICE WATERHOUSE COOPERS,4.0,"Lead a team of business analysts, data analysts, and developers to deliver a data engagement.
Manage data strategy, data roadmap, data governance, and data…",Chicago,data analyst
Senior Business Analyst,,"Chicago, IL 60007",eMoney Advisor,3.4,"5-7 years of Business Analysis or Solutions Architect experience, preferably in a SaaS environment and/or in the financial services/fintech industry.",Chicago,data analyst
Business Analyst,,"Chicago, IL 60606 (The Loop area)","Liferay, Inc.",3.0,"3-5 years of experience in a strategy or business analysis related role.
Facilitate data gathering and analysis based on existing implementations and client…",Chicago,data analyst
Financial Business Analyst,,"Chicago, IL 60631 (Edison Park area)",Focus Management Group,,"Analyst will interpret results using a variety of techniques, ranging from simple data aggregation via statistical analysis to complex data.",Chicago,data analyst
Aml Robotics Process Automation And Reporting Analyst,,"Chicago, IL (The Loop area)",BMO Financial Group,3.5,"Works with various data owners to discover and select available data sources from internal sources and external vendors (e.g. lending system, payment system,…",Chicago,data analyst
Business Intelligence Manager - Market Research,,"Chicago, IL 60654 (The Loop area)",Kirkland and Ellis,4.0,"; create such documents as needed and ensure BI team is meeting or exceeding data standards.
Meticulous methods of information acquisition, compilation, and…",Chicago,data analyst
Business Analysis - Technical Writer - Advanced,,"Chicago, IL",Pinnacle Group,3.7,"Advanced business and data analysis, business.
Expert in technical writing, modeling process flows, data relationship.",Chicago,data analyst
Hr Business Analyst,,"Chicago, IL 60605 (South Loop area)+2 locations",Columbia College Chicago,4.3,"The position will focus on data integrity, data analysis, system administration, process improvements, reporting and ensuring integration of all HR databases.",Chicago,data analyst
Health & Benefits Analyst – H&B Immersion Program (Universit...,,"Chicago, IL",Willis Towers Watson,3.6,"You will have exposure to real client assignments which will exercise your ability to analyze data, draw conclusions, and present results.",Chicago,data analyst
"Analyst, Market Intelligence & Competitive Intelligence – He...",,"Deerfield, IL 60015",BAXTER,3.8,"Synthesize major themes from broad data collection to determine new perspectives and deliver new insights.
Retirement Savings – Choose from pre-tax and/or Roth…",Chicago,data analyst
Sr. Salesforce Business Analyst,,"Chicago, IL",WalkMe,3.9,"You will work with executive leaders to implement enhancements.
If you're keen on improving the lives of your co-workers, always learning new processes and…",Chicago,data analyst
Manufacturing Systems (Mes) Business Analyst,,"Chicago, IL",Accenture,4.0,Participate in workshops with technical teams and end-users to gather requirements for Master Batch Record design.,Chicago,data analyst
"Data & Analytics Manager, Geo Analytics - Bcg Gamma",,"Chicago, IL",Boston Consulting Group,4.2,"We design algorithms and build complex models out of large amounts of data.
Demonstrated handling, processing, and deriving insights from remotely sensed data…",Chicago,data analyst
Specialist Master - Data & Analytics Delivery - Banking & Ca...,,"Chicago, IL 60606 (The Loop area)",Deloitte,4.0,"6+ years of relevant data management consulting or industry experience (master data, metadata, data architecture, data governance, data quality, data modeling,…",Chicago,data analyst
Junior Algorithmic Trader,,"Chicago, IL",TransMarket Group,3.0,"Build and maintain trading quantitative model tools and analytics.
Develop expertise in market microstructure, tick data, and automated trading systems.",Chicago,data scientist
Machine Learning Infrastructure Engineer,,"Chicago, IL",Tempus,,"Comfortable working with scientists and researchers on machine learning applications.
Use your experience, deep technical knowledge, and creativity to simplify…",Chicago,data scientist
Machine Learning Engineer,,"Chicago, IL 60654 (Loop area)",CDL 1000 Inc.,,"Partner with data scientists and data engineers to build high-performance, efficient feature pipelines from backend data sources to train models and serve…",Chicago,data scientist
Client Success Zendesk Lead,,"Chicago, IL",M1 Finance,,"Comprehensive health, dental, vision, disability, and life insurance.
This will be accomplished by supporting day-to-day operations and establishing a strategic…",Chicago,data scientist
Senior Statistical Programmer,,"Chicago, IL•Remote work available","CTI Clinical Trial Services, Inc",3.9,Work with the lead statistician to manage projects to ensure statistical programming tasks are performed within the entire project timeline.,Chicago,data scientist
Software Engineer (Machine Learning Systems),,"Chicago, IL",Venmo,3.2,You will join the team that partners with data scientists and data engineers to transform machine learning models into algorithm-driven services.,Chicago,data scientist
"Data Engineer, Data & Analytics",,"Deerfield, IL 60015",Fortune Brands,4.3,"Create high quality certified data sources that analysts and data scientists will leverage to discover insights ultimately driving revenue, growth, and…",Chicago,data scientist
,,"Chicago, IL+1 location",Credera Experienced Hiring Job Board,,Our ideal candidate is excited about leading project-based teams in a client facing role to analyze large data sets to derive insights through machine learning …,Chicago,data scientist
,,"Chicago, IL•Remote",Nav,,"Familiarity with data science principles, Python, benchmarking, data standardization, data visualization, machine learning, and SQL.
401k and HSA Company Match.",Chicago,data scientist
Statistical Arbitrage Quant Analyst,,"Evanston, IL 60201 (Downtown area)•Temporarily Remote",Magnetar,,"Broad statistical toolkit including machine learning, econometrics, and non-parametric methods.
While working remotely, our employees can take advantage of…",Chicago,data scientist
"Sr Architect, Data & Analytics",,"Deerfield, IL 60015",Fortune Brands,4.3,"10+ years of experience with data & analytics toolsets, including data engineering and data management platforms.
Bachelor’s degree in IT or related discipline.",Chicago,data scientist
Head Algorithmic Trader - Interest Rates,,"Chicago, IL 60661 (Near West Side area)+1 location",Eagle Seven,,The Head Trader will be responsible for leveraging the firm’s proprietary technology to build and manage all aspects of the trading team’s operations.,Chicago,data scientist
Senior Algorithmic Trader,,"Chicago, IL",TransMarket Group,3.0,"Build and maintain trading quantitative model tools and analytics.
Develop expertise in market microstructure, tick data, and automated trading systems.",Chicago,data scientist
Otter.Ai | Speaker Identification Engineer,,"Chicago, IL 60601 (Loop area)+2 locations•Remote",Recruiting From Scratch,,"Receive the benefits of comprehensive health, dental, vision and disability insurance.
Familiarity with the state of the art in deep learning.",Chicago,data scientist
"Senior Software Engineer, Natural Language Processing / Nlp",,"Evanston, IL 60208+1 location",Recruiting From Scratch,,"End-to-end System Design and Implementation: Gather training data; train, deploy, evaluate, and iteratively improve production-grade machine learning systems;…",Chicago,data scientist
Data Reporting Analyst,,"Northbrook, IL 60062",CVS Health,3.2,"2+ years experience working with data or business intelligence projects in an industry relevant to CVS Caremark (e.g., PBM, retail pharmacy, retail clinics, etc…",Chicago,data analyst
Technology Solutions: Senior Analyst (Data Privacy Business...,,"Chicago, IL",Golub Capital,3.4,"Maintain data inventory and data flow mapping.
The candidate will also review and uplift existing policies, procedures and standards regarding data privacy,…",Chicago,data analyst
"Senior Analyst, Retail Risk Portfolio Management & Reporting",,"Chicago, IL",BMO Harris Bank,3.5,Coordinates the management of databases; ensures alignment and integration of data in adherence with data governance standards.,Chicago,data analyst
Invest- Technical Business Analyst,,"Chicago, IL",M1 Holdings,,"Knowledge of SQL and/or data modeling and analysis tools.
Work on a team of business stakeholders to clearly define business requirements, functional models and…",Chicago,data analyst
"Senior Analyst, Data & Analytics",,"Chicago, IL 60607 (Near West Side area)",VMLY&R COMMERCE,,"Experience working with e-commerce sales data and digital tools preferred.
Visualize data and measurement outputs through PowerPoint presentations and…",Chicago,data analyst
Senior Merchandising Analyst -Space Management Analytics,,"Deerfield, IL 60015",WALGREENS,3.5,"Responsible for providing data, analysis, and recommendations to the space management team, key stakeholders, and leadership to maximize the productivity of the…",Chicago,data analyst
Business Analyst ( Healthcare ),,"Chicago, IL",KMM Technologies,2.8,"This may require the Business Analyst to research and analyze data in support of business functions, process knowledge, and systems requirements.",Chicago,data analyst
Business Analyst,,"Northbrook, IL 60062",Velvetech,,"Evaluating solutions: creating test plans, preparing test data, use cases description.
Future projects as highly loaded SaaS web-based services for automating…",Chicago,data analyst
Market And Buyer Intel Sr. Analyst,,"Chicago, IL+1 location",BDO,3.6,"Five (5) or more years of relevant market research and data analytics experience to help solve business problems or optimize market penetration, required.",Chicago,data analyst
Analyst - Gamma,,"Chicago, IL",Boston Consulting Group,4.2,"1+ years in the field of data management and/or data analysis.
Analyzes data (e.g. reports, surveys, products, market) leveraging data analytics tools with no…",Chicago,data analyst
Rcm Business Analyst - Remote,,"Tinley Park, IL•Remote","Baptist Health System, San Antonio, Texas",4.0,"Independent, logical thinker with ability to perform detailed data analysis.
BA/BS Preferred or 1-3 years equivalent experience in Healthcare Revenue Cycle.",Chicago,data analyst
Senior Marketing Analytics Analyst,,"Chicago, IL",BRAVIANT HOLDINGS,,We are seeking a hands-on data analyst with strong technical skills who enjoys analyzing large data sets to solve complex problems.,Chicago,data analyst
Senior Analyst - Digital & Marketing Product Management,,"Chicago, IL 60607 (West Loop Gate area)",WALGREENS,3.5,Bachelor’s degree and at least 3 years of experience with business analysis and/or reporting data OR a High School Diploma / GED and at least 6 years of…,Chicago,data analyst
Business Analyst,,"Chicago, IL 60602 (The Loop area)",Computershare,3.4,"Analysis of documents, data files, data mapping and design reviews.
Experience in reading and interpreting various data file types (XML, fixed width, structured…",Chicago,data analyst
"Senior Manager, Data & Analytics",,"Chicago, IL 60603 (The Loop area)",One Six Solutions,,Work with key clients on the delivery of technology based solutions in the area of both front end and back end data and analytics solutions.,Chicago,data analyst
Junior Algorithmic Trader,,"Chicago, IL",TransMarket Group,3.0,"Build and maintain trading quantitative model tools and analytics.
Develop expertise in market microstructure, tick data, and automated trading systems.",Chicago,data scientist
Machine Learning Infrastructure Engineer,,"Chicago, IL",Tempus,,"Comfortable working with scientists and researchers on machine learning applications.
Use your experience, deep technical knowledge, and creativity to simplify…",Chicago,data scientist
Machine Learning Engineer,,"Chicago, IL 60654 (Loop area)",CDL 1000 Inc.,,"Partner with data scientists and data engineers to build high-performance, efficient feature pipelines from backend data sources to train models and serve…",Chicago,data scientist
Client Success Zendesk Lead,,"Chicago, IL",M1 Finance,,"Comprehensive health, dental, vision, disability, and life insurance.
This will be accomplished by supporting day-to-day operations and establishing a strategic…",Chicago,data scientist
Senior Statistical Programmer,,"Chicago, IL•Remote work available","CTI Clinical Trial Services, Inc",3.9,Work with the lead statistician to manage projects to ensure statistical programming tasks are performed within the entire project timeline.,Chicago,data scientist
Software Engineer (Machine Learning Systems),,"Chicago, IL",Venmo,3.2,You will join the team that partners with data scientists and data engineers to transform machine learning models into algorithm-driven services.,Chicago,data scientist
"Data Engineer, Data & Analytics",,"Deerfield, IL 60015",Fortune Brands,4.3,"Create high quality certified data sources that analysts and data scientists will leverage to discover insights ultimately driving revenue, growth, and…",Chicago,data scientist
,,"Chicago, IL+1 location",Credera Experienced Hiring Job Board,,Our ideal candidate is excited about leading project-based teams in a client facing role to analyze large data sets to derive insights through machine learning …,Chicago,data scientist
,,"Chicago, IL•Remote",Nav,,"Familiarity with data science principles, Python, benchmarking, data standardization, data visualization, machine learning, and SQL.
401k and HSA Company Match.",Chicago,data scientist
Statistical Arbitrage Quant Analyst,,"Evanston, IL 60201 (Downtown area)•Temporarily Remote",Magnetar,,"Broad statistical toolkit including machine learning, econometrics, and non-parametric methods.
While working remotely, our employees can take advantage of…",Chicago,data scientist
"Sr Architect, Data & Analytics",,"Deerfield, IL 60015",Fortune Brands,4.3,"10+ years of experience with data & analytics toolsets, including data engineering and data management platforms.
Bachelor’s degree in IT or related discipline.",Chicago,data scientist
Head Algorithmic Trader - Interest Rates,,"Chicago, IL 60661 (Near West Side area)+1 location",Eagle Seven,,The Head Trader will be responsible for leveraging the firm’s proprietary technology to build and manage all aspects of the trading team’s operations.,Chicago,data scientist
Senior Algorithmic Trader,,"Chicago, IL",TransMarket Group,3.0,"Build and maintain trading quantitative model tools and analytics.
Develop expertise in market microstructure, tick data, and automated trading systems.",Chicago,data scientist
Otter.Ai | Speaker Identification Engineer,,"Chicago, IL 60601 (Loop area)+2 locations•Remote",Recruiting From Scratch,,"Receive the benefits of comprehensive health, dental, vision and disability insurance.
Familiarity with the state of the art in deep learning.",Chicago,data scientist
"Senior Software Engineer, Natural Language Processing / Nlp",,"Evanston, IL 60208+1 location",Recruiting From Scratch,,"End-to-end System Design and Implementation: Gather training data; train, deploy, evaluate, and iteratively improve production-grade machine learning systems;…",Chicago,data scientist
"Sr. Business Analyst, Post Sales & Strategy",,"Chicago, IL",Dyson,3.5,"Previous experience in an analyst role or comparable role required.
Superior attention to detail and accuracy.
4-5+ years of work experience.",Chicago,data analyst
Manager- Data & Analytics – Pharmacy Renewal,,"Deerfield, IL 60015+1 location",WALGREENS,3.5,"Experience drawing insights, trends and conclusions from data.
Bachelor's Degree and at least 2 years of experience in Data Analysis, Analytics, and/or Research…",Chicago,data analyst
"Senior Analyst, Business Intelligence",,"Chicago, IL 60606 (The Loop area)",Invenergy,3.5,"Understanding of data warehousing concepts and relational data models.
Build and maintain our data catalog to track enterprise data assets.",Chicago,data analyst
"Senior Financial Analyst, Physician Compensation",,"Evanston, IL 60201 (Central Street area)•Remote",NorthShore University HealthSystem,3.8,"Develop, maintain and analyze data as needed in support of physician compensation models.
Senior Financial Analyst, Physician Compensation - (80487).",Chicago,data analyst
Ediscovery Analyst,,"Chicago, IL 60604 (Loop area)",CACI,3.8,"Performs advanced tasks related to exporting data from LAW and Relativity databases, including identifying data for export, confirming redactions and other…",Chicago,data analyst
"Sr. Analyst, Front End (Clickstream)",,"Chicago, IL 60602 (The Loop area)","Grubhub Holdings, Inc.",3.2,"4+ years of experience as a data analyst.
You have deep experience building data products and systems around large volumes of structured web event data,…",Chicago,data analyst
Mergers & Acquisitions - Data Analytics Advisory Manager,,"Chicago, IL 60606 (The Loop area)",Deloitte,4.0,"Statistical methods in support of data analysis.
Analyze deal data for trends and outliers.
Demonstrated knowledge or advanced business analytics and data…",Chicago,data analyst
,,"Naperville, IL 60563","KeHE Distributors, LLC",3.0,"3-5 years of experience in an analytical role.
Applies expertise in data mining, quantitative analysis and data visualization to tell a compelling story behind…",Chicago,data analyst
Digital Marketing Analyst,,"Northbrook, IL 60062•Remote",Underwriters Laboratories Inc.,3.6,"UL offers a generous 401k matching structure of up to 5% of eligible pay.
The right candidate will have experience using Excel and SQL to analyze data from…",Chicago,data analyst
"Senior Analyst, Manufacturing Systems",,"Chicago, IL",Abbvie,4.0,"Understanding and promoting data governance, data reuse and good data management practices.
Uses appropriate tools to collect, correlate and analyze data;…",Chicago,data analyst
Pricing Analyst,,"Downers Grove, IL 60515•Remote work available",Elkay Manufacturing,3.3,"Must have data mining skills coupled with the ability to effectively summarize data.
Analyze data and provide recommendations for pricing strategy.",Chicago,data analyst
It Business Analyst,,"Downers Grove, IL 60515",Silgan,2.6,"In this crucial position, you’ll serve as a Project Lead, supporting the Closure’s division and ensuring that Silgan Closures gets maximum value from existing…",Chicago,data analyst
"Data Analyst, Field Operations",,"Naperville, IL",American Water,3.4,"7-10 years as a Strategy Analyst, Financial Analyst, or Financial reporting, planning and analysis • 5-7 years of experience using data analysis tools (SQL…",Chicago,data analyst
"Senior Analyst, Analytics",,"Chicago, IL",IPG Mediabrands,3.7,"Fluent in extracting and manipulating large data sets.
Create Dashboards using a variety of data visualization tools.",Chicago,data analyst
"Senior Analyst Supply Chain (Sql, R, Sas)",,"Deerfield, IL 60015",WALGREENS,3.5,"Experience working in supply chain in a data-focused role.
Performs complex analysis of information, problems, and/or data under limited supervision.",Chicago,data analyst
Junior Algorithmic Trader,,"Chicago, IL",TransMarket Group,3.0,"Build and maintain trading quantitative model tools and analytics.
Develop expertise in market microstructure, tick data, and automated trading systems.",Chicago,data scientist
Machine Learning Infrastructure Engineer,,"Chicago, IL",Tempus,,"Comfortable working with scientists and researchers on machine learning applications.
Use your experience, deep technical knowledge, and creativity to simplify…",Chicago,data scientist
Machine Learning Engineer,,"Chicago, IL 60654 (Loop area)",CDL 1000 Inc.,,"Partner with data scientists and data engineers to build high-performance, efficient feature pipelines from backend data sources to train models and serve…",Chicago,data scientist
Client Success Zendesk Lead,,"Chicago, IL",M1 Finance,,"Comprehensive health, dental, vision, disability, and life insurance.
This will be accomplished by supporting day-to-day operations and establishing a strategic…",Chicago,data scientist
Senior Statistical Programmer,,"Chicago, IL•Remote work available","CTI Clinical Trial Services, Inc",3.9,Work with the lead statistician to manage projects to ensure statistical programming tasks are performed within the entire project timeline.,Chicago,data scientist
Software Engineer (Machine Learning Systems),,"Chicago, IL",Venmo,3.2,You will join the team that partners with data scientists and data engineers to transform machine learning models into algorithm-driven services.,Chicago,data scientist
"Data Engineer, Data & Analytics",,"Deerfield, IL 60015",Fortune Brands,4.3,"Create high quality certified data sources that analysts and data scientists will leverage to discover insights ultimately driving revenue, growth, and…",Chicago,data scientist
,,"Chicago, IL+1 location",Credera Experienced Hiring Job Board,,Our ideal candidate is excited about leading project-based teams in a client facing role to analyze large data sets to derive insights through machine learning …,Chicago,data scientist
,,"Chicago, IL•Remote",Nav,,"Familiarity with data science principles, Python, benchmarking, data standardization, data visualization, machine learning, and SQL.
401k and HSA Company Match.",Chicago,data scientist
Statistical Arbitrage Quant Analyst,,"Evanston, IL 60201 (Downtown area)•Temporarily Remote",Magnetar,,"Broad statistical toolkit including machine learning, econometrics, and non-parametric methods.
While working remotely, our employees can take advantage of…",Chicago,data scientist
"Sr Architect, Data & Analytics",,"Deerfield, IL 60015",Fortune Brands,4.3,"10+ years of experience with data & analytics toolsets, including data engineering and data management platforms.
Bachelor’s degree in IT or related discipline.",Chicago,data scientist
Head Algorithmic Trader - Interest Rates,,"Chicago, IL 60661 (Near West Side area)+1 location",Eagle Seven,,The Head Trader will be responsible for leveraging the firm’s proprietary technology to build and manage all aspects of the trading team’s operations.,Chicago,data scientist
Senior Algorithmic Trader,,"Chicago, IL",TransMarket Group,3.0,"Build and maintain trading quantitative model tools and analytics.
Develop expertise in market microstructure, tick data, and automated trading systems.",Chicago,data scientist
Otter.Ai | Speaker Identification Engineer,,"Chicago, IL 60601 (Loop area)+2 locations•Remote",Recruiting From Scratch,,"Receive the benefits of comprehensive health, dental, vision and disability insurance.
Familiarity with the state of the art in deep learning.",Chicago,data scientist
"Senior Software Engineer, Natural Language Processing / Nlp",,"Evanston, IL 60208+1 location",Recruiting From Scratch,,"End-to-end System Design and Implementation: Gather training data; train, deploy, evaluate, and iteratively improve production-grade machine learning systems;…",Chicago,data scientist
Ecommerce Business Analyst,,"Chicago, IL 60606 (The Loop area)",Zones,2.8,"Greater than 5 years related BA experience and/or training.
We are looking for a business analyst who can work on the next generation customer facing…",Chicago,data analyst
Senior Analyst Innovation & Data,,"Chicago, IL 60607 (Near West Side area)",VMLY&R,3.8,"Extract data from various digital tools.
Manage data accuracy and integrity for client marketing programs.
Implement, collect, and analyze natural language data…",Chicago,data analyst
