title,salary,location,employer,employer_rating,summary,search_city,search_role
,"£18,000 - £22,000 a year",Rochdale OL16 5NA,Forrest Fresh Foods,,"Due to expansion Forrest Foods are looking to recruit a data analyst.
In the position you will help maintain company database, websites and publications with…",Manchester,data analyst
,,Salford M50 2EQ,BBC,4.2,"Understanding of media analytics, data, measurement, methodologies and industry standards including online and offline channels.",Manchester,data analyst
,,Salford M50,BBC,4.2,You will have a key role in gathering and analysing the data that helps our team to improve the performance of our products.,Manchester,data analyst
,"£32,306 - £39,027 a year",Salford M50,Northern Care Alliance NHS Foundation Trust...,,"Provide expert advice and support in the use of reporting systems, data analysis using advanced database, query language tools and report writing.",Manchester,data analyst
Data Analyst Placement (12 Months),"£17,908 a year",Manchester M20 2UR,Siemens,4.0,"Our products and services are helping customers deliver increasingly innovative products, in a batch size of one, to their customers at the same quality, cost…",Manchester,data analyst
,,Stockport SK2 6NG,Vitality,3.1,"Excellent IT skills and proficient in complex spreadsheets, analytical tools and reporting and data visualisation tools.",Manchester,data analyst
,,Manchester M2 4AW,Ridge Surveyors Limited,,"Developing inhouse best practice data management.
Managing energy data to inform sustainability strategies.
This role would particularly suit an individual with…",Manchester,data analyst
,"£27,000 - £35,000 a year",Manchester•Remote,Move Dance,,"Organising and analysing raw data to drive actionable insights.
Highly analytical with the ability to turn data into actionable results.",Manchester,data analyst
,"£41,000 a year",Manchester,Kalibrate,,"Statistical Analysis Skills such as Analyse/interpret data and present results using established methods, evaluating coverage and accuracy of data, prepare…",Manchester,data analyst
,"Up to £45,000 a year",Manchester•Remote,Citation,,Working in the group function you’ll be at the heart of the decision-making process for the business and will use innovative and varied techniques to ensure…,Manchester,data analyst
Transformation Analyst,,Manchester M1 3BN,Barclays,3.9,"Driving the documentation of business requirements, process flows, current vs future gap analysis, training documentation and data analysis.",Manchester,data analyst
Business Analyst,"£55,000 - £60,000 a year",Manchester•Remote,RSA,3.8,You can work independently and remain flexible and organised throughout projects in a fast paced environment and have the ability to establish/maintain high…,Manchester,data analyst
Data Analyst Apprentice,"£22,950 a year",Halifax,Lloyds Banking Group,3.8,"Over the duration of the programme, you’ll develop your capabilities as a data analyst, being taught how to collect, organise and study data to provide business…",Manchester,data analyst
,,Manchester,Ridge & Partners LLP,4.5,"Developing inhouse best practice data management.
Managing energy data to inform sustainability strategies.
This role would particularly suit an individual with…",Manchester,data analyst
,"£30,007 - £45,011 a year",Manchester Central•Remote,ICUC Social,,"High-speed internet connection (no data restrictions).
Must be able to demonstrate experience with social media tools & interact with online community tools…",Manchester,data analyst
Lead Data Scientist (Technical Lead And Team Lead),"£52,051 - £63,175 a year",Manchester,Home Office,,"Ideally you will have a background in working with big data challenges and cloud-based technologies, and you will have some knowledge of creating apps, APIs or…",Manchester,data scientist
Data Scientist,,Greater Manchester•Remote,Raytheon Intelligence & Space,,"The team includes post-doctorate researchers, experienced data scientists and engineers with customer knowledge, security research and machine learning…",Manchester,data scientist
,"Up to £75,000 a year",Manchester•Remote,Citation,,"The person will be well supported with data engineers and data leadership:
Understanding of MLOps and meta data stores.
Adaptable and positive, can-do attitude.",Manchester,data scientist
Data Scientist,"£35,847 - £70,467 a year",Salford M50•Temporarily Remote,Raytheon UK,3.9,"Working knowledge of Python and the wider data science toolkit such as Scikitlearn, Jupyter and other appropriate tools.
Job Types: Full-time, Permanent.",Manchester,data scientist
,"£34,000 - £45,000 a year",Manchester M14 7LU•Remote,The British Institute of Recruiters,,"Work with data and analytics experts to strive for greater functionality in our data systems.
Identify and document opportunities for the advancement of data…",Manchester,data scientist
Junior Data Scientist,,Manchester,THG,3.6,"Able to communicate effectively; using data to tell a story and drive business change.
Proficient in a data visualisation software (Tableau/Looker/PowerBI/etc).",Manchester,data scientist
Data & Analytics - Internship,"£21,500 a year",Manchester,NatWest Group,3.2,"And data science allows us to apply statistics, computer science and problem solving skills together with strong research methods to test, learn and optimise…",Manchester,data scientist
Data Scientist (Suitable For Fresh Graduates),,Manchester•Remote,Swiss Re,4.0,"Combine data science techniques with programming skills to unlock insights from the data provided by clients.
Enable business users to understand the data value…",Manchester,data scientist
Data Scientist,£550 - £600 a day,Manchester•Temporarily Remote,Uniting People,,"_Professional experience as a data scientist & related roles in Natural Language Processing_.
_Consult and collaborate with Clients to understand the data…",Manchester,data scientist
,"£39,334 - £45,865 a year",Buxton•Remote,Health & Safety Executive,3.9,"Previous experience as a text analyst, data scientist, or other similar role.
Have worked in a data science field for a minimum of two years.",Manchester,data scientist
Data Scientist,"£40,000 - £60,000 a year",Manchester M1,Street Group,,"Experience implementing data pipelines to extract, load, transform, enrich and export data for modelling.
Building models to create new and unique data features…",Manchester,data scientist
Data Scientist,,Manchester,Octopus Energy,4.0,"Our ideal data scientist would be an individual who loves to get to the bottom of complex problems, using novel techniques and visualisations to derive meaning…",Manchester,data scientist
,,Manchester M1•Remote,Peak AI,,"Familiarity with one or some of - statistical modelling, machine learning, data mining, unstructured data analytics, natural language processing.",Manchester,data scientist
Graduate Technology - Analytics Manchester Autumn 2022,,Manchester,KPMG,3.9,Our Analytics teams use advanced data analysis technologies and techniques to help our clients answer business questions and address commercial issues.,Manchester,data scientist
,"£50,000 - £75,000 a year",Altrincham•Temporarily Remote,Heywood Pension Technologies,,"Strong attention to detail regarding data; data quality; and scripting to ensure robust and grounded recommendations are made.
Temporarily due to COVID-19.",Manchester,data scientist
,,Manchester,Ridge & Partners LLP,4.5,"Developing inhouse best practice data management.
Managing energy data to inform sustainability strategies.
This role would particularly suit an individual with…",Manchester,data analyst
,"£30,007 - £45,011 a year",Manchester Central•Remote,ICUC Social,,"High-speed internet connection (no data restrictions).
Must be able to demonstrate experience with social media tools & interact with online community tools…",Manchester,data analyst
,"£40,057 - £45,839 a year",Manchester M13 9WL,Manchester University NHS Foundation Trust,3.1,They will be expected to conduct highly complex analysis of diverse data to inform and support the organisation to deliver its strategic vision.,Manchester,data analyst
Data & Analytics - Internship,"£21,500 a year",Manchester,NatWest Group,3.2,"And data science allows us to apply statistics, computer science and problem solving skills together with strong research methods to test, learn and optimise…",Manchester,data analyst
Information Analyst,"£25,655 - £31,534 a year",Bolton BL6 6PQ,North West Ambulance Service NHS Trust,2.9,"Within the Service the Business Intelligence function is a progressive and rapidly changing environment, in which the capabilities of the staff are being…",Manchester,data analyst
Pricing Data Analyst,"£30,000 - £36,000 a year",Manchester M60 0AG,Coop,3.4,"Experience of data analysis, data modelling and data reporting.
Strong Excel and data analysis skills.
Provide accurate data analysis to senior managers and the…",Manchester,data analyst
Mi Data Analyst With Power Bi,,Salford Quays,Bupa,3.3,"Working knowledge of Power BI and data visualisation skills, with good data mining, numerical and analytical ability, to understand, calculate and evaluate data…",Manchester,data analyst
Junior Data Analyst,"£25,000 a year",Manchester,Dovestone Technology Solutions,,"With this role, there is also a strong development pathway, with many previous junior’s progressing up the ranks to become a senior analyst or transitioning…",Manchester,data analyst
Data Analyst,,Manchester+1 location•Temporarily Remote,On the Beach,3.5,"Strong technical skills regarding data analysis and statistics.
Understanding data and providing ad hoc analysis from our primary web analytics tool, Google…",Manchester,data analyst
Business Insights & Analytics Analyst,,Manchester M1 3BN,Barclays,3.9,"Previous experience with statistics, math or data science.
Undertaking diagnostic activities to assess business requirements e.g. interviews, data collections…",Manchester,data analyst
,"£18,000 - £24,000 a year",Manchester,Restore,3.4,"Experience of data collation and trend analysis.
Analyse and interpret data to ensure a high level of accuracy.
Contract Type: Permanent - Full Time*.",Manchester,data analyst
Senior Data Analyst,,Manchester M1 3BN,Barclays,3.9,"Using data to understand customer journeys within Digital First Operations.
Sharing accurate data to support business stakeholders and meet regulatory…",Manchester,data analyst
Gis Data Analyst,,Manchester,Kalibrate,,"Statistical Analysis Skills such as Analyse/interpreting data and presenting results using established methods, evaluating of coverage and accuracy of data,…",Manchester,data analyst
Reconciliation And Reporting Analyst,,Manchester M1 3BN,Barclays,3.9,"Experience of data reporting design and specification, MI and reconciliation.
Liaising with stakeholders to drive the documentation of business requirements,…",Manchester,data analyst
,"£25,000 a year",Manchester•Remote,Touch Medical Media Services,,"Liaise with external partners who provide the raw data for analysis.
An innovative thinker who can identify the next steps to advance their work.",Manchester,data analyst
Data Scientist - Naimuri,,Manchester•Remote,QinetiQ,3.7,"You will work closely with customers, other data scientists, data architects and engineers, software developers and testers to:",Manchester,data scientist
,"£42,139 - £59,210 a year",Manchester•Temporarily Remote,Government Communications Headquarters (GCHQ),4.3,"A thorough understanding of exploratory data analysis, statistical reasoning, communicating about data, and data-driven decision making.",Manchester,data scientist
,"£25,000 - £30,000 a year",Manchester,Burns Sheehan,,You've built and implemented statistical models and you have ideas of where data science could be used to gain insight and yield significant uplifts in…,Manchester,data scientist
,,Manchester M1,Peak AI,,"Familiarity with one or some of - statistical modelling, machine learning, data mining, unstructured data analytics, natural language processing.",Manchester,data scientist
Data Scientist,,Manchester M2 4EW,Acuant Inc,,"Identify new predictive insights and features from a variety of data sources (3rd party providers, social and client data, etc.).",Manchester,data scientist
,,Manchester,INRIX,3.6,"Build data-driven products to enhance our.
Understanding of how to create effective visualisations from data.
Experience accessing and processing structured and…",Manchester,data scientist
Data Scientist,"£50,000 a year",Bolton,Axa,3.9,"This programme is designed to embed data-driven, intelligence-led decision-making into the culture and way of working in Claims to develop the Claims data asset…",Manchester,data scientist
Data Scientist,"£55,000 a year",Manchester M60,N Brown,2.9,"Contribute to an open, progressive and passionate data community.
Critically, a passion to do amazing things with data science in a collaborative environment.",Manchester,data scientist
Business Insights & Analytics Analyst,,Manchester M1 3BN,Barclays,3.9,"Previous experience with statistics, math or data science.
Undertaking diagnostic activities to assess business requirements e.g. interviews, data collections…",Manchester,data scientist
Senior Research Data Scientist,,Manchester,dunnhumby,3.8,"Basic coding skill and practical data analysis skills using e.g. Excel, R, Python.
Using big data, deep expertise and AI-driven platforms to decode the 21st…",Manchester,data scientist
Machine Learning Associate,,Manchester•Temporarily Remote,Cloud Imperium Games,,"Drive data collection and predictions while applying latest research and data techniques.
Integrate Machine Learning applications, toolkits libraries and…",Manchester,data scientist
,"£47,126 - £53,219 a year",Wythenshawe,Manchester University NHS Foundation Trust,3.1,"Capturing data from disparate systems and ensuring its integrity will be a key challenge.
In this senior role, you will drive the development and ongoing…",Manchester,data scientist
Data Scientist,,Manchester,Aldermore,,"Strong attention to detail regarding data, data quality and scripting to ensure robust and grounded recommendations are made.",Manchester,data scientist
Lectureship In Data Science And Earth And Environmental Anal...,"£42,149 - £51,799 a year",Manchester M13 9PL,The University of Manchester,4.2,"This includes a demonstrable understanding of core concepts in traditional and emerging machine learning, general computing and broader data science skillsets…",Manchester,data scientist
Decision Scientist,"£30,000 a year",Manchester M60,N Brown,2.9,"Being a data expert across multiple projects, assuring the quality of data used.
Building and integrate data analytics products.",Manchester,data scientist
Data Analyst,,Manchester M3•Remote,cinch cars Ltd,5.0,"You’ll use your experience and expertise to build out our intelligence-led, data-informed ethos, providing best-in-class data analytics to support our tribes…",Manchester,data analyst
,,Urmston M41 7RR,DARE2b,,"A strong experience using a variety of data analysis methods, data tools, ideally within a clothing Company.
You will work with cross functional teams in order…",Manchester,data analyst
Graduate Data Analyst,"£23,000 - £26,000 a year",North West•Remote,Graduate Recruitment Bureau,4.9,"Analysing data using various software (training will be provided).
They are looking for a graduate analyst to provide strategic recommendations based on insight…",Manchester,data analyst
,"From £25,000 a year",Stockport SK1 3SW•Temporarily Remote,musicMagpie,3.6,Work with behavioural researchers using tools such as Contentsquare and help to link musicMagpie’s various research tools together to improve the quality of…,Manchester,data analyst
,"£40,000 - £45,000 a year",Manchester•Remote,Newtons Recruitment,,"Support, motivate & develop students / data analysts.
Deliver online 1-1 coaching sessions.
Picture a job role where you can pass on your skills, knowledge &…",Manchester,data analyst
Business Analyst – Data Transformation,,Knutsford WA16 9EU,Barclays,3.9,Optimising and creating efficiencies in the processing of data today to ensure consistent consumption by business stakeholders and improved data quality.,Manchester,data analyst
Data Analyst - Myprotein,,Manchester,THG,3.6,You will be responsible for driving actionable business insights through data whilst managing data driven projects across the trading & marketing teams.,Manchester,data analyst
Senior Data Analyst - Editorial Analytics,,Salford M50 2EQ,BBC,4.2,"Be passionate about presenting data in new and interesting ways, using data visualisation tools such as Tableau.",Manchester,data analyst
Business Analyst Apprentice,"£22,950 - £29,835 a year",Halifax,Lloyds Banking Group,3.8,"We’re looking for innovative problem solvers, team players and people with an eye for detail who are keen to make an impact within banking and financial…",Manchester,data analyst
2022 Operations Campus Analyst Programme - Emea,,Manchester,BNY Mellon,3.5,"OCAP provides analysts with targeted on-the-job training designed to build knowledge, expertise and soft-skills to help grow a successful candidate into a…",Manchester,data analyst
Risk Analyst,"£30,000 - £40,000 a year",Manchester M12 6JH,Car Finance 247,3.0,"Prioritise and manage own workload in a fast-paced environment.
Our Risk Analyst will be responsible for coordinating the first line risk and control activity…",Manchester,data analyst
Hr Data Analyst,,Manchester,Lonza,3.5,"Analyze data using statistical methods.
Ability to generate data-driven insights.
Strong knowledge of HR data and Workforce Analytics.",Manchester,data analyst
Data Analyst,"£30,000 - £37,500 a year",Winsford North and East CW7 3RB•Temporarily Remote,InHealth,3.1,"Understanding of database systems, data models, data structures, and data quality metrics.
Support the validation of reference data and patient data load…",Manchester,data analyst
Trainee Data Analyst,"£24,000 - £26,000 a year",Manchester,Platinum Financial Recruitment,3.7,This is the ideal opportunity for you if you have 6-12 months experience in a data analytical role or have been working in an office-based position but have a…,Manchester,data analyst
,"£47,100 a year",Bolton BL5 1EE•Remote,Aldi,3.3,"This fast paced and exciting role delivers information to the entire ALDI business by ensuring high data quality, delivered in informative and creative reports.",Manchester,data analyst
Principal Data Scientist,"£47,126 - £53,219 a year",Wigan WN1 1XX,"Wrightington, Wigan and Leigh Teaching Hospitals...",,You will be a Data Champion – advocating the importance of leveraging data to deliver the highest quality of care for our patients.,Manchester,data scientist
,"£65,000 a year",Manchester•Temporarily Remote,Adria Solutions,,"Strong experience working within the data science field.
The Senior Data Scientist will have the following:
Experience programming in Python and SQL.",Manchester,data scientist
Data Scientist,,Stockport,CGA Strategy Ltd,4.2,"Create innovative solutions and maintain ongoing data exploratory analyses against internal and client-provided data to derive insights for custom projects,…",Manchester,data scientist
Data Analytics Engineer,,Manchester M3,Wejo,3.4,"Cleansing the data received to identify and investigate and erroneous data collection.
Check data quality control standards.",Manchester,data scientist
Lecturer In Mathematics Of Data Science,"£42,149 - £51,799 a year",Manchester M13 9PL,The University of Manchester,4.2,This post forms part of the larger recruitment of ten data science posts across the University during 2021-22 to grow the existing vibrant staff team.,Manchester,data scientist
"Consultant, Artificial Intelligence Engineer, Data & Analyti...",,Manchester,Deloitte,4.0,The role sits within Deloitte’s Data & Analytics Modernisation’s Machine Learning & Data Engineering team which is a group of data scientists and hybrid AI…,Manchester,data scientist
Senior Data Scientist,,Manchester+1 location•Temporarily Remote,On the Beach,3.5,"3+ years of experience working within the data science field.
Whether leveraging real-time analytics to drive decision making, propensity modelling, optimising…",Manchester,data scientist
Head Of Ai And Data Science,"£61,832 - £79,656 a year",Wilmslow,Information Commissioner's Office,3.1,"The ICO’s technology group deals with some of the most complex privacy, data rights, data protection and emerging technology issues that society faces.",Manchester,data scientist
Data Scientist,,Manchester M3,Wejo,3.4,"Propose new data structures and methodologies for manipulation of connected car data.
Once prepared data is in place you will then utilise and apply the…",Manchester,data scientist
,,Manchester M1,Peak AI,,"Use data gathered from stakeholders across the business to design data driven learning solutions.
You will develop best practices in L&D within the people team…",Manchester,data scientist
Senior Data Scientist,,Manchester,NatWest Group,3.2,"You’ll be managing and leading with multidisciplinary teams of data engineers, data scientists and analysts in project teams, coaching and leading as…",Manchester,data scientist
Senior Data Scientist (Manchester Based With Hybrid/Remote W...,"£60,000 - £70,000 a year",Manchester•Temporarily Remote,Talenting,,"Designing and administering data warehouses.
Data mining, and data analysis.
Creating, implementing, and managing data projects.",Manchester,data scientist
Machine Learning Associate,,Manchester•Temporarily Remote,Cloud Imperium Games,,"Drive data collection and predictions while applying latest research and data techniques.
Integrate Machine Learning applications, toolkits libraries and…",Manchester,data scientist
Lead Decision Scientist,"£60,000 a year",Manchester M60,N Brown,2.9,"Telling the story of the data, and building a plan for cleaning and managing it, engaging with appropriate stakeholders to permanently fix data problems.",Manchester,data scientist
Lead Data Scientist (Technical Lead And Team Lead),"£52,051 - £63,175 a year",Manchester,Home Office,,"Ideally you will have a background in working with big data challenges and cloud-based technologies, and you will have some knowledge of creating apps, APIs or…",Manchester,data scientist
,"£47,100 a year",Bolton BL5 1EE•Remote,Aldi,3.3,"This fast paced and exciting role delivers information to the entire ALDI business by ensuring high data quality, delivered in informative and creative reports.",Manchester,data analyst
Information Security Risk Analyst,"£27,000 - £35,000 a year",Manchester•Remote,cinch cars Ltd,5.0,"You will also be responsible for conducting risk analysis, creating risk models and developing mitigation or resolution plans – this will involve elements of…",Manchester,data analyst
Business Intelligence Information Analyst,"£25,655 - £31,534 a year",Bolton BL4 0JR,Bolton NHS Foundation Trust,3.7,"To investigate and analyse highly complex data with multiple, sensitive outcomes.
To provide advice to individual project teams on collecting, reporting,…",Manchester,data analyst
Junior Excel Data Analyst (Outside Ir35),£120 a day,Manchester•Temporarily Remote,IT Talent Solutions Ltd,,"*Part remote/Part onsite (2 days onsite in Warrington 3 days remote)*.
Our leading client are recruiting for a junior or mid-level Excel Developer or Excel Data…",Manchester,data analyst
Mi Analyst,"£41,000 a year",Manchester•Remote,GXO Logistics,1.9,"Use of SQL to extract/data mine.
Ability to manipulate data using SQL (ETL).
Analyse complex data from multiple sources and create meaningful analysis.",Manchester,data analyst
"Analyst, Reconciliation",,Manchester,BNY Mellon,3.5,"Responsible for assisting in the data analysis of reconciliations.
Assists in the creation of the data analysis conclusions, recommendations and updates to…",Manchester,data analyst
Intelligence Analyst,"£25,000 - £30,000 a year",Bolton•Temporarily Remote,BYDAND RECRUITMENT SERVICES,,"As such, the role involves assimilating data and report information whilst also developing an appreciation for other areas such as data protection.",Manchester,data analyst
Data Analytics Degree Apprentice Scheme - Level 6,"£15,074 a year",Salford,BBC,4.2,"And data mining, forecasting and modelling techniques to identify and predict trends and patterns in data.
Support confident and timely decisions, by learning…",Manchester,data analyst
Reporting Analyst,"£21,000 - £25,000 a year",Manchester M1•Remote,McCurrach,3.1,"Delivering bespoke client reports - ensuring high level of data accuracy and bringing reports to life.
Preparing and uploading questionnaires and briefs for…",Manchester,data analyst
Technical Data Analyst,"£30,000 a year",Manchester M60,N Brown,2.9,"Maintain the data dictionary and take the lead on data change assessments.
Carry out data discovery, model data structures and map processes to reflect existing…",Manchester,data analyst
,"£30,000 - £40,000 a year",Chorley PR7 7NA,Speed Medical,2.9,"At least 5 years’ experience as a data analyst for a large commercial organisation.
In depth data analysis and presentation to senior management.",Manchester,data analyst
Forecast Analyst,"£24,000 a year",Manchester M60,N Brown,2.9,"The ideal candidate will be highly analytical, with excellent Excel skills and ideally come from a merchandising or data analyst background.",Manchester,data analyst
,,Manchester,BT,3.7,"Use data analytics – provide data analytics expertise, identifying trends and sharing business insights across the team.
25 days annual leave + Bank holidays.",Manchester,data analyst
