title,salary,location,employer,employer_rating,summary,search_city,search_role
,"From £18,500 a year",Liverpool L3•Remote,Health Compare Ltd,,"Starting with gaining an understanding of how the whole system works, the role will focus initially on developing and maintaining the production environment to…",Liverpool,data analyst
,"£22,549 - £24,882 a year",Liverpool L13 1HD,Liverpool University Hospitals NHS Foundation...,,"The role is expected to d be able to analyse, update and report on the data held within the workforce systems for external, executive and operational purpose.",Liverpool,data analyst
Data Analyst,"£22,549 - £24,882 a year",Liverpool L3 4BL,Liverpool University Hospitals NHS Foundation...,,"And other data in word processing, spreadsheet, presentation and database applications.
Explaining complex data definitions in layman terms to a requester who…",Liverpool,data analyst
Graduate Data Analyst,"£23,000 - £26,000 a year",North West•Remote,Graduate Recruitment Bureau,4.9,"Analysing data using various software (training will be provided).
They are looking for a graduate analyst to provide strategic recommendations based on insight…",Liverpool,data analyst
Data Cleanse Analyst,,Liverpool,Tilney,3.7,"Analyse data from multiple sources to validate dimensions & impact of data quality issues.
Correct the data in our system by learning multiple process depending…",Liverpool,data analyst
,"£18,000 - £20,000 a year",Birkenhead CH41 1FN•Temporarily Remote,Rand Associates Consultancy Services Ltd,,"Set up new or follow existing processes within which data can be validated and amended where necessary, providing regular updates on progress and data accuracy.",Liverpool,data analyst
Text Analyst / Data Scientist (Band3/Seo),"£39,334 - £45,865 a year",Bootle,Health and Safety Executive,3.9,"Previous experience as a text analyst, data scientist, or other similar role.
Have worked in a data science field for a minimum of two years.",Liverpool,data analyst
Data Analyst,£400 - £450 a day,Liverpool,Uniting People,,"_Data profiling, data cleansing, and data enrichment skills through a variety of data sources, particularly SQL Server._.
Job Types: Full-time, Fixed term.",Liverpool,data analyst
,"£39,334 - £45,865 a year",Liverpool•Remote,Health & Safety Executive,3.9,"Previous experience as a text analyst, data scientist, or other similar role.
Have worked in a data science field for a minimum of two years.",Liverpool,data analyst
Data Analyst,,Chester•Remote,Sykes Cottages,3.3,"Ability to manipulate data using SQL.
Comfortable working with large data sets.
Implementing best practice for analytics and data management.",Liverpool,data analyst
,"£40,057 - £45,839 a year",St Helens WA10 3TP,St Helens and Knowsley Teaching Hospitals NHS...,4.0,"Utilise traditional data and wider resources including published literature, reports and locally held data sets to provide bespoke analysis and insight in…",Liverpool,data analyst
,,Liverpool,Liverpool School of Tropical Medicine,4.2,"Outstanding written and verbal communication of complex data.
Strong data management, analysis of trends, scenario modelling, analysis and interpretation.",Liverpool,data analyst
Qc Virology Analyst,,Liverpool L24 9JW,AstraZeneca,4.1,"You will have data analysis, review / approval authority as well inputting data for trending purposes, interpreting and escalating anomalies in data or…",Liverpool,data analyst
Graduate Business Intelligence Analyst - The Regenda Group,"£20,000 - £23,000 a year",Liverpool L1 5AY,Regenda Group,2.5,"You will play an integral role in shaping our data management and reporting systems, to help drive data driven decisions that help solve business critical…",Liverpool,data analyst
Performance Analyst - Research And Analysis (Graduates Welco...,"£30,000 a year",United Kingdom,Youturn,,Experience preparing and presenting data evaluation and performance monitoring briefings and data to partners would also be an advantage.,Liverpool,data analyst
Lead Data Scientist (Technical Lead And Team Lead),"£52,051 - £63,175 a year",Liverpool,Home Office,,"Ideally you will have a background in working with big data challenges and cloud-based technologies, and you will have some knowledge of creating apps, APIs or…",Liverpool,data scientist
,"From £18,500 a year",Liverpool+2 locations•Temporarily Remote,Scottishpower,3.8,"Working within one of our teams responsible for system or asset data, you’ll use data to find meaning and create actionable insights, identifying opportunities…",Liverpool,data scientist
Data Scientist,"£35,000 - £55,000 a year",United Kingdom•Remote,MarketFinance,4.7,"Experience with modern data tools and big data technologies (e.g. Azure).
Experience using Python, including the use of data manipulation, cleansing and data…",Liverpool,data scientist
Graduate Data Scientist,"£29,615 - £34,304 a year",Liverpool,University of Liverpool,4.1,"The Signal Processing Group, within the University of Liverpool manages a significant research portfolio funded by research councils, government and private…",Liverpool,data scientist
,"£39,334 - £45,865 a year",Liverpool•Remote,Health & Safety Executive,3.9,"Previous experience as a text analyst, data scientist, or other similar role.
Have worked in a data science field for a minimum of two years.",Liverpool,data scientist
Text Analyst / Data Scientist (Band3/Seo),"£39,334 - £45,865 a year",Bootle,Health and Safety Executive,3.9,"Previous experience as a text analyst, data scientist, or other similar role.
Have worked in a data science field for a minimum of two years.",Liverpool,data scientist
Principal Data Scientist,"£47,126 - £53,219 a year",Wigan WN1 1XX,"Wrightington, Wigan and Leigh Teaching Hospitals...",,You will be a Data Champion – advocating the importance of leveraging data to deliver the highest quality of care for our patients.,Liverpool,data scientist
Data Science Manager,,Liverpool L33 7SZ,Matalan,3.3,"Experience managing the data science project lifecycle.
Experience of leading a team of data scientists, with the ability to develop both the technical…",Liverpool,data scientist
Data Scientist - Legaltech,,Liverpool•Remote,Robert Walters,3.6,"Experience working with complex datasets and generalized understanding of data architecture.
This will see you working within the wider Business & Data…",Liverpool,data scientist
Graduate Data Analyst/Scientist,"£21,000 - £26,000 a year",Chester•Remote,Agility Resourcing,,"Ability to investigate data, find trends, forecast performance and provide insightful recommendations.
Your day to day will consist of…….",Liverpool,data scientist
Lecturer In Algorithmic Optimisation/Data Science/Machine Le...,"£42,149 - £53,348 a year",Liverpool,University of Liverpool,4.1,"Machine learning for materials data: Feature engineering and data analytics, data science for solid crystalline materials, novel types of data with symmetries,…",Liverpool,data scientist
Lecturer In Natural Language Processing And Information Retr...,"£42,149 - £53,348 a year",Liverpool,University of Liverpool,4.1,"We seek to appoint up to 2 highly motivated, research-focused individuals as Lecturers in Natural Language Processing (NLP) or Information Retrieval (IR) in the…",Liverpool,data scientist
Postdoctoral Research Associate In Machine Learning Of Agein...,"£35,327 - £40,928 a year",Liverpool,University of Liverpool,4.1,"Candidates should have a PhD and research experience in bioinformatics, genomics, systems biology or related fields.",Liverpool,data scientist
Data Science Manager,,Liverpool,EPAM Systems,3.8,"Lead a team of data scientists within a consulting practice.
Deliver data projects for clients in different industries.
Work with version control systems.",Liverpool,data scientist
Postdoctoral Research Associate In Machine Learning Applied...,"£35,327 - £40,928 a year",Liverpool,University of Liverpool,4.1,This position forms part of an interdisciplinary team working with computer scientists on the Engineering & Physical Sciences Research Council Programme Grant …,Liverpool,data scientist
Graduate Business Intelligence Analyst - The Regenda Group,"£20,000 - £23,000 a year",Liverpool L1 5AY,Regenda Group,2.5,"You will play an integral role in shaping our data management and reporting systems, to help drive data driven decisions that help solve business critical…",Liverpool,data analyst
Business Analyst (Ref: Pr2037),"£45,000 - £50,000 a year",Liverpool,Projentum,,"Expanding social housing organisation that are pursuing a major change agenda, which includes significant upgrades and enhancements to core systems and business…",Liverpool,data analyst
Data Analyst,"£19,800 - £23,000 a year",Chester,Adele Carr Recruitment,,"Interrogating warehouse data for accuracy.
Analysing various data sets to highlight key trends and issues.
Loading of various data sources that sit outside an…",Liverpool,data analyst
Business Analyst,"£30,000 - £35,000 a year",Liverpool,BYDAND RECRUITMENT SERVICES,,Previous Experience: Proven experience of business analysis practices; proficient in MS Word and MS Excel; project experience; experience of process mapping and…,Liverpool,data analyst
Data Analyst,"£30,000 - £37,500 a year",Winsford North and East CW7 3RB•Temporarily Remote,InHealth,3.1,"Understanding of database systems, data models, data structures, and data quality metrics.
Support the validation of reference data and patient data load…",Liverpool,data analyst
Senior Data Analyst,"£70,000 - £80,000 a year",England,Metrica Recruitment,,"Python experience of transforming data and building data pipelines.
Work with the team to understand their requirements, gather the data, clean the data, and…",Liverpool,data analyst
Information Analyst,"£25,655 - £31,534 a year",Bolton BL6 6PQ,North West Ambulance Service NHS Trust,2.9,"Within the Service the Business Intelligence function is a progressive and rapidly changing environment, in which the capabilities of the staff are being…",Liverpool,data analyst
Itil Analyst,,Chester,Bank of America,3.8,"Excellent reporting and data analysis skills.
Liaise with customers and stakeholders to ensure service is restored in a timely manner.",Liverpool,data analyst
Operations Business Analyst – Client Servicing Programmes,,Liverpool,Investec,4.2,Investec Wealth & Investment seeks to deliver exceptional levels of customer service and has been trusted to meet the needs of private investors for almost 200…,Liverpool,data analyst
Business Analyst,"£33,839 a year",Birkenhead,HM Land Registry,3.7,"Experience of requirements elicitation and definition, including modelling techniques (business/process/data).
HMLR - Digital, Data and Technology.",Liverpool,data analyst
Marketing Data And Insight Analyst,"£29,500 - £37,000 a year",Chester•Remote,Sykes Cottages,3.3,"Implement best practice for analytics and data management in compliance with relevant data regulations.
Extract data from the internal business database for…",Liverpool,data analyst
Business Data Analyst,,Chorley•Temporarily Remote,TVS Supply Chain Solutions,3.0,The data analyst and modelling will be of a quality that will support the production of solutions that add value to potential customers.,Liverpool,data analyst
Senior Bi Analyst,"£60,000 - £70,000 a year",England,Metrica Recruitment,,"SQL experience of querying data and building data pipelines.
Extensive data visualisation experience with Tableau.
Strong communication and presentation skills.",Liverpool,data analyst
,"£30,000 - £40,000 a year",Chorley PR7 7NA,Speed Medical,2.9,"At least 5 years’ experience as a data analyst for a large commercial organisation.
In depth data analysis and presentation to senior management.",Liverpool,data analyst
"Senior Information Analyst, Odu","£32,306 - £39,027 a year",St. Asaph LL17 0RS,Welsh Ambulance Service NHS Trust,3.3,"The Senior Information Analyst is responsible for the production of timely, accurate and intelligent business intelligence and information to inform the…",Liverpool,data analyst
Senior Data Scientist,,Liverpool,EPAM Systems,3.8,"Provide unique insights from large volumes of data.
Tell stories back to the business through stunning data visualisation.
Work with version control systems.",Liverpool,data scientist
Data And Analytics Technology Consultant (Gcp),,Liverpool,EPAM Systems,3.8,This position requires a strong Data/GCP technical consulting background with the ability to assist clients in defining their overall technology strategy and…,Liverpool,data scientist
Senior Data Scientist,,Liverpool,The Very Group,3.9,"We are looking for a senior data scientist who designed and implemented end to end forecasting workflow in the past.
Proactively trying to solve blockers.",Liverpool,data scientist
Computational Scientist In Extreme Scale Computing And Ai,"£31,931 - £34,709 a year",Warrington,Science and Technology Facilities Council (STFC),3.9,"Learning and applying HPC, data centric, analytics and AI technologies.
The continuing success of the Hartree Centre means we are looking to recruit hardworking…",Liverpool,data scientist
Graduate Computer/Data Scientist,,Birchwood,Jacobs,3.9,"On-the-job training, with opportunities to develop wider technical and project delivery skills by working alongside experienced professionals.",Liverpool,data scientist
,"From £33,000 a year",Chester CH4 9QR•Remote,Firstdot UK Ltd,,"Perform, plan and co-ordinate the following for complex studies: (i) the programming, testing, and documentation of statistical programs for use in creating…",Liverpool,data scientist
,"Up to £78,000 a year",Central and Westminster•Remote,Air Recruitment,,"Effective at managing big data projects.
Strong familiarity with data science and key machine learning techniques.
Job Types: Full-time, Permanent.",Liverpool,data scientist
Business Analyst And Programme Manager,"£31,346 - £33,782 a year",Bootle L30 4YD,Merseyside Fire and Rescue Service,4.1,"Lead on projects and develop full-scale supporting project plans.
Undertake research and make recommendations on bought-in software applications and services.",Liverpool,data analyst
Data Analyst,"£35,000 a year",Chester•Remote,Asset Resourcing,,"Ability to manipulate data using SQL.
Comfortable working with large data sets.
Highly proficient in Microsoft Excel.
Experience of working with Tableau.",Liverpool,data analyst
Data Protection Analyst,,Liverpool,Search Consultancy,3.4,"Support data protection training and awareness initiatives across the business.
Provide considered and practical advice to the business on data protection…",Liverpool,data analyst
Bi Analyst,"From £28,000 a year",Warrington WA3 6BA,Kleen - Tex Industries Ltd,,"Experience in large datasets; data manipulation; data modelling, analysing and visualising data.
Direct experience of working with an ERP system with skills in…",Liverpool,data analyst
Pricing & Data Analyst,,Cheshire,Amber Car Leasing,,"Analyse, manipulate and interpret the data to provide the best pricing.
A keen interest and knowledge of motor vehicles is preferred but not essential together…",Liverpool,data analyst
Business Analyst,,Liverpool,BDO,3.6,"Analyse available data to create suggestions on moving forward.
Gather data to enable understanding, analysis and documentation of business processes.",Liverpool,data analyst
Senior Business Analyst,"£38,552 - £40,861 a year",Birkenhead,HM Land Registry,3.7,"Experience of requirements elicitation and definition, including modelling techniques (business/process/data).
HMLR - Digital, Data and Technology.",Liverpool,data analyst
Finance Data Analyst,"£31,000 - £37,000 a year",Liverpool,Accountable Recruitment,,"Streamline current reporting processes and assist in data automation.
This role is assigned to their Liverpool office and is currently operating in a hybrid…",Liverpool,data analyst
Customer Insight Analyst,"£60,000 a year",Liverpool,ShortList,,You will be working with key stakeholders on challenges facing the business and provide quantitative analysis from multiple data sources.,Liverpool,data analyst
,,Haydock,Speedy Hire PLC,3.1,"As the Commercial Data Analyst, you will have a focus on commerciality and would be responsible for producing, interpret and analyse standard reports that…",Liverpool,data analyst
Specialist Business Intelligence Analyst,"£40,057 - £45,839 a year",St Helens WA10 3HG,St Helens and Knowsley Teaching Hospitals NHS...,4.0,"This will involve running data quality checks and producing new data quality reports.
This role will be responsible for managing data extraction, data provision…",Liverpool,data analyst
Business Analyst (Commercial),,Liverpool,Princes,3.8,"Sound understanding and management of associated business data.
Prepare test data and conduct thorough testing of processes.",Liverpool,data analyst
Business Intelligence Information Analyst,"£25,655 - £31,534 a year",Bolton BL4 0JR,Bolton NHS Foundation Trust,3.7,"To investigate and analyse highly complex data with multiple, sensitive outcomes.
To provide advice to individual project teams on collecting, reporting,…",Liverpool,data analyst
,"£32,306 - £39,027 a year",Wigan WN1 1XX,"Wrightington, Wigan and Leigh Teaching Hospitals...",,"Qlik or azure data factory would be an advantage.
Knowledge of health informatics and NHS data structures is desirable.",Liverpool,data analyst
Performance Analyst - Research And Analysis (Graduates Welco...,"£30,000 a year",United Kingdom,Youturn,,Experience preparing and presenting data evaluation and performance monitoring briefings and data to partners would also be an advantage.,Liverpool,data analyst
Data Scientist - Legaltech,,Liverpool•Remote,Robert Walters,3.6,"Experience working with complex datasets and generalized understanding of data architecture.
This will see you working within the wider Business & Data…",Liverpool,data scientist
Graduate Data Analyst/Scientist,"£21,000 - £26,000 a year",Chester•Remote,Agility Resourcing,,"Ability to investigate data, find trends, forecast performance and provide insightful recommendations.
Your day to day will consist of…….",Liverpool,data scientist
Lecturer In Algorithmic Optimisation/Data Science/Machine Le...,"£42,149 - £53,348 a year",Liverpool,University of Liverpool,4.1,"Machine learning for materials data: Feature engineering and data analytics, data science for solid crystalline materials, novel types of data with symmetries,…",Liverpool,data scientist
Lecturer In Natural Language Processing And Information Retr...,"£42,149 - £53,348 a year",Liverpool,University of Liverpool,4.1,"We seek to appoint up to 2 highly motivated, research-focused individuals as Lecturers in Natural Language Processing (NLP) or Information Retrieval (IR) in the…",Liverpool,data scientist
Postdoctoral Research Associate In Machine Learning Of Agein...,"£35,327 - £40,928 a year",Liverpool,University of Liverpool,4.1,"Candidates should have a PhD and research experience in bioinformatics, genomics, systems biology or related fields.",Liverpool,data scientist
Data Science Manager,,Liverpool,EPAM Systems,3.8,"Lead a team of data scientists within a consulting practice.
Deliver data projects for clients in different industries.
Work with version control systems.",Liverpool,data scientist
Postdoctoral Research Associate In Machine Learning Applied...,"£35,327 - £40,928 a year",Liverpool,University of Liverpool,4.1,This position forms part of an interdisciplinary team working with computer scientists on the Engineering & Physical Sciences Research Council Programme Grant …,Liverpool,data scientist
Data Scientist,"£35,000 - £55,000 a year",United Kingdom•Remote,MarketFinance,4.7,"Experience with modern data tools and big data technologies (e.g. Azure).
Experience using Python, including the use of data manipulation, cleansing and data…",Liverpool,data scientist
Senior Data Scientist,,Liverpool,EPAM Systems,3.8,"Provide unique insights from large volumes of data.
Tell stories back to the business through stunning data visualisation.
Work with version control systems.",Liverpool,data scientist
Data And Analytics Technology Consultant (Gcp),,Liverpool,EPAM Systems,3.8,This position requires a strong Data/GCP technical consulting background with the ability to assist clients in defining their overall technology strategy and…,Liverpool,data scientist
Senior Data Scientist,,Liverpool,The Very Group,3.9,"We are looking for a senior data scientist who designed and implemented end to end forecasting workflow in the past.
Proactively trying to solve blockers.",Liverpool,data scientist
Computational Scientist In Extreme Scale Computing And Ai,"£31,931 - £34,709 a year",Warrington,Science and Technology Facilities Council (STFC),3.9,"Learning and applying HPC, data centric, analytics and AI technologies.
The continuing success of the Hartree Centre means we are looking to recruit hardworking…",Liverpool,data scientist
Graduate Computer/Data Scientist,,Birchwood,Jacobs,3.9,"On-the-job training, with opportunities to develop wider technical and project delivery skills by working alongside experienced professionals.",Liverpool,data scientist
,"From £33,000 a year",Chester CH4 9QR•Remote,Firstdot UK Ltd,,"Perform, plan and co-ordinate the following for complex studies: (i) the programming, testing, and documentation of statistical programs for use in creating…",Liverpool,data scientist
,"Up to £78,000 a year",Central and Westminster•Remote,Air Recruitment,,"Effective at managing big data projects.
Strong familiarity with data science and key machine learning techniques.
Job Types: Full-time, Permanent.",Liverpool,data scientist
,"£32,306 - £39,027 a year",Wigan WN1 1XX,"Wrightington, Wigan and Leigh Teaching Hospitals...",,"Qlik or azure data factory would be an advantage.
Knowledge of health informatics and NHS data structures is desirable.",Liverpool,data analyst
,"£25,000 a year",Liverpool•Remote,Momentum Security Recruitment,,"Understanding of data creation and manipulation for testing.
Generate the necessary test data for different stages of testing.
Job Types: Full-time, Permanent.",Liverpool,data analyst
Marketing Data Analyst,"Up to £37,000 a year",Chester•Remote,Sykes Cottages,3.3,"Mentor and manage workload of sandwich year data analyst.
They must have s*trong experience using a variety of data mining/data analysis methods, using data…",Liverpool,data analyst
,,Warrington,United Utilities,3.8,"Develop, creates and updates critical project documentation for the impacted business areas so that the business can understand the impact to their people,…",Liverpool,data analyst
,,Wigan WN5 0LZ,Arrow XL,2.8,"Continually look for ways to adapt and improve the data set, potentially using alternative sources to speed up and enhance data analysis.",Liverpool,data analyst
Junior Bi Developer,"£23,000 - £33,000 a year",Chester•Remote,Sykes Cottages,3.3,"Sharing and promoting of good data practices and data-driven culture.
Previous SQL Server data warehousing development experience.
Solid foundations on T-SQL.",Liverpool,data analyst
Ssc Assistant - Data Analytics,,Liverpool,BDO,3.6,"Provide comprehensive feedback to audit teams on data quality and procedures.
Drive and ambition to work in the field of data analytics.",Liverpool,data analyst
Business Analyst,,Liverpool,ServiceSource,3.4,"The ability to analyze and/or report from highly complex data from multiple data sources.
You will receive mentorship on highly complex issues from more senior…",Liverpool,data analyst
Performance Analytics Senior Analyst,"£28,332 - £36,770 a year",Chester,Lloyds Banking Group,3.8,"Maximising the value of group data, analytical capability, and toolsets.
An understanding of Balance Sheet / P&L data and drivers of P&L performance.",Liverpool,data analyst
Graduate Data Analyst/Scientist,"£21,000 - £26,000 a year",Chester•Remote,Agility Resourcing,,"Ability to investigate data, find trends, forecast performance and provide insightful recommendations.
Your day to day will consist of…….",Liverpool,data analyst
Marketing Data Analyst,"£30,000 - £38,000 a year",Chester CH1,Ikhoi Recruitment,,"Implement best practice for analytics and data management in compliance with relevant data regulations.
Extract data from the internal business database for…",Liverpool,data analyst
Business Intelligence Manager - The Regenda Group,"£45,000 a year",Liverpool L1 5AY,Regenda Group,2.5,We're looking for an expert in business intelligence with proven experience in data engineering and analysis to develop and deliver new data management…,Liverpool,data analyst
,"£30,000 a year",Merseyside,Langley James IT Recruitment,,"You’ll be able to demonstrate an ability to work with non-technical stakeholders in regards to technical projects, experience of analysing data to help draw…",Liverpool,data analyst
Data Analyst,"£35,000 a year",Chester CH1 3BQ,Cubiq Recruitment,,"Ability to manipulate data using SQL.
Comfortable working with large data sets.
Implementing best practices for analytics and data management.",Liverpool,data analyst
Commercial Data Analyst,"£27,000 - £35,000 a year",St Helens,Paul Boardman Associates,,"They wish to appoint a Commercial Data Analyst (Excel Guru) to join their growing team.*.
Supporting the Sales teams with quotes and pricing.",Liverpool,data analyst
Data Scientist - Legaltech,,Liverpool•Remote,Robert Walters,3.6,"Experience working with complex datasets and generalized understanding of data architecture.
An exciting opportunity for an experienced Data Scientist has…",Liverpool,data scientist
