title,salary,location,employer,employer_rating,summary,search_city,search_role
,"£27,000 - £35,000 a year",Leeds LS14 6UF,TPP Retail Group,,"Be comfortable in a fast paced environment and meet/manage deadlines (internal and external).
You need to be able to spot patterns in data, use reports to find…",Leeds,data analyst
Data Analyst,"Up to £35,000 a year",Harrogate HG1 1JD,Jigsaw Insurance Services Plc,,"You must be an experienced data analyst with recent work experience, who is proactive and self-motivated with the ability to work well under pressure by…",Leeds,data analyst
Junior Data Analyst,,Leeds LS1•Temporarily Remote,SikSilk,,"Providing reports and templates to assist with ongoing data management.
You will be responsible for the delivery of all digital product information, maintenance…",Leeds,data analyst
Data Analyst Apprentice,"£22,950 a year",Halifax,Lloyds Banking Group,3.8,"Over the duration of the programme, you’ll develop your capabilities as a data analyst, being taught how to collect, organise and study data to provide business…",Leeds,data analyst
,,Leeds LS7 2AA,Nobia UK,2.6,You’ll have excellent communication skills with the ability to translate complex data into meaningful and understandable information.,Leeds,data analyst
Data Analyst,"£34,304 - £40,927 a year",Leeds,University of Leeds,4.3,"You will have responsibility for developing data requirements, contributing to the data dictionary, business data catalogue and data quality profiling and…",Leeds,data analyst
Data Analyst Apprentice,,Leeds,Jet2.com and Jet2holidays,3.4,"A passion for the customer insight and using data to drive performance.
You will be enrolled on to the Level 4 Data Analyst Apprenticeship, where you will…",Leeds,data analyst
,,Leeds LS11 5AD,ASDA,3.4,"Key responsibilities include supporting key online projects, managing the availability of products through the website, developing new supply chain processes,…",Leeds,data analyst
Data Analyst,"£28,248 - £30,815 a year",Bradford,Christians Against Poverty,4.5,"The Data Insight Analyst is passionate about the role of data to inform both operations and strategy.
The Supporter Insight & Data team equips the Fundraising…",Leeds,data analyst
,"£45,000 - £85,000 a year",Leeds•Remote,Estio Training,3.5,"Coaching, supporting and mentoring all apprentices to ensure they have acquired the technical skills and knowledge to achieve the standard requirements through…",Leeds,data analyst
,"£39,334 - £45,865 a year",Leeds•Remote,Health & Safety Executive,3.9,"Previous experience as a text analyst, data scientist, or other similar role.
Have worked in a data science field for a minimum of two years.",Leeds,data analyst
,,Leeds,O2 Telefonica,3.6,"Analyse data and report on the performance of services, including partner performance and identify issues and trends.
Data analysis, assessment and monitoring.",Leeds,data analyst
Business Analyst Apprentice,"£22,950 - £29,835 a year",Halifax,Lloyds Banking Group,3.8,"We’re looking for innovative problem solvers, team players and people with an eye for detail who are keen to make an impact within banking and financial…",Leeds,data analyst
Data Analyst,,Leeds,QBE,3.6,"Deliver data analysis to support business requirement definition and governance compliance.
Support the design, development and implementation of fit-for…",Leeds,data analyst
Data Analyst,"£25,000 - £30,000 a year",Bradford•Remote,Anchor,,"Be proficient in the use and management of complex relational databases with excellent analytical and numerical skills, and ability to critically examine data…",Leeds,data analyst
,"£38,481 - £48,101 a year",Bradford,Yorkshire Water,3.9,"Responsible for advancing the company’s understanding of performance, assets, customers & risk via data-driven insights.",Leeds,data scientist
,"£39,334 - £45,865 a year",Leeds•Remote,Health & Safety Executive,3.9,"Previous experience as a text analyst, data scientist, or other similar role.
Have worked in a data science field for a minimum of two years.",Leeds,data scientist
,,Leeds,Direct Line Group,3.4,"This is an ideal role for someone keen to develop a career in a fast-paced data driven environment.
Driving development of fraud mitigation strategies in…",Leeds,data scientist
Data Scientist (Ktp Associate),"£33,667 a year",Bradford,University of Bradford,3.9,The main purpose of this project is to embed within Incommunities an ethical data-driven business culture adopting an Artificial Intelligence (AI) based…,Leeds,data scientist
Data Analyst Graduate,"£27,000 a year",Leeds,Hermes,2.4,"Keep up to date with trends in data science, learning, sharing new skills and methods.
You’ll collaborate with stakeholders across the business and IT to solve…",Leeds,data scientist
Senior Data Scientist,,Leeds,Avnet,3.8,"Practical experience of large-scale data manipulation, transformation and enrichment for identifying value in data.",Leeds,data scientist
,,Wetherby LS23,Easysoft Ltd,,"Design, develop, implement and maintain data models.
Access technologies – extract and pre-process data for populating models.
Ability to stick to deadlines.",Leeds,data scientist
Data Science Personalisation Analyst,,Leeds LS11 5AD,ASDA,3.4,"Be confident extracting, querying and manipulating data from multiple sources; and working with data engineers to define requirements for data pipelines.",Leeds,data scientist
,"£44,131 - £65,377 a year",Bradford,Yorkshire Water,3.9,"Be confident engineering data, manipulating it and building pipeline practices.
We would like you to have substantial statistical, analytical and data science…",Leeds,data scientist
Trials / Clinical Manager,£600 - £650 a day,Leeds LS1 4AW•Remote,Gios technologies,,"Discovery work to assess if NHS Digital data can be considered as source data for clinical trials.
Discovery/delivery of development of CT contracts which…",Leeds,data scientist
Lead Data Scientist,,York,Hiscox,3.6,"Optimising operational activities using data.
Experience of implementing a data science approach including a working knowledge of machine learning algorithms.",Leeds,data scientist
Supply Chain Specialist - Data Science,,West Yorkshire,WM Morrisons Supermarkets,3.3,"Supporting the data science team with data and basic modelling tasks including:
Creating data visualisations and possessing an understanding of how to display…",Leeds,data scientist
Data Science Personalisation Manager,,Leeds LS11 5AD,ASDA,3.4,"Be confident extracting, querying and manipulating data from multiple sources; and working with data engineers to define requirements for data pipelines.",Leeds,data scientist
Data Scientist,"£50,000 - £60,000 a year",Leeds,Harnham,4.6,"As a Data Scientist, you will be an instrumental figure within the business designing key models using R or Python to help support the CRM team and predict…",Leeds,data scientist
Data Scientist,,York,Hiscox,3.6,"Work collaboratively with data scientists, data engineers and other technical people including pricing teams in order to help support maturation of analytics…",Leeds,data scientist
Data Analyst Graduate,"£27,000 a year",Leeds,Hermes,2.4,"Keep up to date with trends in data science, learning, sharing new skills and methods.
You’ll collaborate with stakeholders across the business and IT to solve…",Leeds,data analyst
Data Analyst,,Leeds LS27 0DQ,ASDA,3.4,"Strong data visualisation skills and an understanding of data processing is critical.
At the heart of this are our data analytics teams who provide actionable…",Leeds,data analyst
,"£21,500 - £23,000 a year",Leeds LS1,Ecorys,4.3,"This includes developing research questions and analysis plans, designing and implementing data collection (e.g. surveys), and undertaking statistical analysis …",Leeds,data analyst
,,Leeds LS11 5AD,ASDA,3.4,"You won't need to be overly technical, but a good understanding of current technology will be required with the ability to work closely with IT Programme and…",Leeds,data analyst
,"£18,000 - £21,000 a year",Leeds LS10 1AD,ERS Medical Limited,2.2,"Analyse the data being produced.
Understand cost implications of activity data.
Analyse data from new contracts on a monthly, 6 monthly and annual basis, to…",Leeds,data analyst
Commercial Data Analyst,,Leeds LS7 2AA,Magnet,3.4,You’ll have an analytical mindset with excellent Microsoft skills including excel and able to turn data and reports into a creative and simple way.,Leeds,data analyst
Supply Chain Analyst,,Leeds LS11 5AD,ASDA,3.4,"Category demand planning and data analysis to ensure ongoing Forecast Accuracy.
You'll have experience of, or a passion for analyzing large amounts of data.",Leeds,data analyst
,"£40,057 - £45,839 a year",Leeds LS2,NHS England and NHS Improvement,3.0,"Provide access to a single, shared view of data for systems and their stakeholders and highlight areas that warrant further examination in order to improve…",Leeds,data analyst
"Data Analyst (Leeds, Manchester Or Bristol Office- Flexible...",,Leeds LS1 2ND•Remote,DAC Beachcroft,3.4,"Create data dashboards, graphs and visualisations.
Working with colleagues to develop innovative analytics solutions, implement new intelligence processes and…",Leeds,data analyst
Airline Revenue Analyst,,Leeds,Jet2.com and Jet2holidays,3.4,"This role is data driven – key responsibilities include analysing sales, identifying trends and forecasting future demand, and you will utilise a host of…",Leeds,data analyst
Business Data Analyst,£375 - £400 a day,Leeds•Temporarily Remote,Uniting People,,"Acquiring data from primary or secondary data sources and maintaining databases.
The business data analyst should also be responsible for improving the existing…",Leeds,data analyst
,"£18,933 - £19,698 a year",Leeds LS2 7DJ,North Yorkshire County Council,3.4,"Extract data from datasets, then undertake data analysis and interpretation.
Data analysis, architecture and data cleansing.",Leeds,data analyst
Sas / Data Analyst,£250 - £295 a day,Leeds•Remote,GIOS Tech,,"Processing data using software such as Python, R or Hadoop.
Expertise with data management, optimisation, process design; code development (using languages such…",Leeds,data analyst
Junior / Graduate Pricing Analyst,,Leeds,UK General Insurance,4.4,"You will have daily exposure to multiple personal lines products and the opportunity to participate in pricing reviews, assisting the pricing team with data…",Leeds,data analyst
Timetabling Officer & Data Analyst,,Calderdale,Ryburn Valley High School,3.8,Working with the Senior Leadership Team you will be responsible for the management of data and the management information system.,Leeds,data analyst
Technology Principal - Data And Analytics,,Leeds,Version 1,4.1,"Your CV shows technology leadership in the definition of best practices & repeatable methodologies in Data Engineering (including Data Storage, ETL, Data…",Leeds,data scientist
Data Science Graduate,"£25,000 a year",Leeds,Hermes,2.4,"Keep up to date with trends in data science, learning, sharing new skills and methods.
You will be part of the Office of the CIO where you will have the…",Leeds,data scientist
,"£40,927 - £50,296 a year",University of York,University of York,4.2,"Examples of your expertise might include, but are not limited to: the design, development or analysis of data-driven media experiences (e.g. recommender systems…",Leeds,data scientist
Machine Learning Engineer,,York,Hiscox,3.6,"A robust understanding of core data engineering topics – ETL vs ELT, structured and unstructured data, data quality and data governance.",Leeds,data scientist
Analytics Manager,"£55,000 - £65,000 a year",Leeds,Marks Sattin,3.6,"3+ years working with data and a strong idea on data transformation.
Experience of building data/analytical models.
Strong Microsoft Excel skills is a must.",Leeds,data scientist
Data Scientist,"£40,000 - £50,000 a year",Leeds•Remote,Nigel Frank International Limited,2.9,"Exposure to analysing sales data.
Ideally Power BI reporting or similar data visualisation background.
You won't need to do much data engineering work as they…",Leeds,data scientist
Fraud Analytics Manager,"£40,000 - £50,000 a year",Leeds,IPS Group,3.6,You will have 4 direct reports who will all work within fraud analytics from graduate level to experienced data scientists.,Leeds,data scientist
Senior People Analytics Specialist - Corporate L&D,"£45,000 - £60,000 a year",York,Nestlé,4.2,Demonstrated experience of successfully translating data into insights and excel in connecting with external environment and translating implications for people…,Leeds,data scientist
Operations Intelligence Graduate,"£25,000 a year",Leeds,Hermes,2.4,"They maintain all the data and systems that are key to the operation functioning day to day.
You will complete 4 x 6 month placements spending time in each of…",Leeds,data scientist
Data Scientist/Machine Learning Engineer,,Leeds,Musiio,,"Investigate and asses new techniques for processing and understanding audio data.
Musiio launched in 2018, creating technologies that enable the Music Industry…",Leeds,data scientist
Analytics Manager,"£50,000 - £55,000 a year",Morley,Hermes,2.4,"3+ years working with data and a strong idea on data transformation.
Experience of building data/analytical models.
Strong Microsoft Excel skills is a must.",Leeds,data scientist
Ai/Machine Learning Developer / Data Scientist,,Leeds•Temporarily Remote,CRISP,,"Understanding the underlying nature of our data and how best to design systems around it.
Applying the latest technologies to our data in order to create…",Leeds,data scientist
Data Scientist/ Senior Modelling Analyst,"£55,000 - £55,001 a year",Huddersfield,Oscar Technology,3.9,"Ensure that data from all sources are stored correctly allowing easy access for current needs as well as future use.
Salary - Up to £55,000 plus 10% bonus.",Leeds,data scientist
Senior Data Scientist,"£70,000 - £80,000 a year",United Kingdom,Metrica Recruitment,,"You will be involved in the data-mining, machine learning and graph analysis techniques for a variety of modelling problems involving customers, their…",Leeds,data scientist
Lecturer In Machine Learning For Chemistry,"£40,927 - £50,296 a year",University of York,University of York,4.2,"Specialist knowledge of applying machine learning / big data approaches to chemical problems.
They should have a strong background in chemistry but be advancing…",Leeds,data scientist
Junior / Graduate Pricing Analyst,,Leeds,UK General Insurance,4.4,"You will have daily exposure to multiple personal lines products and the opportunity to participate in pricing reviews, assisting the pricing team with data…",Leeds,data analyst
Timetabling Officer & Data Analyst,,Calderdale,Ryburn Valley High School,3.8,Working with the Senior Leadership Team you will be responsible for the management of data and the management information system.,Leeds,data analyst
,"£35,000 - £40,000 a year",Leeds,Pure Retirement,2.5,"Understanding of Data warehousing and been involved in projects to building data warehouse capabilities.
37.5 hours per week (hours of work will be flexible and…",Leeds,data analyst
,,Leeds,FDM Group,2.9,As an FDM Business Intelligence Analyst you will use your investigative and problem-solving skills to analyse data and uncover trends that deliver actionable…,Leeds,data analyst
Research Data Analyst,"£34,304 - £40,927 a year",Leeds,University of Leeds,4.3,They will have experience of analysing large datasets; a thorough understanding of statistical principles and working experience of statistical techniques (e.g.…,Leeds,data analyst
Data Quality & Compliance Analyst,"£34,728 - £37,890 a year",Wakefield WF2 0XE•Temporarily Remote,YPO,4.2,"Developing and implementing data audits and analysing data on a regular basis to ensure data standards are being adhered to.
Job Types: Full-time, Permanent.",Leeds,data analyst
,"£34,000 - £43,000 a year",York,Nestlé,4.2,"Instigate timely periodic update and annual review of investment components, including an active feed into the Market Trade Terms Committee - preparing analysis…",Leeds,data analyst
Data Governance And Reporting Analyst,,Leeds LS1 4DL,Link Group,2.9,"The team have experience in system data analytics covering a wide range of business systems and applications (e.g. Transfer Agency systems and infrastructure,…",Leeds,data analyst
Higher Information Analyst,£124 a day,Leeds•Remote,AJACO,,"We are looking for an experienced analyst to join the established primary care domain analytical team.
Rate: *£ 124.03 per day.
Job Types: Full-time, Temporary.",Leeds,data analyst
Procurement Specialist - Data Analyst,,Bradford,WM Morrisons Supermarkets,3.3,"Ability to interpret data requirements and challenge approach.
Drive and desire to continuously improve data management and ways of working.",Leeds,data analyst
Data Quality Analyst,,Leeds LS11 5AD,ASDA,3.4,"In your role you will be working with data stewards, business data analysts, engineering squads and data quality managers to embed the robust data quality…",Leeds,data analyst
Oversight Analyst,,Leeds LS1 4DL,Link Group,2.9,The primary purpose of the Oversight team is to ensure high quality output and regulatory compliance of fund accounting and financial reporting activities…,Leeds,data analyst
,£600 - £650 a day,Leeds•Remote,Matt Burton Associates,,"6 Month Contract (Outside IR35)*.
£600 / £650 per day*.
Location: Leeds (Office based with flexible working, remote opportunities) *.",Leeds,data analyst
,"£33,000 a year",Leeds,Leeds Building Society,3.4,"You will also support the use of predictive analytics, data discovery, and visual analytical solutions as new strategic capabilities for the society.",Leeds,data analyst
,"£42,000 a year",Bradford BD1 2ST,Anchor,3.2,"Investigate, analyse and review existing business structures, processes, systems, data and information to identify detailed requirements, utilising a range of…",Leeds,data analyst
Technology Principal - Data And Analytics,,Leeds,Version 1,4.1,"Your CV shows technology leadership in the definition of best practices & repeatable methodologies in Data Engineering (including Data Storage, ETL, Data…",Leeds,data scientist
Data Science Graduate,"£25,000 a year",Leeds,Hermes,2.4,"Keep up to date with trends in data science, learning, sharing new skills and methods.
You will be part of the Office of the CIO where you will have the…",Leeds,data scientist
,"£40,927 - £50,296 a year",University of York,University of York,4.2,"Examples of your expertise might include, but are not limited to: the design, development or analysis of data-driven media experiences (e.g. recommender systems…",Leeds,data scientist
Machine Learning Engineer,,York,Hiscox,3.6,"A robust understanding of core data engineering topics – ETL vs ELT, structured and unstructured data, data quality and data governance.",Leeds,data scientist
Analytics Manager,"£55,000 - £65,000 a year",Leeds,Marks Sattin,3.6,"3+ years working with data and a strong idea on data transformation.
Experience of building data/analytical models.
Strong Microsoft Excel skills is a must.",Leeds,data scientist
Data Scientist,"£40,000 - £50,000 a year",Leeds•Remote,Nigel Frank International Limited,2.9,"Exposure to analysing sales data.
Ideally Power BI reporting or similar data visualisation background.
You won't need to do much data engineering work as they…",Leeds,data scientist
Fraud Analytics Manager,"£40,000 - £50,000 a year",Leeds,IPS Group,3.6,You will have 4 direct reports who will all work within fraud analytics from graduate level to experienced data scientists.,Leeds,data scientist
Senior People Analytics Specialist - Corporate L&D,"£45,000 - £60,000 a year",York,Nestlé,4.2,Demonstrated experience of successfully translating data into insights and excel in connecting with external environment and translating implications for people…,Leeds,data scientist
Operations Intelligence Graduate,"£25,000 a year",Leeds,Hermes,2.4,"They maintain all the data and systems that are key to the operation functioning day to day.
You will complete 4 x 6 month placements spending time in each of…",Leeds,data scientist
Data Scientist/Machine Learning Engineer,,Leeds,Musiio,,"Investigate and asses new techniques for processing and understanding audio data.
Musiio launched in 2018, creating technologies that enable the Music Industry…",Leeds,data scientist
Analytics Manager,"£50,000 - £55,000 a year",Morley,Hermes,2.4,"3+ years working with data and a strong idea on data transformation.
Experience of building data/analytical models.
Strong Microsoft Excel skills is a must.",Leeds,data scientist
Ai/Machine Learning Developer / Data Scientist,,Leeds•Temporarily Remote,CRISP,,"Understanding the underlying nature of our data and how best to design systems around it.
Applying the latest technologies to our data in order to create…",Leeds,data scientist
Data Scientist/ Senior Modelling Analyst,"£55,000 - £55,001 a year",Huddersfield,Oscar Technology,3.9,"Ensure that data from all sources are stored correctly allowing easy access for current needs as well as future use.
Salary - Up to £55,000 plus 10% bonus.",Leeds,data scientist
Lecturer In Machine Learning For Chemistry,"£40,927 - £50,296 a year",University of York,University of York,4.2,"Specialist knowledge of applying machine learning / big data approaches to chemical problems.
They should have a strong background in chemistry but be advancing…",Leeds,data scientist
Technical Data Science Lead,,Yorkshire,Star Actuarial Futures,,A key Star Actuarial client is looking to recruit into a role tasked with developing and implementing a pricing-focused data science strategy within an agile…,Leeds,data scientist
Data Report Developer And Analyst,,Leeds,QBE,3.6,"Strong abilities in the use and interpretation of numerical data.
The role will also include liaising with departments outside Actuarial, such as finance and…",Leeds,data analyst
Revenue Management Analyst,"£31,000 a year",Leeds•Remote,Northern Trains,3.6,"Maintain the system reference data that assists in revenue managing Northern trains.
Provide regular and ad-hoc data analysis using Management Information…",Leeds,data analyst
Data Analyst,£500 a day,Leeds•Remote,Lorien,3.2,"Identify and communicate efficient ways to collect, cleanse and maintain data necessary for legacy systems to extract source data in preparation for migration…",Leeds,data analyst
Data Science Personalisation Analyst,,Leeds LS11 5AD,ASDA,3.4,"Be confident extracting, querying and manipulating data from multiple sources; and working with data engineers to define requirements for data pipelines.",Leeds,data analyst
Bi Analyst,"£30,000 - £40,000 a year",Pudsey,TRC Group,4.4,They are currently looking for a BI Analyst to provide high quality reporting & data insight across the organisation.,Leeds,data analyst
Business Analyst,,Leeds,Jet2.com and Jet2holidays,3.4,"You will facilitate stakeholder workshops, displaying skill in interviewing, effective questioning and have an ability to capture valuable output that you can…",Leeds,data analyst
Commercial Data Analyst,,Harrogate•Remote,cinch cars Ltd,5.0,"Significant experience in data analytics is essential, plus knowledge of Python, SQL and advanced Excel.
You will work closely with our Data Engineering Team,…",Leeds,data analyst
Sql Data Support Analyst,"£23,000 - £26,000 a year",Barnsley S75 1JN•Temporarily Remote,Bartec Municipal Technologies,,"Collating and managing data requirements specifications.
Creating suitable import packages using T-SQL to process data received.
Temporarily due to COVID-19.",Leeds,data analyst
Data Analyst,,York,"Routeware, Inc",,"As a Data Analyst you will undertake tasks such as gathering and analyzing data, building and validating models, interacting with customers to ensure the best…",Leeds,data analyst
,,Leeds,Sky,3.5,"Experience working with multiple data streams and large data sets with proven ability to provide concrete insights.
Python and R experience a plus.",Leeds,data analyst
Data Analyst,"£31,000 - £35,000 a year",Morley,Hermes,2.4,"2+ years working with data (i.e. quantitative analysis experience, manipulating and analysing data and creating analytical reports).",Leeds,data analyst
Data Analyst,,Leeds,SharkNinja,3.2,"Critical thinking and problem-solving skills are essential for interpreting data.
Develop data governance, best practices, and processes with BI Tool vendor.",Leeds,data analyst
,"£32,000 - £40,000 a year",England•Remote,Robert Half,3.9,"Assist in maintaining the data warehouse.
Assist in maintaining data mapping protocols and structure.
Take responsibility for the loading of data via Azure Data…",Leeds,data analyst
,"£50,000 a year",Leeds,ECOM Recruitment,,"A degree (or equivalent) in a quantitative area or relevant experience gained in data analytics.
The successful candidate will follow their customer's journey,…",Leeds,data analyst
Data Analyst,"£30,000 - £35,000 a year",Leeds•Remote,Sanderson Recruitment Plc,4.3,"You will manipulate, analyse and interpret data sets relating to the client’s business and create data dashboards, graphs and visualisations.",Leeds,data analyst
Technology Principal - Data And Analytics,,Leeds,Version 1,4.1,"Your CV shows technology leadership in the definition of best practices & repeatable methodologies in Data Engineering (including Data Storage, ETL, Data…",Leeds,data scientist
Data Science Graduate,"£25,000 a year",Leeds,Hermes,2.4,"Keep up to date with trends in data science, learning, sharing new skills and methods.
You will be part of the Office of the CIO where you will have the…",Leeds,data scientist
