title,salary,location,employer,employer_rating,summary,search_city,search_role
(Senior) Data Scientist (W/M/D),,Berlin,GENOPACE GmbH,,"Du bist Teil unseres dann 5-köpfigen Data Teams, welches selbstorganisiert zusammenarbeitet - entweder an unserem Standort Berlin oder deutschlandweit remote.",Berlin,data scientist
Senior Data Scientist,,Berlin,Orange Quarter,,"Full ownership of an exciting data product.
Experience with anomaly detection, time-series analysis and sensor data is a big plus.",Berlin,data scientist
"Field Application Scientist, Dach",,Berlin,Olink,,"This includes technical support, troubleshooting issues related to user technical skill, instrument operation, and data analysis to ensure highest customer…",Berlin,data scientist
Data Scientist / Software Engineer - Predictive Analytics (M...,,Berlin,Adolf Würth GmbH & Co. KG,"3,6","Forschungsgruppe Big Data Research am Standort Berlin.
Wir erforschen und entwickeln digitale Wissenswerkzeuge durch Analyse,Mathematik und maschinelles Lernen…",Berlin,data scientist
Lead Data Scientist (Metric Tree),,Berlin+1 Ort,OLX Group,"4,4","Experience writing SQL queries and handling large amounts of data.
Experience building large-scale batch data pipelines with Spark or AWS Batch.",Berlin,data scientist
,,Berlin,Rivr @ Simplaex GmbH,,"Experience in working on big data with distributed computing (Spark, Airflow, Kubernetes).
Lead the analysis of advertising ""big data"" to inform the future…",Berlin,data scientist
Senior Data Scientist,,Berlin,Snowflake,,"Experience working with large-scale machine generated data (e.g., log, application, or customer-usage data).
Answer questions from the executive team for board…",Berlin,data scientist
Senior Data Scientist,,Berlin,Alldus,,They are looking for a Senior Data Scientist who wants to play with massive data sets and solve complex data science problems and deliver REAL tangible results.,Berlin,data scientist
(Senior) Data Scientist (F/M/X),,Berlin,diconium group,"3,9","Understanding different data sources and technologies to strengthen data driven mindset.
Creating business value through data science.",Berlin,data scientist
Postdoctoral Scientist Preclinical Pharmacology (M/F/D),,Berlin,Bayer,"4,1","Ideally experienced in the analysis of large data sets and high-performance computing.
Evaluate novel patho-mechanism in infertility-related indications.",Berlin,data scientist
Data Scientist (M/W/D) – Vertriebsmodelle,,Berlin+1 Ort,Sparkassen Rating und Risikosysteme GmbH,,Die Sparkassen Rating und Risikosysteme (SR) ist der zentrale Dienstleister für Verfahren des Risikomanagements in der Sparkassen-Finanzgruppe.,Berlin,data scientist
Fully-Funded Phd Positions In Biomedical Sciences At The Mdc...,,Berlin-Buch,Max-Delbrück-Centrum für Molekulare Medizin,,"Computational biology and data science.
Your degree is in biology, biotechnology, medicine, molecular medicine, chemistry, computer science, data science,…",Berlin,data scientist
Data Scientist (M/W/D),,Berlin,auticon GmbH,,"Mit Autismus-Diagnose oder Attest.
70% unserer Kolleg*innen sind Autist*innen.
„Autismus ist kein Systemfehler, sondern ein anderes Betriebssystem.“.",Berlin,data scientist
Sr. Software Engineer (Rust),,Berlin+1 Ort,Materialize,,"Materialize is the streaming SQL database company that makes it easy for any developer or analyst to understand streaming data, answer complex questions and…",Berlin,data scientist
Controlling Analyst (F/M/D),,Berlin,BLACKLANE,,"You will prepare and adhere to budgets by analyzing and consolidating financial data.
You will provide status updates of our financial condition by collecting,…",Berlin,data analyst
,,Berlin,Grover,,"Transforming delivery announcements into data for Inbound Team.
Experience in creating data-based processes / EDI experience.",Berlin,data analyst
Business Analyst,,Berlin,CURE Digital Finance GmbH,,Via open banking we connect financial data in the medical practice and simplify business finance management so that doctors have more time for their patients…,Berlin,data analyst
Data Engineer,,Berlin+1 Ort,Amazon Deutschland Servcs GmbH,"3,5","Demonstrated strength in data modeling, ETL development, and data warehousing.
Experience building/operating highly available, distributed systems of data…",Berlin,data analyst
Senior Data Analyst (M/W/D),,Berlin+1 Ort,wenigermiete.de,"4,8","Enable data-driven decision making by retrieving, aggregating and building reports out of our data for our business stakeholders.",Berlin,data analyst
Senior Talent Data Analyst,,Berlin,OLX Group,"4,4","Responsible for advocating for continuous data quality improvement via identifying data discrepancies.
In this role you will help build the data automation…",Berlin,data analyst
Senior Finance Analyst (M/F/D),,Berlin,SellerX,,"Partner with our Data Engineering and Technical BI teams to enhance data infrastructure, data availability, and broad access to financial insights.",Berlin,data analyst
Data Analyst (M/F/D),,Berlin,wajve,,Experience working with Consumer Insights - Having previously worked with large chunks of consumer data and developing initial segments and data structures.,Berlin,data analyst
Business Intelligence Analyst (M/F/D),,Berlin,nu3 GmbH,"5,0","You will have an operational focus on the data driven pricing action.
Here you will support in improving and adjusting data pipelines and reports.",Berlin,data analyst
Senior Data Analyst (F/M/X),,Berlin,travel audience GmbH,,"You'll extend data literacy and curiosity throughout the whole company.
You’ll be actively involved in the development and evolvement of the data architecture;.",Berlin,data analyst
Business Intelligence Analyst (M/F/D) - Remote,,Berlin•Homeoffice,infarm,"3,5","Develop creative and engaging data visualisations which allow stakeholders to make data-driven decisions.
Help identify, define and specify future insight and…",Berlin,data analyst
Data Analyst / Bi Analyst (M/W/D),,Berlin+1 Ort,datapine GmbH,,"Datapine* ist ein dynamisches und innovatives Start-up mit Sitz in Berlin und seit 2019 Teil der RIB Gruppe, einem globalen Softwareanbieter mit…",Berlin,data analyst
Data Analyst - Growth Marketing,,Berlin,oda,,"Since you will be contributing hands-on in the process of building our own data pipelines within this field, strong technical capabilities and data wrangling…",Berlin,data analyst
Marketing Data Analyst,,Berlin,Pandata,,"Understand how marketing data is generated, quality tested and analyzed.
Directly work with our clients' developers and marketing stakeholders to implement data…",Berlin,data analyst
Qa Analyst (M/F/D),,Berlin,Project A Ventures,,"A new member in our QA team at Project A. In this role, you will be working with our Portfolio Companies to establish effective control over a product’s life…",Berlin,data analyst
Fully-Funded Phd Positions In Biomedical Sciences At The Mdc...,,Berlin-Buch,Max-Delbrück-Centrum für Molekulare Medizin,,"Computational biology and data science.
Your degree is in biology, biotechnology, medicine, molecular medicine, chemistry, computer science, data science,…",Berlin,data scientist
Data Scientist (M/W/D),,Berlin,auticon GmbH,,"Mit Autismus-Diagnose oder Attest.
70% unserer Kolleg*innen sind Autist*innen.
„Autismus ist kein Systemfehler, sondern ein anderes Betriebssystem.“.",Berlin,data scientist
Sr. Software Engineer (Rust),,Berlin+1 Ort,Materialize,,"Materialize is the streaming SQL database company that makes it easy for any developer or analyst to understand streaming data, answer complex questions and…",Berlin,data scientist
Data Scientist (M/W/D),,Berlin+1 Ort,Supper & Supper GmbH,,"Data Science ist Deine Berufung.
Du führst Data Science und Datenanalyse Projekte mit unseren Kunden durch.
Data Science ist deine Leidenschaft.",Berlin,data scientist
Data Engineering Manager,,Berlin,Delivery Hero,"3,6","Data engineers at Delivery Hero build data pipelines that efficiently and reliably move data across systems.
Participate in key technical and design discussions…",Berlin,data scientist
Junior Business Intelligence Engineer (M/F/X),,Berlin,Mister Spex SE,"3,5","Practiced and proficient in ETL procedures, data migration, integration, or data quality concepts.
Aggregate and combine data to shape the central Data…",Berlin,data scientist
Senior Data Scientist,,Berlin,prestatech,"5,0","Experience with data visualization tools.
Processing, cleansing and verifying the integrity of data used for analysis.
Experience with programming in Python.",Berlin,data scientist
Postdoctoral Position | Interfacial Ionics | Operando Electr...,,Berlin,Fritz Haber Institute of the Max Planck Society,,"By combining unique synthesis methods, state-of-the art tools for experimental characterization and advanced approaches to data analysis, atomistic details of…",Berlin,data scientist
Data Engineer,,Berlin,Adecco Group,"3,5",Create data tools for analytics and data scientist team members that assist them in building and optimizing our product into an innovative industry leader.,Berlin,data scientist
Senior Lead Data Scientist Immuno-Oncology (M/F/D),,Berlin,Bayer,"4,1","Represent data science for portfolio reviews, data boards, and joint steering committees with academic and biotech collaborators.",Berlin,data scientist
Lead Data Scientist - Merchant Success,,Berlin,SumUp,"3,8",Explore and evaluate new data sources and data tools as well as help to build an automated data collection and cleaning process.,Berlin,data scientist
(Senior) Marketing Data Scientist (M/F/D),,Berlin•Vorübergehend im Homeoffice,Sonova Digital,,"5+ years of experience in a marketing/data analyst role.
Drive the decision-making process on marketing topics via data analysis, logic and statistics.",Berlin,data scientist
Data Scientist / Analyst It (W/M/D) Audit Center Of Competen...,,Berlin,KPMG,"3,9","Begleite KPMG bei den zukünftigen Herausforderungen unserer Kunden und Kundinnen.
Begeistere auch Du Dich für die Vielfalt unserer Fragestellungen - und mach…",Berlin,data scientist
Senior Data Scientist For Business Performance (F/M/D),,Berlin,CoachHub,"5,0","In the last 2 years our data team defined how to perform business processes, cleaned up several data sources and implemented various data pipelines to provide…",Berlin,data scientist
Senior Data Scientist,,Berlin,Transition Partners,,"4+ years of experience working in data science.
Data acquisition and preprocessing from various sources (API’s, home-brewn parsers, web-scraping).",Berlin,data scientist
,,Berlin,JOIN Solutions AG,,"As a first team member solely dedicated to data engineering, you'll play a pivotal role in establishing a scalable data infrastructure for data analysts &…",Berlin,data analyst
,,Berlin,Project A Ventures,,Support and training of the operational departments in interpreting data and using digital analytics tools as well as our data warehouses.,Berlin,data analyst
Senior Product Data Analyst,,Berlin,Alldus,,A Financial Services company in Germany are looking to hire a Senior Product Data Analyst who will provide the team with actionable insights to help discover…,Berlin,data analyst
Business Intelligence Analyst (M/F/D) - Remote,,Berlin-Mitte•Homeoffice,FinCompare GmbH,,"Experience with tools and pipelines for data-science and data-warehousing.
Perform data-science research and propose projects that help derive tangible user…",Berlin,data analyst
Data Scientist - Aws Fraud Prevention,,Berlin,Amazon Development Center DEU,"3,5",Ability to leverage SQL or Spark for Ad-hoc analyses and building out ETL pipelines on heterogeneous data sources.,Berlin,data analyst
Qa Analyst (M/F/D),,Berlin,Project A Services GmbH & Co. KG,,"A new member in our QA team at Project A. In this role, you will be working with our Portfolio Companies to establish effective control over a product's life…",Berlin,data analyst
,,Berlin,Merantix Labs (Berlin),,Strong organizational and multitasking skills with the ability to prioritize appropriately and effectively investigative a problem with support of analytical…,Berlin,data analyst
Product Analyst / Data Scientist (W/M/D) - Für Unseren Digit...,,Berlin,EUROPACE AG,,"Wir glauben daran, dass der Finanzierungsprozess digital wird.
Deine Rolle unterstützt dein Produktteam bei der Befähigung, Weitergabe und Transformation von…",Berlin,data analyst
Student Assistant Data Analyst (F/M/D) / Content,,Berlin•Vorübergehend im Homeoffice,Scholz & Friends Berlin,,"Wir suchen dich als *Data Analyst (f/m/d)* für unseren *Düsseldorfer Standort*.
Dafür studierst du idealerweise Wirtschaftsinformatik, Wirtschaftsingenieurwesen…",Berlin,data analyst
Tactical Global Sourcing Analyst,,Berlin,N26,"3,5","Ability to work effectively in a fast-paced environment, with a problem-solving mindset, using data to support your decisions.",Berlin,data analyst
Customer Success Program Analyst (M/F/D),,Berlin,Siemens,"4,0","Exceptional work ethic towards change management and data driven business decisions.
Works with Customer Success Managers to identify patterns in customer data…",Berlin,data analyst
(Senior) Data & Business Analyst (M/W/D),,Berlin,Tele Columbus AG,"3,0",Mit ihren Partnern der Wohnungswirtschaft realisiert die Tele Columbus Gruppe maßgeschneiderte Kooperationsmodelle und moderne digitale Mehrwertdienste wie…,Berlin,data analyst
Principal Audit Analyst (M/F/X) – Credit Risk,,Berlin,Deutsche Bank,"3,8",Advanced experience in the delivery of audit related assignments (ideally in complex financial services environments) and Commercial Banking or Investment…,Berlin,data analyst
Data Analyst -Media & Marketing Intelligence (F/M/D),,Berlin-Friedrichshain,Heineken,"4,2","To mine existing and historical data (e.g 1st ,2nd , 3rd party data sources) for deeper consumer understanding.
Ability to work within tight deadlines.",Berlin,data analyst
,,Berlin+1 Ort,Taxfix,,"Educate your stakeholders on the usage of data and help them to become more data fluent.
You will also be the first Data Analyst in our Madrid office and become…",Berlin,data analyst
Data Scientist,,Berlin,DAIN Studios,,"Utilize internal and external data and big data to design, develop, and deliver machine-learning models (unsupervised, supervised, deep learning) to solve…",Berlin,data scientist
Senior Data Scientist,,Berlin,OLX Group,"4,4","At least 3 years of professional data science experience.
Experience with building batch and real-time data pipelines using tools like Spark and Airflow.",Berlin,data scientist
Senior Product Data Scientist,,Berlin,Picsart,,"Define the underlying architecture of data collection.
Partner with Business and IT teams to understand data/reporting needs, offer solutions to address…",Berlin,data scientist
(Senior) Data Scientist (W/M/D),,Berlin,GENOPACE GmbH,,"Du bist Teil unseres dann 5-köpfigen Data Teams, welches selbstorganisiert zusammenarbeitet - entweder an unserem Standort Berlin oder deutschlandweit remote.",Berlin,data scientist
(Senior) Research Scientist - Zalando Research,,Berlin,Zalando,"3,1","Your work will be use case inspired basic research, enabled by your expertise, by Zalando's vast data pool, interactions with millions of customers, and by our…",Berlin,data scientist
Senior Applied Scientist - Commercial Planning & Trading Ai,,Berlin,Zalando,"3,1","In close collaboration with our stakeholders and the engineering team, you will align on reporting requirements and actively shape data visualization concepts…",Berlin,data scientist
Senior Data Scientist,,Berlin,Orange Quarter,,"Full ownership of an exciting data product.
Experience with anomaly detection, time-series analysis and sensor data is a big plus.",Berlin,data scientist
"Field Application Scientist, Dach",,Berlin,Olink,,"This includes technical support, troubleshooting issues related to user technical skill, instrument operation, and data analysis to ensure highest customer…",Berlin,data scientist
Data Scientist / Software Engineer - Predictive Analytics (M...,,Berlin,Adolf Würth GmbH & Co. KG,"3,6","Forschungsgruppe Big Data Research am Standort Berlin.
Wir erforschen und entwickeln digitale Wissenswerkzeuge durch Analyse,Mathematik und maschinelles Lernen…",Berlin,data scientist
Lead Data Scientist (Metric Tree),,Berlin,OLX Group,"4,4","Experience writing SQL queries and handling large amounts of data.
Experience building large-scale batch data pipelines with Spark or AWS Batch.",Berlin,data scientist
,,Berlin,Rivr @ Simplaex GmbH,,"Experience in working on big data with distributed computing (Spark, Airflow, Kubernetes).
Lead the analysis of advertising ""big data"" to inform the future…",Berlin,data scientist
Machine Learning Engineer (M/W/D),,Berlin,Michael Page,"3,5",My client is a thriving company which supports a digitized as well as largely automated supply and service chain in the industry sector.,Berlin,data scientist
Senior Data Scientist,,Berlin,Snowflake,,"Experience working with large-scale machine generated data (e.g., log, application, or customer-usage data).
Answer questions from the executive team for board…",Berlin,data scientist
Senior Data Scientist - Location (F/M/D),,Berlin,Delivery Hero,"3,6","Help defining data needs to further improve existing projects, to support data engineering and tech teams in planning their roadmap.",Berlin,data scientist
Senior Data Scientist,,Berlin,Alldus,,They are looking for a Senior Data Scientist who wants to play with massive data sets and solve complex data science problems and deliver REAL tangible results.,Berlin,data scientist
,,Berlin+1 Ort,Taxfix,,"Educate your stakeholders on the usage of data and help them to become more data fluent.
You will also be the first Data Analyst in our Madrid office and become…",Berlin,data analyst
Data Analyst Im Umfeld Von Gis-Anwendungen (M/W/X),,Berlin,iPAXX,,"Für unseren Kunden suchen wir in direkter Festanstellung einen Senior Berater!
Erstellen der strukturellen und inhaltlichen Konzepte für Projektumsetzungen mit…",Berlin,data analyst
Lead Business Analyst & Data Analyst (M/F/D),,Berlin,Customlytics GmbH,,"We need your experience in the field of Data Analytics and/or Data engineering that has resulted in a strong and broad understanding of data management, data…",Berlin,data analyst
Intern Business Analyst - B2B Project Management (F/M/X),,Berlin•Vorübergehend im Homeoffice,AUTO1 Group SE,,"Explore and give meaning to data, identify opportunities and challenges, elaborate predictions to enable the organization to take action based on data.",Berlin,data analyst
Analyst (M/W/D) Data Analytics,,Berlin+1 Ort,Kelly Services Internal,,"Wir bieten Beratung, die Strategie mit Technologie vereint und verbinden Unternehmertum mit Innovationsgeist.
Die digitale Welt entwickelt sich rasant weiter.",Berlin,data analyst
Business Analyst,,Berlin,Atheneum Partners,,"Create the data and process models and gap analysis.
Supply data-driven evidence to support the benefits of the change proposals.
The ideal candidate will also:",Berlin,data analyst
Junior Fp&A Analyst (F/M/D),,Berlin+1 Ort,HeyJobs,"5,0","Very analytical and data-driven mindset.
At HeyJobs, we use rich data sets and machine-learning technology to match talent and companies.",Berlin,data analyst
Business Analyst Commercial (M/F/D),,Berlin,Flaconi GmbH,"3,7","Degree in mathematics, statistics, economics or a comparable course of studies with a focus on data processing.
What you can expect in this role.",Berlin,data analyst
Data Scientist (M/F/D),,Berlin,Flaconi GmbH,"3,7","You will develop processes and pipelines to monitor and analyze model performance and data quality over time.
What you can expect in this role.",Berlin,data analyst
,,Berlin,CareerFoundry GmbH,,"You’ll oversee and deliver on the backlog for marketing data requests.
You’ll be highly motivated to innovate around new methods of data collection, research,…",Berlin,data analyst
(Senior) Data Analyst (M/F/D),,Berlin,PaulCamper,,"Be a data expert in our company and support all teams with the right data and insights.
Identify and develop creative and engaging data visualization and…",Berlin,data analyst
,,Berlin,Puls Technologies GmbH,,"Strong attention to detail and ability to notice discrepancies in data.
The client will be able to have an overview of their financial history, as well as…",Berlin,data analyst
Inventory Analyst (M/F/D),,Berlin+1 Ort,everphone GmbH,,"Confidence in working with large amounts of data.
Experience in working with financial statements, raw data and accounting.
Inventory Analyst (m/f/d).",Berlin,data analyst
Financial Business Analyst (M/F/D) Business Optimization,,Berlin,Flix,,"You work closely with internal stakeholders – including Business Development, Business Intelligence, Marketing and Pricing to set up PowerBI dashboards by…",Berlin,data analyst
Data Quality Engineer Working Student ( D / F / M),,Berlin+1 Ort,Gymondo GmbH,"4,5","Communicate with the data analysts so that they can be aware of and communicate the status of data quality to stakeholders.
Your contribution within the team.",Berlin,data analyst
Software Engineering Manager - Javascript (F/M/X),,Berlin,Comtravo GmbH,,"You work in close cooperation with other developer teams, our product team and the data scientist to develop kick-ass features.",Berlin,data scientist
Senior Data Scientist,,Berlin,DAIN Studios,,"Utilize internal and external data and big data to design, develop, and deliver machine-learning models (unsupervised, supervised, deep learning) to solve…",Berlin,data scientist
Senior Bi Analyst (M/F/D),,Berlin,Moss,,"3 years of professional experience as an analyst/data scientist.
Strong data manipulation skills (SQL, Excel).
Strong written and oral communication skills.",Berlin,data scientist
Postdoctoral Position (F/M/D) | Analysis Of Functional Inter...,,Berlin,Fritz Haber Institute of the Max Planck Society,,We are looking for someone who is also interested in implementing modern methods of data analysis and integrating commercial spectrometers into a digitized…,Berlin,data scientist
Machine Learning Engineer / Data Scientist (W/M/D) - Google...,,Berlin,adesso SE,"2,5",Nutzung von Python zum Deployment von production ready data pipelines und modernen Machine Learning Modellen in der Google Cloud.,Berlin,data scientist
Senior Data Scientist (F/M/D),,Berlin,Codepan GmbH,,"4+ years working experience with industry data science and machine learning projects.
A solid understanding of data science and machine learning concepts and…",Berlin,data scientist
Data Scientist (M/W/D),,Berlin,ixto,,"Abwechslungsreiche Herausforderungen bei renommierten Kunden vom Mittelständler bis zum Großkonzern.
Hohe Lern- und Begeisterungsfähigkeit für alle mit Data…",Berlin,data scientist
Principal Scientist (F/X/M) — Reverse Translation Modeling A...,,Berlin,Newsenselab,,"The vacancy of a Data Scientist with whom you will work closely in the area of data assimilation.
We invest in advancing research through data that advances our…",Berlin,data scientist
Senior Data Scientist,,Berlin,Marley Spoon,"3,0","Experienced dealing with large amounts of data and knowledge of big data technologies (e.g. SageMaker, AirFlow, Snowflake, Looker).",Berlin,data scientist
Data Scientist (M/W/D),,Berlin,Positive Thinking Company,"3,8","Wir suchen Dein Talent und Deine Leidenschaft zur Verstärkung unserer Data & Analytics Experten.
Verantwortung für die Planung, Konzipierung und Realisierung…",Berlin,data scientist
Senior Product Data Analyst,,Berlin,Miro,,"Advanced experience writing SQL queries and working with large data sets (DBT, Snowflake, Spark are a plus).
4+ years of experience in data analytics, including…",Berlin,data scientist
Data Scientist - Search,,Berlin,Vestiaire Collective,,"Use data to improve relevance and ranking.
Experienced in machine learning, data science projects.
You will work with other applied scientists and backend…",Berlin,data scientist
,,Berlin,NLC - Next Level Commerce,,"Als Tochterunternehmen und Innovationsmotor der K-Mail Order (KLiNGEL Gruppe), welche mit 15 Marken in 12 Ländern zu den führenden Multichannel-Distanzhändlern…",Berlin,data scientist
Senior Data Scientist (D/W/M),,Berlin-Kreuzberg,tetrel GmbH,,"Tetrel ist ein Start-up für Machine Learning basierte Softwarelösungen.
Unsere Kunden sind Unternehmen oder Non-Profits in Deutschland und Europa.",Berlin,data scientist
(Senior) Machine Learning Engineer For Product Supply (M/W/D...,,Berlin,Bayer,"4,1","Wir tun dies mit Energie, Neugier und purer Hingabe, lernen stets von den Menschen um uns herum, erweitern unsere Denkweise, verbessern unsere Fähigkeiten und…",Berlin,data scientist
(Product) Data Analyst (W/M/D),,Berlin,EUROPACE AG,,"Du misst kontinuierlich den Produkterfolg am Markt und leitest daraus Handlungsempfehlungen ab.
Leistungsbereitschaft gepaart mit ausgeprägter Eigeninitiative…",Berlin,data analyst
Pip Data Analyst,,Berlin,Adecco Group,"3,5","Analyse data from primary or secondary data sources.
Work with data engineers and IT counterparts to understand existing quality and availability of data assets…",Berlin,data analyst
Business Analyst (M/F/D),,Berlin,Aroundtown Commercial Properties,,"Business data mining and rent role analysis.
Financial analysis and modelling: Producing performance analysis for the management based on actual results and…",Berlin,data analyst
"Data Product Owner, Customer Experience -Europe Remote",,Berlin•Homeoffice,Vista,"3,6","Work with agile product teams of analysts, data scientists, and data engineers.
Develop and maintain Vistaprint’s first company-wide customer experience (CX)…",Berlin,data analyst
