title,salary,location,employer,employer_rating,summary,search_city,search_role
Senior Data Scientist - Ranking Team,,"Austin, TX",Indeed,4.3,"Demonstrated ability with the following skills required: Small data modeling using: Python, R, Julia, or Octave; big data modeling using: Hadoop, Pig, Scala, or…",Austin,data scientist
Principal Data Scientist - Match Recommendations,,"Austin, TX•Temporarily Remote",Indeed,4.3,"Mentor and grow other software engineers and data scientists across teams.
Have the desire to solve difficult problems at the intersection of machine learning,…",Austin,data scientist
Data Scientist Ii,,"Austin, TX 78758 (North Austin area)",SparkCognition,4.4,Experience and knowledge of renewable energy technologies especially applying data analytics techniques in the domain.,Austin,data scientist
,,"Austin, TX",Glassdoor,4.2,"Drive a deep and holistic understanding of our users through applying a mix of machine learning, statistics and analytics skills.",Austin,data scientist
"Data Scientist, Presales",,"Austin, TX",Moveworks,4.3,"Expertise in data modeling, ETL (or relevant toolkit), and data warehousing concepts.
You will distill prospective customer ticket data into insights to enable…",Austin,data scientist
Oracle Business Analyst,,"Austin, TX 78758 (The Domain area)",Hanger Inc.,3.4,"Experience with SQL data extracts, Oracle OBIEE, BI Publisher highly preferred.
3 years working with ERP applications.
Proven track record in meeting deadlines.",Austin,data analyst
"Senior Consultant, Technology Business Analyst",,"Austin, TX 78701 (Downtown area)",CohnReznick,3.5,"3 + years of experience with a consulting company or in an internal consulting role (e.g., analyst, project manager) participating in large scale, complex…",Austin,data analyst
Lead Biso Analyst (Enabling Areas),,"Austin, TX",Deloitte,4.0,"Use data analyst techniques to answer research questions about vulnerabilities, and general threat intelligence trends.",Austin,data analyst
Sr. Business Analyst - Fom,,"Austin, TX 78729",PayPal,3.9,"Business Analyst will support key initiatives, derived from the FOM strategic plan and approved by the FOM steering committee to deliver outcomes that promote…",Austin,data analyst
It Business Analyst/Project Manager,,"Austin, TX 78735 (West Oak Hill area)",NXP Semiconductors,3.8,"Ensure on-time and on-budget delivery using Scaled Agile.
Develop overall project plans and approach in collaboration with the business team.",Austin,data analyst
Business Intelligence Analyst Ii,,"Austin, TX 73301 (St Edwards area)•Remote",TE Connectivity,3.7,"Assess the effectiveness and accuracy of new data sources and data gathering techniques.
Present information using data visualization techniques.",Austin,data analyst
Salesforce Business Analyst,,"Austin, TX 78701 (Downtown area)",Advance Auto Parts,3.4,"Proficiency in producing data flow and business process diagrams as an output of team discussions.
Minimum of 3 years Business Analyst experience required.",Austin,data analyst
Business Analyst,,"Austin, TX 78753 (Windsor Hills area)",Rakuten Americas,,"5-7 years of Experience (Total).
Role is to develop technical solutions to problems in a business or to further a company’s sales revenue by defining,…",Austin,data analyst
Accenture - Repl Workforce Management (Wfm) Business Analyst...,,"Austin, TX",Accenture,4.0,"Minimum of 3 years of business analyst experience.
Experience in data gathering and facilitation techniques.
Lead detailed design activities ensuring solutions…",Austin,data analyst
Business Operations Analyst Senior,,"Austin, TX 78734",Anthem,3.7,"Requires a BS/BA degree in related field; 3-5 years data analysis or related experience; or any combination of education and experience, which would provide an…",Austin,data analyst
Data Warehouse Business Analyst Lead,,"Austin, TX",Intone Networks,4.2,"This analyst will work with a team of business analysts, business users, data security team, developers, and project managers.",Austin,data analyst
"Data & Analytics Manager, Deloitte Health Equity Institute,...",,"Austin, TX+1 location",Deloitte,4.0,"Evaluate data quality and promote data governance best practices, including confirming that data assets are monitored, and governance principles are upheld.",Austin,data analyst
Data Analyst Iv - (E4),,"Austin, TX",Applied Materials Inc.,3.9,"Lead and develop a team of data analysts.
Develop strategies for effective data analysis and reporting.
Define company-wide metrics and relevant data sources.",Austin,data analyst
Sr. Business Analyst,,"Austin, TX 78701 (Downtown area)",Advance Auto Parts,3.4,"Work with business users & data architects to translate business rules into data transformation procedures.
Identify, create and exchange process design changes…",Austin,data analyst
"Senior Associate, State And Local Ui/Ux Business Analyst",,"Austin, TX 78701 (Downtown area)",KPMG,3.9,"Identify user experience design requirements through interviews, data analysis, surveys and the documentation of findings coupled with support of the…",Austin,data analyst
,,"Austin, TX+2 locations",realtor.com,3.3,"PhD/MS in computer science, statistics, mathematics, operations research or related fields and 2 years of relevant experience in data science, machine learning…",Austin,data scientist
Data Scientist,,"Austin, TX•Remote",Victory,3.7,"Significant experience in data mining, machine-learning and operations research.
Organize and present information using data visualization techniques.",Austin,data scientist
Data Scientist,,"Austin, TX 73301 (St Edwards area)+1 location",Recruiting From Scratch,,"Design and build models across a variety of use cases to deliver insights for internal and external stakeholders.
BA/MA, BS/MS, or PhD in a technical field.",Austin,data scientist
Senior Data Scientist,,"Austin, TX 78702 (Rosewood area)",Freedom Financial Network,3.5,"5+ years of experience as a professional data scientist.
As a Senior Data Scientist at Freedom Financial, you will focus on developing and deploying machine…",Austin,data scientist
"Data Scientist, Decision Science (Marketing And Go To Market...",,"Austin, TX+1 location",Glassdoor,4.2,"The Decision Science team drives data-driven strategy and decision making across the company through predictive analytics, testing and optimization.",Austin,data scientist
Lead Data Scientist,,"Austin, TX 78735",Kestra Financial,3.1,"Mentor data scientists, data analysts, and data engineers of varying experience levels and subject matter areas.
5+ years experience with data science.",Austin,data scientist
Principal Data Scientist - Remote,,"Austin, TX 73301 (St Edwards area)•Remote",Varis,,"Implementing and deploying large scale machine learning applications and tools.
Write high-quality documents that help provide insights to leadership and gain…",Austin,data scientist
Signal Processing And Data Analysis Software Engineering Sci...,,"Austin, TX 78758 (North Burnet area)",Applied Research Laboratories,3.6,"*Experience developing multi-threaded, multi-machine computational software applications, and/or experience with middleware tools and messaging protocols such…",Austin,data scientist
Machine Learning Project Manager,,"Austin, TX 78704 (South Lamar-South Congress area)",Liaison AI,,"Familiar with basic data processing software.
Liaison’s vision is to create fully autonomous enterprises for the benefit of everyday life by accelerating the…",Austin,data scientist
Data Architect,,"Austin, TX 78759 (Arboretum area)",SparkCognition,4.4,"Includes data scientists and software engineers working to create this solution.
Working with data scientists to help understand the needs of the algorithms we…",Austin,data scientist
Data Engineer,,"Austin, TX 78731","Iodine Software, LLC",,Iodine Software equips medical care teams with the most innovative tools to solve some of their toughest problems in clinical documentation.,Austin,data scientist
Machine Learning Engineer,,"Austin, TX•Temporarily Remote",PentaMaksTech,,"Experience developing and productionizing machine learning models is a plus.
Experience with distributed data processing tools like Hive, Spark, Airflow.",Austin,data scientist
Research Engineer - Machine Learning For Autonomous Driving...,,"Austin, TX 78712 (University of Texas area)",Bosch Group,4.1,The Austin office offers an R&D experience that's heavy on the R. We have the flexibility to apply machine learning to automated driving products that are…,Austin,data scientist
,,"Austin, TX",Argo AI,3.2,Build backend infrastructure and web services in python and C++ that empower machine learning engineers and scientists across the organization.,Austin,data scientist
"Construction Engineer For Bitfury Data Centers (Nam, Remote)",,"Austin, TX•Remote",Bitfury,3.3,"Construction engineer is responsible for potential data center (DC) sites assessment and initial data analysis, DC site engineering process supervision and…",Austin,data scientist
Data Analyst Iv - (E4),,"Austin, TX",Applied Materials Inc.,3.9,"Lead and develop a team of data analysts.
Develop strategies for effective data analysis and reporting.
Define company-wide metrics and relevant data sources.",Austin,data analyst
Sr. Business Analyst,,"Austin, TX 78701 (Downtown area)",Advance Auto Parts,3.4,"Work with business users & data architects to translate business rules into data transformation procedures.
Identify, create and exchange process design changes…",Austin,data analyst
"Senior Associate, State And Local Ui/Ux Business Analyst",,"Austin, TX 78701 (Downtown area)",KPMG,3.9,"Identify user experience design requirements through interviews, data analysis, surveys and the documentation of findings coupled with support of the…",Austin,data analyst
Supply Chain Systems Analyst - Operations,,"Austin, TX 78728•Remote work available","ICU Medical, Inc.",3.3,"3-5 years of experience in collaborating with business and technical teams to understand requirements.
Typically requires travel less than 5% of the time.",Austin,data analyst
"Senior Manager, Data Analytics (Customer Success & Renewals)",,"Austin, TX 73301 (St Edwards area)",Splunk,4.2,Finding practical ways to bring together data and insights to manage and advise the performance of our business.,Austin,data analyst
,,"Austin, TX 78744 (Franklin Park area)",Wayfair,3.1,"Develop data visualizations, including reports, dashboards, and analyses in Looker and GBQ to distribute data insights in an easily digestible manner.",Austin,data analyst
"Advisor, Business Intelligence (17000Vuq)",,"Round Rock, TX+1 location",Dell Technologies,4.0,"Apply data quality techniques to empower our teams to make confident data driven decisions.
Dell’s ability to leverage high-quality, seamless and consistent…",Austin,data analyst
Accenture Products And Platforms Lead Business Analyst,,"Austin, TX",Accenture,4.0,"5 years of experience in the IT management consulting industry or insurance industry.
5 years implementing life insurance policy administration systems and…",Austin,data analyst
,,"Austin, TX",General Motors,4.0,"Understanding of business issues and data challenges of the organization and industry as a whole.
Working technical knowledge & understanding of business…",Austin,data analyst
Mergers & Acquisitions - Data Analytics Advisory Manager,,"Austin, TX",Deloitte,4.0,"Statistical methods in support of data analysis.
Analyze deal data for trends and outliers.
Demonstrated knowledge or advanced business analytics and data…",Austin,data analyst
Sales Systems And Data Analyst,,"Austin, TX 78735 (West Oak Hill area)",NXP Semiconductors,3.8,"Implements SQL database models and procedures, and safeguards Sales data through effective data security.
Leverage SQL, BI tools, and Excel to produce ad-hoc…",Austin,data analyst
Sr. Business Intelligence/Analytics Analyst (Hid2381),,"Austin, TX 78753 (Windsor Hills area)•Remote",HID Global,3.6,"5+ years of experience as a business/data analyst working with data and technical systems.
5+ years ERP functionality and/or data sourcing (Oracle EBS, SAP, JD…",Austin,data analyst
,,"Round Rock, TX•Remote",Dell Technologies,4.0,"Administer BI platforms and tools like PowerBI, Tableau, SSRS, SSAS and BOBJ.
Perform installations, upgrades, certificate renewals and other related platform…",Austin,data analyst
Sap Data & Analytics Manager,,"Austin, TX 78703 (Downtown area)+1 location",PRICE WATERHOUSE COOPERS,4.0,"Use data and insights to inform conclusions and support decision-making.
Develop new skills outside of comfort zone.",Austin,data analyst
Senior Business Analyst/Scrum Master Remote,,"Austin, TX•Remote",Learn On Demand,,"At least 5 years working as a Business Analyst in an IT environment.
Ability to move equipment, in excess of 5 lbs.",Austin,data analyst
,,"Austin, TX 78702 (Rosewood area)",Granify,,"3 years experience managing large enterprise clients in a small, fast paced company.
Project manage all aspects of the partnership, from implementation to…",Austin,data scientist
"Data Scientist, Senior",,"Austin, TX",Cintra US Services LLC,,Experience with designing data visualizations using software like Tableau to communicate complex data insights to management.,Austin,data scientist
Project Manager For Bitfury Data Centers (Remote),,"Austin, TX•Remote",Bitfury,3.3,"Develop risk management plan to proactively identify and manage project risks.
Develop project dashboard and automated project status reporting;",Austin,data scientist
"Lead Data Scientist, Presales",,"Austin, TX",Moveworks,4.3,"You will collaborate closely with GTM teams, customer success managers, engineers, data scientists, and product managers.",Austin,data scientist
Senior Data Analyst,,"Austin, TX",Movoto,4.0,"Working experience with large datasets using data analytics tools.
3+ years of experience in data analyst or data science.
PetPlan (10-15% off premiums).",Austin,data scientist
Machine Learning Engineer,,"Austin, TX",Teladoc Health,3.1,"In your role as a Machine Learning Engineer, you will work closely with machine learning scientists, data engineering teams and different stakeholders to create…",Austin,data scientist
Senior Machine Learning Scientist - Enterprise,,"Austin, TX•Remote",Whip Media,,"Experience creating data products that successfully address large scale-business challenges.
Therefore, for everyone's safety, as a condition of employment: all…",Austin,data scientist
Data Science Practice Lead,,"Austin, TX 78746•Remote work available",Toole Design,,"This data science practice lead position earns a competitive salary and great benefits, including medical, dental, vision, life insurance, disability, a health…",Austin,data scientist
Machine Learning Engineer,,"Austin, TX 78759 (Arboretum area)","SparkCognition, Inc.",4.4,Working closely with data scientists to understand core challenges and develop solutions which improve data science productivity.,Austin,data scientist
,,"Austin, TX 73301 (St Edwards area)",Brightside Health,4.9,"Co-manage and develop core SQL data models that power our BI platform.
A core strength for the ideal candidate will be in the development of evolving SQL data…",Austin,data scientist
Staff Machine Learning Engineer-Consumer Data Science,,"Austin, TX",realtor.com,3.3,"Mentor the team on data exploration, machine learning, deep learning and developing data-oriented products.
Research, build and deploy machine learning and deep…",Austin,data scientist
Gpu/Cpu Performance Engineer - Deep Learning - 109942 1,,"Austin, TX","Advanced Micro Devices, Inc.",3.8,"Optimize the performance of Deep Learning models for AMD GPUs and platforms.
Define performance suite and best practices for measuring GPU accelerated Machine…",Austin,data scientist
"Data Science, Manager Of Experimentation Automation",,"Austin, TX",realtor.com,3.3,"Intense curiosity, high intellectual and analytical horsepower, passionate pursuit of analytics driven insights.",Austin,data scientist
Machine Learning Performance Engineer - 124765,,"Austin, TX+3 locations","Advanced Micro Devices, Inc.",3.8,"AMD is seeking an expert at machine learning with background in frameworks such as Pytorch/TensorFlow, and machine learning workloads.",Austin,data scientist
Principal Scientist - Machine Learning For Autonomous Drivin...,,"Austin, TX 78712 (University of Texas area)",Bosch Group,4.1,"In addition, you will be responsible for the scoping, supervision, and publication of peer-reviewed research projects; and work in close collaboration with our…",Austin,data scientist
Third Party Risk Management (Trpm) Gateway Center Of Excelle...,,"Austin, TX",Deloitte,4.0,"Experience working on data analytics projects that included data mining, query development, data quality assessments, and/or statistical analysis is a plus.",Austin,data analyst
Lead Analyst / Data Scientist,,"Austin, TX 73301 (St Edwards area)",New Relic,3.3,"Experience using data access tools and building visualizations using large datasets and multiple data sources.
Advanced degree in the above analytical fields.",Austin,data analyst
Fixed Term - Pwc Technology - Business Analyst,,"Austin, TX 78703 (Downtown area)",PRICE WATERHOUSE COOPERS,4.0,"Use data and insights to inform conclusions and support decision-making.
You’ll focus on managing the design and implementation of technology infrastructure…",Austin,data analyst
Global Business Analyst,,"Austin, TX",Varian Medical Systems,3.8,Maintain and foster relationship with contracted vendors in support of data delivery and exploration of new opportunities.,Austin,data analyst
Business Analyst,,"Austin, TX 78701 (Downtown area)•Temporarily Remote",Employees Retirement System of Texas,3.9,"Five (5) years of experience (depending on classification level) planning, eliciting, analyzing, and managing business requirements and monitoring throughout…",Austin,data analyst
Senior Business Analyst - Kantar Marketplace,,"Austin, TX",KANTAR,3.7,"Using PowerBI to analyse and visualize data.
Experience with Application Insights or other data analysing tool for web applications.",Austin,data analyst
Pwc Technology - Data Analytics Senior Associate,,"Austin, TX 78703 (Downtown area)",PRICE WATERHOUSE COOPERS,4.0,Reporting and analysis of organizational and infrastructure data using Splunk log aggregation and other similar tools;,Austin,data analyst
Sw Business Analysis Specialist,,"Austin, TX",Accenture,4.0,"A minimum of 3 years of experience in a successful and professional business analysis role.
Excellent analytical and problem-solving skills with a close…",Austin,data analyst
Data Analyst 2 - Marketing Analytics,,"Austin, TX•Temporarily Remote",Zynga,3.8,"3+ years of work experience in data science or analytics roles.
A strong background in experimental design and statistical methodologies for analyzing data.",Austin,data analyst
Guidewire Business Analyst - Senior Associate,,"Austin, TX 78703 (Downtown area)",PRICE WATERHOUSE COOPERS,4.0,"Document management systems (production, imaging, storage) – as a functional user or as a business system analyst.
Writing and designing process maps;",Austin,data analyst
Gps Lead Talent Business Analyst For Sm/Ppmd - Sector Op Sup...,,"Austin, TX",Deloitte,4.0,"Cross functional data integration & analysis.
Works in conjunction with USI analysts to manage transfers and general demographic transitions.",Austin,data analyst
"Business System Analyst - Austin, Tx (Remote)",,"Austin, TX+1 location•Remote",iknowvate technologies,,"Ability to analyze data and present outcomes in a way for management team to easily comprehend results.
Our client is looking Business System Analyst in long…",Austin,data analyst
Cloud Migration Business Intelligence Consultant,,"Austin, TX",Accenture,4.0,"Designing technical architecture of interfaces, including definition of data sources and modeling, and selection of integration and reporting tools.",Austin,data analyst
Senior Business Intelligence Analyst,,"Austin, TX 78704 (South Lamar-South Congress area)",St Edwards University,3.5,"The role is responsible for management of contract data analysts and scientists working on behalf of the university.
Short Term Disability (STD) Insurance.",Austin,data analyst
Senior It Compliance Analyst - Remote Opportunity,,"Austin, TX 78758 (The Domain area)",Hanger Inc.,3.4,"Experience in data analysis techniques and understanding of how to write basic scripts to query and join populations of data.
The IT Compliance Analyst will:",Austin,data analyst
"Data Science, Ml Engineer/Lead",,"Austin, TX•Temporarily Remote",spar information systems,4.3,"Experience in using machine learning tools to train and evaluate natural language processing models.
5+ years of relevant work experience.",Austin,data scientist
"Machine Learning Engineer, Nlp",,"Austin, TX 78759 (Arboretum area)","SparkCognition Government Systems, Inc.",," Familiarity in applying deep learning techniques to text.
 Collect and prepare data sets.
 Develop new algorithms and approaches to various NLP problems.",Austin,data scientist
"Senior Software Engineer, Machine Learning Platform",,"Austin, TX",Argo AI,3.2,"Experience building highly scalable, reliable, and maintainable data systems/Machine Learning pipelines.
Strong programming skills in relevant languages (Python…",Austin,data scientist
"Director Of Sales & Business Development - Ai, Data Science",,"Austin, TX•Remote",Xen.ai,,"Xen.AI is looking for Director of Sales & Business Development - AI & Machine Learning solutions, who can bring in AI, Machine Learning, Deep Learning and Data…",Austin,data scientist
Machine Learning Engineer (Speech To Text Startup),,"Austin, TX 73301 (St Edwards area)+9 locations•Remote",Recruiting From Scratch,,"Receive the benefits of comprehensive health, dental, vision and disability insurance.
Experience with TensorFlow or PyTorch, or similar deep learning…",Austin,data scientist
"Senior / Staff Data Analyst, Generalist",,"Austin, TX",realtor.com,3.3,The best candidates have some experience with data visualization; analytics/data engineering and data modeling; and statistical modeling and other quantitative…,Austin,data scientist
Machine Learning / High Performance Compute Program Manager-...,,"Austin, TX","Advanced Micro Devices, Inc.",3.8,"As program manager in AMD’s machine learning software engineering team, you will drive end-to-end delivery of leading-edge technology in high performance GPU…",Austin,data scientist
Senior Simulation Data Scientist,,"Austin, TX 73301 (St Edwards area)",Recruiting From Scratch,,"They work with protocols to manage risk, improve capital efficiency, and manage incentive spend.
Build data models and visualizations of public blockchain data…",Austin,data scientist
Senior Data Analyst,,"Austin, TX",Punchh,,You will leverage prior industrial experience in product and business analytics and help create cutting-edge data and analytics products.,Austin,data scientist
Machine Learning Engineer,,"Austin, TX 78704 (South Lamar-South Congress area)+1 location",Liaison AI,,"Familiar with basic data processing software.
Candidates are open-minded, multi-talented individuals who are sensitive to the nuances of interpersonal…",Austin,data scientist
Ai / Nlu Engineer,,"Austin, TX 73301 (St Edwards area)+1 location•Remote",Recruiting From Scratch,,"Comprehensive health care for you and your family.
For nearly 25 years, enterprise customers nationwide – Fortune 500, healthcare, and higher education – have…",Austin,data scientist
Senior Data Scientist - Remote,,"Austin, TX 73301 (St Edwards area)•Remote",Varis,,"Implementing and deploying large scale machine learning applications and tools.
Write high-quality documents that help provide insights to leadership and gain…",Austin,data scientist
"Team Lead, Engineering & Data Science",,"Austin, TX 78702 (Rosewood area)•Remote work available",ASTRALABS,,"Technical expertise in data models, database design/development, data mining, and segmentation techniques.
Own and drive project delivery milestones, set team…",Austin,data scientist
"Asic Production Test Engineer - Ai Silicon Design (Ca, Tx Or...",,"Austin, TX 78738",Tenstorrent,,"Collect and analyze volume fault data for root cause identification and yield improvement opportunities.
ASIC Production Test Engineer - AI Silicon Design.",Austin,data scientist
Senior Ai Engineer,,"Austin, TX",Acrisure Technology Group,,"Take a scientific and data-driven approach to solving problems.
Wade through ambiguity and a vast set of opportunities to identify the right strategies to…",Austin,data scientist
"Associate, Data Scientist - Financial Services Statistical M...",,"Austin, TX 78701 (Downtown area)",KPMG,3.9,"Build ingestion processes to prepare, extract, and enrich a variety of structured and unstructured data sources such as social media, news, internal/external…",Austin,data analyst
Cloud Migration Business Intelligence Manager,,"Austin, TX",Accenture,4.0,"Minimum of 3 years of designing, building and managing Business Intelligence interfaces.
Designing technical architecture of interfaces, including definition of…",Austin,data analyst
"Lis Business Analyst (Austin, Texas)",,"Austin, TX","Sonic Reference Laboratory, Inc",,"Ability to perform data analysis and present findings in a concise actionable manner.
The LIS Business Analyst will be responsible for evaluating and deploying…",Austin,data analyst
Cpa - Capps Financials Deployment Analyst,,"Austin, TX 78701 (Downtown area)",COMPTROLLER OF PUBLIC ACCOUNTS,2.8,"Travel: Yes, 5 % of the Time.
8 a.m. – 5 p.m. Monday through Friday, 40 hours a week with occasional evening, weekend and holiday hours.",Austin,data analyst
