title,salary,location,employer,employer_rating,summary,search_city,search_role
,,Deutschland•Homeoffice,Acxiom Deutschland GmbH,,"Als Junior Data Analyst (m/w/d) @Acxiom ist es deine Aufgabe, unsere Kunden und Stakeholder dabei zu unterstützen, verfügbare Daten zu verstehen und mit ihnen…",Hamburg,data analyst
,,Hamburg,Accenture,"4,0",SinnerSchrader gehört zu den führenden Design- und Technologie-Agenturen Europas mit dem Fokus auf Design und Entwicklung von digitalen Produkten und Services.,Hamburg,data analyst
,,Hamburg,ABOUT YOU SE & Co. KG,,"Routine in data crunching & visualization.
Prepare and model data using modern database technologies.
Do you want to support the Team by handling many terabytes…",Hamburg,data analyst
Process And Data Analyst (All),,Hamburg,Spairliners GmbH,,"First working experience in data analysis.
Analyze our output and performance data, create relevant KPIs using Power BI from Microsoft.
Tasks you will work on:",Hamburg,data analyst
,,Hamburg,Container xChange,,"Experience in data modelling, data wrangling and data mining.
Set up a scalable data warehouse for marketplace data with standard data-tables that automates the…",Hamburg,data analyst
Business Analyst (M/F/D),,Hamburg,PALTRON GmbH,,"Additionally, you’re responsible for visualizing data by building dashboards using PowerBI and similar tools.
Also social support: subsidy for daycare/childcare…",Hamburg,data analyst
,,Hamburg•Homeoffice,Kale&Me GmbH,,"DATA ANALYST (m/w/d).
Dauer: unbefristet, 10-20h / Woche.
Anpassung und Neuentwicklung von Auswertungen für Marketing, Vertrieb und Logistik.",Hamburg,data analyst
Data Analyst,,Hamburg,WarnerMedia,,"Collaborate with external data source providers to receive and review data files.
Basic technical skills are required, including experience with SQL, data…",Hamburg,data analyst
Business Analyst (M/F/D),,Hamburg,MOIA,"2,3","Drive the business: You proactively push data-based insights into the organization.
You are experienced in the application of Python, R or similar to work with…",Hamburg,data analyst
Junior Data Analyst (All Genders),,Hamburg,Cocomore AG,,"Die Cocomore AG ist eine Agentur für Marketing, IT & Experience Design mit 180 Mitarbeiterinnen und Mitarbeitern und Büros in Frankfurt/Main, Genf, Köln, Berlin…",Hamburg,data analyst
Global Customs Analyst,,Hamburg,Flexport,,"We aim to do this by building the Operating System for Global trade - a strategic model combining advanced technology and data analytics, logistics…",Hamburg,data analyst
Data Analyst (M/W/D),26 € pro Stunde,Hamburg•Homeoffice,Hanseatic-Statistics,,"+++ Hi, please note that the german language is necessary for this position ( >=C1) +++.
Wir suchen Verstärkung für unser Team, bestehend aus 18 Data…",Hamburg,data analyst
(Junior) Research Data (Insights) Analyst (M/W/D),,Hamburg,Omnicom Media Group Germany,"3,8","Du zapfst frei zugängliche Datenquellen an und ziehst uns Insights für die Fragestellungen unserer Kunden daraus.
Dir fällt noch mehr ein?",Hamburg,data analyst
(Junior) Data Analyst (W/M/D),,Hamburg,freenet Group,"3,0","Ein Unternehmen der freenet Group.
Mobilcom-debitel bietet ein umfangreiches Portfolio rund um die Themen Mobilfunk, TV und Internet.",Hamburg,data analyst
Working Student M/F/D Data Analyst – Regional Commercial,,Hamburg,Hapag-Lloyd AG,,"Acquiredata from primary or secondary data sources and maintain databases/data systems.
Develop andimplementdatabases, data collection systems, data analytics…",Hamburg,data analyst
Data Scientist Angewandte Statistik (M/W/D),,Hamburg•Vorübergehend im Homeoffice,PPI AG,"4,0","Ziel Deiner Arbeit ist es, unseren Kunden valide Entscheidungsgrundlagen bereitzustellen und mit ihnen gemeinsam datengetriebene Geschäftsprozesse zu gestalten.",Hamburg,data scientist
,,Hamburg,Accenture,"4,0","SinnerSchrader wurde 1996 gegründet, ist seit 1999 börsennotiert und hat Studios in Hamburg, Berlin, Frankfurt am Main, München, Zürich und Prag.",Hamburg,data scientist
Remote Sensing Scientist– Altimetry,7.500 € pro Monat,Deutschland,EUMETSAT,"4,3","Manage the Altimetry team and its resources, including development of the scientific knowledge required to support the exploitation and evolution of EUMETSAT…",Hamburg,data scientist
,,Hamburg,sovanta AG,,"The opportunity to take responsibility while working alongside other data science colleagues.
Chance to analyze complex data sources, develop machine learning…",Hamburg,data scientist
Data Scientist For Business Analytics (M/F/D),,Hamburg,MOIA,"2,3","Proficiency with hypothesis testing and data visualization.
A degree in a quantitative scientific discipline and/or work experience as a data scientist or…",Hamburg,data scientist
(Junior) Data Scientist (M/W/D),,Hamburg,ABOUT YOU SE & Co. KG,,"Diese Produkte beinhalten unter anderen das Attributionsmodell und die Customer Lifetime Value Metriken.
Dabei ist das Team für den gesamten Prozess von der…",Hamburg,data scientist
Lead Data Scientist,95.000 € - 110.000 € pro Jahr,Hamburg,Flint Data,,"Hamburgs. Darüber hinaus bietet dir das Unternehmen eine attraktive Vergütung, sowie Karriere und Persönliche Entwicklungsmöglichkeiten.",Hamburg,data scientist
Senior Data Scientist (M/F/Diverse) @ Aviatar,,Hamburg,Lufthansa Technik AG,"3,9","We develop data and engineering driven software solutions for airline’s technical operations.
Our international agile teams develop and operate every step of…",Hamburg,data scientist
Data Scientist (M/F/D),,Hamburg,Porsche Consulting GmbH,"4,0","Application of advanced analytics methods (data modeling, analysis and visualization) to process real world data in a business/management context.",Hamburg,data scientist
Data Scientist (M/F/D),,Hamburg,Indivumed,,"Aid quality control of clinical and omics data within the database.
At Indivumed you’ll have access to a truly unique tissue-based oncology data resource.",Hamburg,data scientist
Data Scientist (M/W/D),,Hamburg,Datalogue GmbH,,"Wir bei DATALOGUE wollen die datengetriebene Zukunft aktiv mitgestalten.
Dazu unterstützen wir unsere Kunden, Daten für Sales & Marketing intelligent nutzbar…",Hamburg,data scientist
Junior Data Scientist (M/W/D),,Hamburg,Statista,,Mit unserer High-End-Daten-Plattform und zahlreichen weiteren Produkten und Services aus dem Bereich Market Analysis helfen wir täglich Millionen von Menschen…,Hamburg,data scientist
Data Scientist (F/M/D/-),,Hamburg,SinnerSchrader,,"A cross-functional team of data analysts and data scientists.
Our projects cover all activities of explorative data analysis such as customer segmentation,…",Hamburg,data scientist
Data Scientist (M/W/D),,Hamburg,DATALOGUE Schweiz AG,,"Wir bei DATALOGUE wollen die datengetriebene Zukunft aktiv mitgestalten.
Dazu unterstützen wir unsere Kunden, Daten für *Sales & Marketing* intelligent nutzbar…",Hamburg,data scientist
Data Scientist (M/F/D),,Hamburg,Olympus Europa SE & Co. KG (OEKG),"3,6","Furthermore, you ensure that data science solutions provide promised benefits and that trade-offs and constraints are communicated and well understood.",Hamburg,data scientist
Working Student M/F/D Data Analyst – Regional Commercial,,Hamburg,Hapag-Lloyd AG,,"Acquiredata from primary or secondary data sources and maintain databases/data systems.
Develop andimplementdatabases, data collection systems, data analytics…",Hamburg,data analyst
I&I Data Analyst Project Manager,,Hamburg,Diageo,"4,0","Support with GfK SimIT tool and assess how to best use GfK data.
Build the country focused Northern Europe (NE) GPS PBI update with harmonized GPS data.",Hamburg,data analyst
Controller / Data Analyst (M/W/D),,Hamburg+2 Orte,bonprix,,"In strategischen Fragen haben wir keine Lust auf Linienflüge.
Quer entlang der Customer Journey bieten wir unseren Kund*innen ein nahtloses Service-Erlebnis,…",Hamburg,data analyst
Data Analyst (M/W/D),,Hamburg+1 Ort,TOOLPORT GmbH,,Du konzipierst Simulationen und Modelle zur Planung und Steuerung des operativen Tagesgeschäftes und erarbeitest hierdurch eine wichtige Grundlage für…,Hamburg,data analyst
(Junior) Analyst Market Outlooks (M/F/D),,Hamburg+1 Ort,Statista,,"The Strategic Market Insights team at Statista creates exclusive, data-driven content in the form of market models, expert surveys, and in-depth reports about…",Hamburg,data analyst
Data Analyst (M/W/D),,Hamburg•Homeoffice,FACELIFT bbt GmbH,"5,0","Du trägst die Verantwortung für die Initiativen sowie die datengetriebenen Themen rund um Product Analytics.
Im engen Austausch mit Stakeholdern identifizierst…",Hamburg,data analyst
Data Analyst - Scayle (M/W/D),,Hamburg,ABOUT YOU SE & Co. KG,,"SCAYLE ist die B2B-Division der ABOUT YOU Holding SE und umfasst ein dreiteiliges Service-Portfolio: Commerce Technology, Online Marketing und Commerce…",Hamburg,data analyst
Data & Bi Business Analyst (F/M/D),,Hamburg,Aquila Group,,"Data & BI Business Analyst** (f/m/d)*.
Analyse and document business requirements / change requests / business processes.
Fluent in English and German.",Hamburg,data analyst
Senior Game Analyst / Data Analyst (F/M/X),,Hamburg,Bytro Labs,,"You can take responsibility and shape the data analyst position at Bytro.
Shape and maintain ETL and data integration pipelines.",Hamburg,data analyst
Data Scientist For Business Analytics (M/F/D),,Hamburg,MOIA,"2,3","Proficiency with hypothesis testing and data visualization.
A degree in a quantitative scientific discipline and/or work experience as a data scientist or…",Hamburg,data analyst
Werkstudent Data Analyst / Data Science (W/M/D),,Hamburg,Rhenus Office Systems GmbH,,Als weltweit operierender Logistikdienstleister mit 33.500 Mitarbeitern in über 50 Ländern managen wir komplexe Supply Chains und bieten unseren Kunden…,Hamburg,data analyst
,,Hamburg,Carnival Maritime GmbH,"2,3","First experience in data analytics and data manipulation.
Extract, transform, merge, load & present the whole data analysis life cycle by using ships-automation…",Hamburg,data analyst
Pricing Analyst (M/W/D),,Hamburg,ABOUT YOU SE & Co. KG,,"Stellar analytical skills and distinctive understanding of numbers (you need to like data…).
As our new Pricing Analyst (m/w/d) you will not only support our…",Hamburg,data analyst
Finance Analyst (Development Role),,Hamburg,Shell,"3,9","The job requires excellent communication with the various stakeholders, including senior management.
Deliver the full suite of Finance support (including tax,…",Hamburg,data analyst
Data Analyst (W/M/D),,Hamburg,iVentureGroup,,"Die *iVentureGroup GmbH* ist ein etabliertes und international tätiges Tech-Unternehmen, das sich den Start-Up-Spirit bewahrt hat.
Das erwartet Dich bei uns*.",Hamburg,data analyst
Process Development Scientist Iii,,Altstadt,Cargill France,"3,8","Experience with OSISoft, PI data historian and PI Batch.
The Senior Process Developer Oils and Fats will support process engineering for new Oils and Fats…",Hamburg,data scientist
Data Scientist (Gn),,Hamburg,LichtBlick SE,"2,8","Du hast Erfahrung in data science in einem professionellen Kontext.
Du hast exzellente Programmierkenntnisse in Python inkl. relevanter data manipulation…",Hamburg,data scientist
Data Scientist (M/W/D),,Hamburg,Statista,,Strong skills in identifying appropriate data sources and automating data collection processes including data cleansing and data mining techniques.,Hamburg,data scientist
Clinical Development Scientist (M/W/D),,Hamburg,Philips,"4,0","Knowledge of clinical research, device/drug development processes, regulatory requirements, good clinical and data management practices.",Hamburg,data scientist
(Senior) Data Scientist (M/F/X) – Xing Marketing Solutions,,Hamburg,XING Marketing Solutions,,"Conduct off- and online evaluations of data science features.
Proven track record of designing and operating data science solutions.",Hamburg,data scientist
Data Scientist (Gn),,Hamburg,Lichtblick SE',,"Du hast Erfahrung in data science in einem professionellen Kontext.
Exzellente Programmierkenntnisse in Python inkl. relevanter data manipulation packages sowie…",Hamburg,data scientist
Chapter Lead Data Scientist (M/F/D),,Hamburg,MOIA,"2,3","Effective communication skills with fellow data scientists and business stakeholders.
Knowledge on data visualization with tools like Matplotlib, ggplot2 or…",Hamburg,data scientist
Data Analyst / Scientist (M/W/D) Im Bereich Photovoltaik,,Hamburg,Greentech,,In diesem spannenden Umfeld suchen wir zum nächstmöglichen Zeitpunkt am Standort Hamburg eine/n engagierte/n Data Analyst (m/w/d) in Vollzeit als Verstärkung…,Hamburg,data scientist
Werkstudent Data Analyst / Data Science (W/M/D),,Hamburg,Rhenus Office Systems GmbH,,Als weltweit operierender Logistikdienstleister mit 33.500 Mitarbeitern in über 50 Ländern managen wir komplexe Supply Chains und bieten unseren Kunden…,Hamburg,data scientist
Data Scientist M/W/D Controlling,,Hamburg,Hapag-Lloyd AG,,"Anwendung statistischer Methoden wie deskriptive Analysen, Regressionsverfahren, Zeitreihenanalysen.
Verfahren im Bereich Data Mining & Machine Learning.",Hamburg,data scientist
Data Scientist,,Hamburg,SCHICKLER Unternehmensberatung GmbH,,"Dabei kombinieren wir unser Know How in Strategie, Organisation und Data Science.
Unsere Kunden sind Medienunternehmen in Deutschland, Österreich und der…",Hamburg,data scientist
Data Scientist (F/M/D),,Hamburg,Beiersdorf Shared Services,,"Collaborate with our Data Engineers on the implementation of data pipelines.
Design and implement mathematical models as the heart of our data-driven software…",Hamburg,data scientist
Data Scientist (M/W/D) Tv Data Competence Center,,Hamburg,emetriq GmbH,,"Du hilfst dem Team beim Einsatz von Machine Learning, Deep Learning und NLP (z.B. mit Python, R, Spark, tensorflow) nicht nur op-to-date zu sein, sondern auch…",Hamburg,data scientist
Data Scientist (M/W/D) Dynamic Pricing,,Hamburg,bonprix,,"Wenn man die digitale Fashionwelt revolutionieren will – dann lieber mit mehr Einsen als Nullen!
Deswegen starten wir schon morgens mit einem 1A Seemannsköpper…",Hamburg,data scientist
Data Scientist (M/W/D),,Hamburg,EOS Deutscher Inkasso-Dienst,,"EOS, ein Unternehmen der Otto Group, ist das gemeinsame Dach von über 50 Unternehmen aus dem Bereich der Finanzdienstleistungen.",Hamburg,data scientist
Data Analyst Monitoring & Operations | Payment (M/F/D),,Hamburg,ABOUT YOU SE & Co. KG,,"Our Checkout team is responsible for the complete order lifecycle, from customers first placing items into their baskets to handling the refund of a returned…",Hamburg,data analyst
Data Analyst (W/M/D),,Hamburg+1 Ort,Fielmann AG,"3,3",Erstellen von Standard Reports und Ad-hoc Reports des Warengeschäfts für interne Abteilungen und Lieferanten als Teammitglied im Einkauf Kontaktlinsen.,Hamburg,data analyst
Quality Data Analyst (F/M/D),,Hamburg,Olympus Europa SE & Co. KG,"3,6","Identification of improvement potentials from Quality data.
Development of Quality Reports and KPI`s in the BI System and/or Excel.",Hamburg,data analyst
Business Analyst (F/M/D),,Hamburg,Finc3,,"You have already successfully built complex data models using relational databases.
You will be responsible for the whole Business Intelligence cycle from data…",Hamburg,data analyst
Junior Data Scientist (M/W/D),,Hamburg,Statista,,Mit unserer High-End-Daten-Plattform und zahlreichen weiteren Produkten und Services aus dem Bereich Market Analysis helfen wir täglich Millionen von Menschen…,Hamburg,data analyst
Corporate Finance Analyst (M/F/D),,Hamburg,Archer Daniels Midland Company,"3,6","Strong data manipulation and analytical skills are essential.
The main purpose of the role is to assist in group funding projects, monitor intercompany…",Hamburg,data analyst
,,Hamburg+2 Orte,Salesforce,"4,3","Engage with current and prospect organizations to position Salesforce solutions through strategic value based selling, business case definition, return on…",Hamburg,data analyst
Data Analyst / Scientist (M/W/D) Im Bereich Photovoltaik,,Hamburg,Greentech,,In diesem spannenden Umfeld suchen wir zum nächstmöglichen Zeitpunkt am Standort Hamburg eine/n engagierte/n Data Analyst (m/w/d) in Vollzeit als Verstärkung…,Hamburg,data analyst
Technical Web Analyst (M/W/D),,Hamburg,ZEIT ONLINE GmbH,,"Sie entwickeln Handlungsempfehlungen und präsentieren diese Ihren Stakeholdern.
Auch die Konzeption und Implementierung datenschutzkonformer Web-Tracking- und…",Hamburg,data analyst
(Junior) Research Data (Insights) Analyst (M/W/D),,Hamburg,annalect,,Du hast ein abgeschlossenes Studium mit Schwerpunkt empirische Sozial-/Marktforschung (Sozial-/Kulturwissenschaften) oder BWL mit Schwerpunkt Marketing…,Hamburg,data analyst
Junior Data Analyst / Bi Manager (M/W/D),,Hamburg,Mobile Trend GmbH,,"Du setzt die Automatisierung unserer Reports um und implementierst neue KPIs innerhalb dieser.
Du untersuchst Zusammenhänge in den Metriken und definierst KPIs…",Hamburg,data analyst
Senior Data Analyst - Product (M/F/D),,Hamburg,FREE NOW,"4,0","Support of our data driven product development through analysis of transactional, in-app, and external data.
Work closely with our software programmers and data…",Hamburg,data analyst
Data Scientist (F/M/D/-),,Hamburg,SinnerSchrader,,"A cross-functional team of data analysts and data scientists.
Our projects cover all activities of explorative data analysis such as customer segmentation,…",Hamburg,data analyst
Senior Data Analyst - Product (M/F/D),,Hamburg,Jimdo,,Our mission is to foster the understanding and usage of data throughout the company and enable data-driven decision making.,Hamburg,data analyst
Working Student Technical Business Analyst / Programmer,,Hamburg,Adobe,"4,3","Our team consists of data scientists and engineers designing data products such as derived metrics, dashboards and reports that help other business functions…",Hamburg,data analyst
Medical Evidence Scientist (Onkologie) (M/W/D),,Hamburg,AstraZeneca,"4,1","Wenn Sie jetzt denken „Hier ist meine Zukunft!“, dann freuen wir uns auf Ihre Bewerbung als Medical Evidence Scientist (Onkologie) (m/w/d).",Hamburg,data scientist
,,Hamburg,Sasol,,"Data Scientist, Full Stack Developer*in.
Sasol in Deutschland ist Teil der südafrikanischen Sasol-Gruppe, einem internationalen, integrierten Chemie- und…",Hamburg,data scientist
Data Scientist - Consumer Analytics (M/W/D),,Hamburg,British American Tobacco,"4,4","The Data Scientist (with data focus) will be responsible for establishing connections to respective data sources, optimizing datasets, building production-ready…",Hamburg,data scientist
,,Hamburg,November,"4,3","You will work with various data channels and you will implement and realize Data Cleansing to make the data workable.
You will setup and grow DWH.",Hamburg,data scientist
Data-Scientist (M/W/D),,Hamburg,Möhrle Happ Luther,,Aufbau von Expertise in state-of-the-art Data Governance Werkzeugen und Zusammenarbeit mit unseren Software Partnerschaften.,Hamburg,data scientist
Senior Data Scientist (M/W/D),,Hamburg,EOS Deutscher Inkasso-Dienst,,"EOS, ein Unternehmen der Otto Group, ist das gemeinsame Dach von über 50 Unternehmen aus dem Bereich der Finanzdienstleistungen.",Hamburg,data scientist
Data Engineer (M/W/D) Tv Data Competence Center,,Hamburg,emetriq GmbH,,Du aggregierst diverse Datenquellen von innerhalb und außerhalb des Data Lake in konsistentes und dokumentiertes Reporting (Data Warehouse).,Hamburg,data scientist
Senior Data Scientist (M/W/D),,Hamburg,CompuGroup Medical,"2,7","Standorte in 18 und Produkte in 56 Ländern.
Werde ALL IN! for Health als Senior Data Scientist (m/w/d).
Docmetric bietet Dir die Möglichkeit, sich in einem…",Hamburg,data scientist
Data Engineer,,Hamburg,Namics,,"Create and maintain data tools for data scientist / analyst teams that assist them in building and optimizing data algorithms like AI / Machine Learning models,…",Hamburg,data scientist
(Senior) Data Scientist (M/W/D),,Hamburg,emetriq GmbH,,"Durch eine proaktive Arbeitsweise hilfst du uns, in den Bereichen Machine Learning und Data Mining nicht nur up-to-date zu sein, sondern auch vorauszudenken.",Hamburg,data scientist
Senior Data Engineer (M/W/D) Tv Data Competence Center,,Hamburg,emetriq GmbH,,"Du hilfst uns, bei der Weiterentwicklung der Reporting- und ML-Pipeline für MagentaTV nicht nur up-to-date zu sein, sondern auch vorauszudenken und wendest…",Hamburg,data scientist
Data Engineer,,Hamburg,Merkle DACH,,"Create and maintain data tools for data scientist / analyst teams that assist them in building and optimizing data algorithms like AI / Machine Learning models,…",Hamburg,data scientist
Data Scientist (M/W/D),,Hamburg,celver AG,,"Du gestaltest zielstrebig herausfordernde Data Science-Projekte in einem interdisziplinären Team.
Du konzipierst innovative Lösungen mithilfe moderner Methoden…",Hamburg,data scientist
Data Scientist (M/W/D),,Hamburg,Parship Group,,"Für unseren Hauptsitz in Hamburg suchen wir einen Data Scientist (m/w/d) in Vollzeit.
Deine Verantwortung bei uns im BI & Data Technology Team.",Hamburg,data scientist
"Berater Business Intelligence (M/W/D) – (Data Engineer, Data...",,Barmbek,initions GmbH,,"Festanstellung , full-time · Hamburg-Barmbek.
Zum Einsatz kommen „state of the art“ Konzepte, Technologien und Werkzeuge der führenden Hersteller wie Microsoft,…",Hamburg,data scientist
Working Student Technical Business Analyst / Programmer,,Hamburg,Adobe,"4,3","Our team consists of data scientists and engineers designing data products such as derived metrics, dashboards and reports that help other business functions…",Hamburg,data analyst
(Junior) Web Analyst (F/M/D/-),,Hamburg,SinnerSchrader,,You support our clients with analyses in Adobe or Google Analytics and help with the further development of the data and tool landscape.,Hamburg,data analyst
Data Analyst (M/W/D),,Hamburg,ALTEN Engineering,"3,0","Werden Sie Teil unseres dynamischen und wachsenden Teams als Data Analyst (m/w/d).
Sie können auch der Fokus für unsere digitalen Prozessoptimierungsschritte…",Hamburg,data analyst
,,Hamburg,The Data School von The Information Lab,,"Die Data School – dein Karriere-Sprungbrett in der Datenanalyse mit Standorten in London, Hamburg, Sydney, New York und Melbourne.",Hamburg,data analyst
Data Analyst (Consumer) (F/M/D),,Hamburg,Beiersdorf AG,"4,1","Be responsible for key aspects along the data modeling cycle from definition of business questions and hypotheses to data sourcing and preparation, model…",Hamburg,data analyst
Direct Tax Analyst,,Hamburg,Amazon Deutschland Servcs GmbH,"3,5","Demonstrable advisory experience in a large accounting/consultancy practice, law firm, tax authority or business in-house.",Hamburg,data analyst
Data Engineer (F/M/D),,Hamburg,Container xChange,,"Extract data from our data sources and pipe it into the warehouse.
Experience in setting up scalable data infrastructures.",Hamburg,data analyst
Team Lead Data Science & Analytics (Gn),,Hamburg,LichtBlick SE,"2,8","Exzellente Programmierkenntnisse in Python inklusive relevanter data manipulation packages sowie SQL und MLOps Erfahrung.
Erfahrung mit PowerBI (nice to have).",Hamburg,data analyst
,,Hamburg,Abbott Laboratories,"4,0","Management of large amounts of data into formats useful to management a must.
Senior Financial Analyst (m/f/d).
Fluent in German (Good English an advantage).",Hamburg,data analyst
Web-Analyst (W/M/D),,Hamburg,HAUSGOLD - talocasa GmbH,"3,5","Werde auch Du Teil unserer Erfolgsgeschichte - als Web-Analyst (m/w/d) in Vollzeit.
Als Web-Analyst (w/m/d) verstehst Du dich als Architekt unserer Tracking-…",Hamburg,data analyst
Data Analyst (M/F/D),,Hamburg,NXP Semiconductors,"3,8","In-depth ability in analyzing and identifying data relationships and data quality issues.
Combining these sources in a data model.",Hamburg,data analyst
,,Hamburg,exmox GmbH,,"Partner with the engineering team to create new data sources & ensure data integrity of existing sources.
3+ years working with and supporting business and/or…",Hamburg,data analyst
Financial Analyst (M/F/D),,Hamburg,Gossmann & Cie. GmbH,,"Gossmann & Cie. is a Liability Management Company that provides holistic and data-intuitive solutions for the management.
Of insurance risk-related liabilities.",Hamburg,data analyst
Junior Data Engineer (M/F/D),,Hamburg,Artefact,"3,9","To develop and present data recommendations to clients,.
You know how to set up and deploy NLP model provided by our data scientists.",Hamburg,data analyst
,,Fuhlsbüttel,Airbus,"4,2","Enjoy dealing with data and data structures.
With a focus on business needs, extract / integrate both structured /unstructured data from various databases/data…",Hamburg,data analyst
(Senior) Computer Scientist,,Hamburg,Adobe,"4,3","Mastery in scripting languages for automation, analysis, and data engineering.
It operates across multiple regions on Amazon Web Services (AWS) and Microsoft…",Hamburg,data scientist
Senior Data Engineer (M|W|D) Remote,,Hamburg•Homeoffice,EOS Holding,,"EOS, ein Unternehmen der Otto Group, ist das gemeinsame Dach von über 50 Unternehmen aus dem Bereich der Finanzdienstleistungen.",Hamburg,data scientist
(Senior) Data Scientist (W/M/D),,Hamburg,freenet Group,"3,0",Der Bereich Data & Intelligence entwickelt und betreibt auf einer skalierenden AWS Infrastruktur eine wachsende Zahl an datengetriebenen Lösungen mit…,Hamburg,data scientist
Data Scientist / Dynamic Pricing,,Hamburg,Oxygen Digital Recruitment,,"Using the latest Big Data technology along with ML methods the group determines, optimises and personalises their customer’s profiles and journeys.",Hamburg,data scientist
