title,salary,location,employer,employer_rating,summary,search_city,search_role
Data Scientist,"$55,590 - $118,000 a year","Montréal, QC•Temporarily Remote",Genpact,,"Knowledge of best practices in data analysis and data science.
Maintains complex data pipeline supporting our team’s mission in democratizing data and enabling…",Montreal,data_scientist
Consultant,,"Montréal, QC•Temporarily Remote",Fusion Analytics,,"Team builders (e.g. BBQs, board game nights).
Work with the executive team of a pharmacy to rethink their overall strategy.
Job Types: Full-time, Permanent.",Montreal,data_scientist
Analytics Data Scientist,"$70,000 - $85,000 a year","Montréal, QC•Temporarily Remote",BrainFinance,4.2,Exploratory data analysis employing large data sets involving visualization and basic statistical techniques to develop intuitions and identify key variables in…,Montreal,data_scientist
"Data Scientist Technical Lead (Montreal), Intact Lab",,"Montréal, QC•Remote",Intact,3.8,Coaching and mentoring of senior data scientists on technical matters and act as a technical reference for management.,Montreal,data_scientist
,,"Brossard, QC•Remote",Power Factors,,"Interpreting data, analyzing results using statistical techniques;
Our platforms collect millions of IIoT and other data points, cleans data, detects issues,…",Montreal,data_scientist
Senior Data Scientist - Research Lab Management,,"Montréal, QC",Groom & Associes,4.3,This laboratory will work in close collaboration with research centers based in France for data intelligence and that of Xdev for blockchain.,Montreal,data_scientist
Data Scientist,,"Montréal, QC",ei3 Corporation,,"You will work as part of our international team of Data Scientists, developing and implementing data science algorithms in ei3 that work on machine data to.",Montreal,data_scientist
"Senior Data Scientist, Intact Lab",,"Montréal, QC",Intact,3.8,"Help maintain our data mining tools and platforms.
A multi-platform production experience with the following commercial and open-source data mining frameworks:",Montreal,data_scientist
Montreal - R&D Data Scientist,"$70,000 - $80,000 a year","Montréal, QC",Rubicon HR Canada,,"The job is an English-speaking position, but French-speaking would be a bonus.
For over five years they have been a growing and innovating enterprise in the TMS…",Montreal,data_scientist
Scientifique Principal Chargé Des Données | Senior Data Scie...,,"Montréal, QC",Sonder,3.3,The team creates and implements data-driven pricing strategies to optimize revenue and is responsible for the ongoing development of our forecasting models.,Montreal,data_scientist
Data Engineering Specialist,,"Montréal, QC",Maya HTT,4.3,"Collaborating with data scientist to create the right data pipelines.
Presenting data mining and early data finding results in a clear manner.",Montreal,data_scientist
Senior Sales Engineer,,"Montréal, QC",Forethought,,"Our products enable seamless customer experiences by infusing intelligence at each stage of the customer support journey: resolving common cases instantly,…",Montreal,data_scientist
"Analyste, Intelligence Client",,"Montréal, QC",L'Équipe Spectra,3.6,"(data collection, management and storage, data modeling and presentation, etc.).
Create and enforce policies for effective data management.",Montreal,data_analyst
"Analyst, Forecasting & Planning",,"Saint-Laurent, QC",VF Corporation,3.8,"Planning Departments to audit and confirm data and develop strategies and solve problems.
The primary responsibilities of the Forecasting & Planning Analyst are…",Montreal,data_analyst
Analyst – Control Systems,,"Longueuil, QC",Pratt & Whitney,3.9,"Review and interpret test data produced during validation testing.
He/She will also work closely with suppliers to verify software, and review data for control…",Montreal,data_analyst
"Senior Analyst, Broking And Financial Management",,"Montréal, QC",Aon Corporation,3.7,"Working with a team of analysts and senior team leaders you will be involved with a variety of client deliverables including but not limited to annual renewals,…",Montreal,data_analyst
,,"Montréal, QC",Bell Canada,3.8,"Defining business requirements, data mapping rules, data selection/exclusion rules and Business admin configuration of the ServiceNow platform for Bell HR.",Montreal,data_analyst
Senior Business Systems Analyst - Telus Health,,"Montréal, QC",TELUS,3.9,"Utilize complex SQL skills to troubleshoot data related issues;
Strong data analysis with ability to handle complex business rules;",Montreal,data_analyst
Analyste Fonctionnel,,"Montréal, QC",Transition Services Conseils Inc,,"Experience completing client-server or Web systems development projects as a functional analyst.
Conduct or take part in analyses arising from prioritized and…",Montreal,data_analyst
Analyste Assurance Qualité - Software Quality Assurance,,"Montréal, QC",Nuance,3.2,"Create specifications for test data and test environments.
L'analyste en assurance qualité sera responsable d'automatiser de nouveaux tests, d'exécuter des…",Montreal,data_analyst
Bilingual Advisory Analyst,,"Montréal, QC",Hatch,3.9,"Strong data analytics skills, including experience with business requirements gathering, analysis and ability to translate business requirements into technical…",Montreal,data_analyst
"Staff Software Engineer, Data - Slack",,"Montréal, QC",Salesforce,4.3,"6+ years of experience working in data architecture, data modeling, master data management, metadata management.",Montreal,data_analyst
"Analyste Principal, Fichiers Maîtres / Sr Analyst, Master Da...",,"Montréal, QC•Remote",Domtar,3.7,"After validations are done, the master data is then maintained in the systems.
Handle requests from different business groups for creations and changes to the…",Montreal,data_analyst
Intern Model Risk Management - Summer 2022,,"Montréal, QC",Société Générale,3.9,"You have a strong background in statistics/econometrics and data science;
This individual will use statistical technique and/or data science (ML/AI) to tackle…",Montreal,data_analyst
"Peoplesoft Application Administrator, Intermediate","$74,676 - $89,201 a year","Montréal, QC",Universite Concordia,4.1,"Perform upgrades, patches, replications, data refreshes, performance tuning and monitoring.
Work closely with DBA’s to ensure PeopleSoft application servers and…",Montreal,data_analyst
Senior Consultant,,"Montréal, QC",Virtusa,3.7,"Knowledge of data governance and master data management concepts.
You will be responsible for the collection of information and requirements from customers, as…",Montreal,data_analyst
"Senior Qa Analyst, Automation",,"Montréal, QC",WarnerMedia,,Provide valuable and meaningful data and information to the internal and external partners to help launch products at the desired quality level.,Montreal,data_analyst
Researcher Scientist - Industrial Data,,"Pointe-Claire, QC",FPInnovations,3.9,"Retrieve, prepare, and process a rich variety of data sources such as operational data from 3rd party database systems (build data pipeline).",Montreal,data_scientist
Pricing Data Scientist,,"Montréal, QC",Sonder,3.3,"Drive revenue growth by developing, deploying and testing optimal pricing algorithms and strategies across Sonder's portfolio of units.",Montreal,data_scientist
"Data Scientist, Ads Unit / Scientifique De Données, Ads Unit",,"Montréal, QC",Unity Technologies,,"Drive Unity's user acquisition product in close collaboration with other data scientists, product managers, and engineers.
Convey ideas and assist execution.",Montreal,data_scientist
Data Scientist,"$55,590 - $118,000 a year","Montréal, QC•Temporarily Remote",Genpact,,"Knowledge of best practices in data analysis and data science.
Maintains complex data pipeline supporting our team’s mission in democratizing data and enabling…",Montreal,data_scientist
Consultant,,"Montréal, QC•Temporarily Remote",Fusion Analytics,,"Team builders (e.g. BBQs, board game nights).
Work with the executive team of a pharmacy to rethink their overall strategy.
Job Types: Full-time, Permanent.",Montreal,data_scientist
Analytics Data Scientist,"$70,000 - $85,000 a year","Montréal, QC•Temporarily Remote",BrainFinance,4.2,Exploratory data analysis employing large data sets involving visualization and basic statistical techniques to develop intuitions and identify key variables in…,Montreal,data_scientist
"Data Scientist Technical Lead (Montreal), Intact Lab",,"Montréal, QC•Remote",Intact,3.8,Coaching and mentoring of senior data scientists on technical matters and act as a technical reference for management.,Montreal,data_scientist
,,"Brossard, QC•Remote",Power Factors,,"Interpreting data, analyzing results using statistical techniques;
Our platforms collect millions of IIoT and other data points, cleans data, detects issues,…",Montreal,data_scientist
Senior Data Scientist - Research Lab Management,,"Montréal, QC",Groom & Associes,4.3,This laboratory will work in close collaboration with research centers based in France for data intelligence and that of Xdev for blockchain.,Montreal,data_scientist
Data Scientist,,"Montréal, QC",ei3 Corporation,,"You will work as part of our international team of Data Scientists, developing and implementing data science algorithms in ei3 that work on machine data to.",Montreal,data_scientist
"Senior Data Scientist, Intact Lab",,"Montréal, QC",Intact,3.8,"Help maintain our data mining tools and platforms.
A multi-platform production experience with the following commercial and open-source data mining frameworks:",Montreal,data_scientist
Montreal - R&D Data Scientist,"$70,000 - $80,000 a year","Montréal, QC",Rubicon HR Canada,,"The job is an English-speaking position, but French-speaking would be a bonus.
For over five years they have been a growing and innovating enterprise in the TMS…",Montreal,data_scientist
Scientifique Principal Chargé Des Données | Senior Data Scie...,,"Montréal, QC",Sonder,3.3,The team creates and implements data-driven pricing strategies to optimize revenue and is responsible for the ongoing development of our forecasting models.,Montreal,data_scientist
Data Engineering Specialist,,"Montréal, QC",Maya HTT,4.3,"Collaborating with data scientist to create the right data pipelines.
Presenting data mining and early data finding results in a clear manner.",Montreal,data_scientist
Senior Sales Engineer,,"Montréal, QC",Forethought,,"Our products enable seamless customer experiences by infusing intelligence at each stage of the customer support journey: resolving common cases instantly,…",Montreal,data_scientist
Analyste De Systèmes | Systems Analyst,,"Montréal, QC",Edelman,3.7,"Develop, analyze, prioritize, and organize requirement specifications, data mapping, diagrams, and flowcharts for developers and testers to follow.",Montreal,data_analyst
It Business Analyst (6+ Month Contract),,"Montréal, QC",DELAN - IT Head Hunters,,"9+ years of experience as an IT Business Analyst, versatility on large-scale projects, experience in analysis and modeling of business processes (asset),…",Montreal,data_analyst
Senior Research Manager- Healthcare,,"Montréal, QC",Ipsos North America,3.7,"Managing key operational partners (data collection, data processing and results reporting) to ensure that reliable results are delivered to client in a timely,…",Montreal,data_analyst
"Analyst, Retirement And Annuity Purchase",,"Montréal, QC",Mercer,3.5,"Perform retirement plans actuarial valuation including validation of data, analysis of the plan’s gains and losses, analysis of the plan’s asset performance,…",Montreal,data_analyst
"Data Scientist, Validation And Monitoring",,"Montréal, QC",Desjardins,3.9,"As a data scientist, risk model validation and monitoring, you provide the data needed to make business decisions, develop solutions and services adapted to…",Montreal,data_analyst
Technical Ba,,"Montréal, QC",AiquestInc,,"Excellent knowledge in SQL and relational data modelling.
Using tools such as Visio for data and process modelling, use case diagrams.",Montreal,data_analyst
Network & Security Systems Analyst,,"Montréal, QC",Corning,3.8,"Secure highly sensitive data appropriately.
Reporting to the Information Technology Manager as part of the Information Technology department, the Network &…",Montreal,data_analyst
Functional/Technical Analyst Oracle Erp Cloud (Finance),,"Montréal, QC",CGI Inc,3.6,"O Mastering of the data model in Oracle ERP Cloud.
Within CGI’s ERP Centre of Expertise, the successful candidate will act as an Oracle ERP Cloud Functional…",Montreal,data_analyst
Pega Senior Software Engineer,,"Montréal, QC",Sun Life Financial,3.9,"Competitive salary and bonus structure influenced by market range data.
Collaborate with architects, designers/developers, business system analysts and testing…",Montreal,data_analyst
,,"Montréal, QC",opentext,3.5,"Ability to analyze data sets, determine the gaps and create reports on the findings.
The Senior Security Analyst will understand a wide array of security…",Montreal,data_analyst
"Analyste De Données, Intelligence D'Affaires",,"Montréal, QC",Ivanhoe Cambridge,3.9,"Ivanhoé Cambridge s’engage à créer des espaces vivants qui favorisent le bien-être des gens et des communautés, tout en réduisant son empreinte écologique.",Montreal,data_analyst
Production Planner,,"Candiac, QC",Cascades,3.1,"Reporting to the Director Demand Planning and Supply, the Production Planner’s mission is to develop the master production plan in order to efficiently…",Montreal,data_analyst
"Vice President, Information Technology",,"Boucherville, QC•Remote",FOUR CORNERS GROUP,,"+ Managing all data management and architecture and SKU set up in the systems.
The function is currently supported by a team of approximately 40 employees…",Montreal,data_analyst
"(Remote) Senior Data Scientist, Growth - Personalization",,"Montréal, QC•Remote",Hopper,3.6,"Use machine learning and big data tools on large and complex data sets to enhance our data-driven, personalized travel advice.",Montreal,data_analyst
Customer Compliance Analyst,,"Dorval, QC",Bombardier,3.8,"You are an expert in Excel and data manipulation.
You have knowledge of aviation compliance requirements namely anti-corruption, sanctions, data privacy.",Montreal,data_analyst
Researcher Scientist - Industrial Data,,"Pointe-Claire, QC",FPInnovations,3.9,"Retrieve, prepare, and process a rich variety of data sources such as operational data from 3rd party database systems (build data pipeline).",Montreal,data_scientist
Pricing Data Scientist,,"Montréal, QC",Sonder,3.3,"Drive revenue growth by developing, deploying and testing optimal pricing algorithms and strategies across Sonder's portfolio of units.",Montreal,data_scientist
"Data Scientist, Ads Unit / Scientifique De Données, Ads Unit",,"Montréal, QC",Unity Technologies,,"Drive Unity's user acquisition product in close collaboration with other data scientists, product managers, and engineers.
Convey ideas and assist execution.",Montreal,data_scientist
Data Scientist,"$55,590 - $118,000 a year","Montréal, QC•Temporarily Remote",Genpact,,"Knowledge of best practices in data analysis and data science.
Maintains complex data pipeline supporting our team’s mission in democratizing data and enabling…",Montreal,data_scientist
Consultant,,"Montréal, QC•Temporarily Remote",Fusion Analytics,,"Team builders (e.g. BBQs, board game nights).
Work with the executive team of a pharmacy to rethink their overall strategy.
Job Types: Full-time, Permanent.",Montreal,data_scientist
Analytics Data Scientist,"$70,000 - $85,000 a year","Montréal, QC•Temporarily Remote",BrainFinance,4.2,Exploratory data analysis employing large data sets involving visualization and basic statistical techniques to develop intuitions and identify key variables in…,Montreal,data_scientist
"Data Scientist Technical Lead (Montreal), Intact Lab",,"Montréal, QC•Remote",Intact,3.8,Coaching and mentoring of senior data scientists on technical matters and act as a technical reference for management.,Montreal,data_scientist
,,"Brossard, QC•Remote",Power Factors,,"Interpreting data, analyzing results using statistical techniques;
Our platforms collect millions of IIoT and other data points, cleans data, detects issues,…",Montreal,data_scientist
Senior Data Scientist - Research Lab Management,,"Montréal, QC",Groom & Associes,4.3,This laboratory will work in close collaboration with research centers based in France for data intelligence and that of Xdev for blockchain.,Montreal,data_scientist
Data Scientist,,"Montréal, QC",ei3 Corporation,,"You will work as part of our international team of Data Scientists, developing and implementing data science algorithms in ei3 that work on machine data to.",Montreal,data_scientist
"Senior Data Scientist, Intact Lab",,"Montréal, QC",Intact,3.8,"Help maintain our data mining tools and platforms.
A multi-platform production experience with the following commercial and open-source data mining frameworks:",Montreal,data_scientist
Montreal - R&D Data Scientist,"$70,000 - $80,000 a year","Montréal, QC",Rubicon HR Canada,,"The job is an English-speaking position, but French-speaking would be a bonus.
For over five years they have been a growing and innovating enterprise in the TMS…",Montreal,data_scientist
Scientifique Principal Chargé Des Données | Senior Data Scie...,,"Montréal, QC",Sonder,3.3,The team creates and implements data-driven pricing strategies to optimize revenue and is responsible for the ongoing development of our forecasting models.,Montreal,data_scientist
Data Engineering Specialist,,"Montréal, QC",Maya HTT,4.3,"Collaborating with data scientist to create the right data pipelines.
Presenting data mining and early data finding results in a clear manner.",Montreal,data_scientist
Senior Sales Engineer,,"Montréal, QC",Forethought,,"Our products enable seamless customer experiences by infusing intelligence at each stage of the customer support journey: resolving common cases instantly,…",Montreal,data_scientist
"Senior Manager, Network & Telecommunication",,"Lasalle, QC",Labatt Breweries of Canada,3.1,"Maintain Canada service levels for end user computing, network performance including voice and data.
Month end meeting with department financial analyst and…",Montreal,data_analyst
"Programmer Analyst, System And Infrastructure Operations, Ma...",,"Montréal, QC",Desjardins,3.9,"Actively help develop execution strategies, and analyze and develop software products (design, code, and automate run tests), while applying development, data…",Montreal,data_analyst
Workday Data Conversion Lead,,"Montréal, QC",KPMG,3.9,"Facilitate data gathering workshops and proactively manage client’s expectation throughout each tenant build.
Working knowledge of Alteryx is a plus.",Montreal,data_analyst
Technical Program Manager,,"Montréal, QC•Remote",Yelp,,"To accomplish that, we employ a wide variety of approaches including business analysis, modeling, data engineering, data governance, and auction theory.",Montreal,data_analyst
Lease Administration Analyst (Contract),,"Montréal, QC",JLL,3.7,"Ability to understand and interpret data.
Our Lease Administration platform supports a diverse set of client needs from basic management of lease abstractions…",Montreal,data_analyst
Fp&A Financial Analyst / Analyste Financier Fp&A,,"Montréal, QC",JAM Industries Ltd.,3.2,"Actively involved in the preparation of the company’s division / department budgets.
Maintain monthly, quarterly, and annual revised forecasts (Sales, Margins,…",Montreal,data_analyst
Stagiaire - Data Analyst & Solution (H/F),,"Montréal, QC•Remote",BNP Paribas,3.9,"Assist and perform walk through and data collection exercises with CIB Operations teams as required.
Access to social volunteer and recreational programs, via…",Montreal,data_analyst
"Director, Wealth Sales, Montreal",,"Montréal, QC•Remote",Sun Life Financial,3.9,"Consult with Investment Professionals to help build their business through product knowledge, prospecting, lead generation, industry and competitive data.",Montreal,data_analyst
,,"Montréal, QC",CAA Québec,4.0,Le service Intelligence d’affaires valorise la donnée et développe la connaissance pour contribuer à la définition et à la réalisation d’initiatives d’affaires.,Montreal,data_analyst
"Programmer Analyst, Fullstack, Angular",,"Montréal, QC•Remote",Desjardins,3.9,"Play an active role in developing execution strategies and analyze and develop software products, including design, coding, test automation and operations,…",Montreal,data_analyst
Programmer Analyst,,"Dorval, QC",Bombardier,3.8,"Extract, import, process and document source data.
Be responsible for the design, implementation and documentation of new web applications.",Montreal,data_analyst
Technology Consultant (Elements Contact Cloud Team),,"Montréal, QC",TELUS,3.9,"Known to proactively identifying issues and opportunities, analyzing facts and data, and developing and implementing solutions to address.",Montreal,data_analyst
Payroll Analyst (Remote),,"Kirkland, QC•Remote",IQVIA,3.8,"Accurate and efficient data entry skills.
Handle basic earning & deduction payroll system configuration, data audits of confidential employee information, and…",Montreal,data_analyst
Salesforce Administrator,,"Montréal, QC",Stingray,3.8,"Ensure the proper use of the platform as well as data quality.
Participate in the integration of the various Stingray’s platforms with Salesforce, to optimize…",Montreal,data_analyst
"Manager, Business Intelligence & Distribution Process",,"Boucherville, QC",Lowe's Canada,3.5,"Knowledge of data visualization tools and techniques (e.g., Tableau, PowerBI, Looker).
Support and work directly with Lowe’s India’s business centre analysts to…",Montreal,data_analyst
Researcher Scientist - Industrial Data,,"Pointe-Claire, QC",FPInnovations,3.9,"Retrieve, prepare, and process a rich variety of data sources such as operational data from 3rd party database systems (build data pipeline).",Montreal,data_scientist
Pricing Data Scientist,,"Montréal, QC",Sonder,3.3,"Drive revenue growth by developing, deploying and testing optimal pricing algorithms and strategies across Sonder's portfolio of units.",Montreal,data_scientist
"Data Scientist, Ads Unit / Scientifique De Données, Ads Unit",,"Montréal, QC",Unity Technologies,,"Drive Unity's user acquisition product in close collaboration with other data scientists, product managers, and engineers.
Convey ideas and assist execution.",Montreal,data_scientist
Data Scientist,"$55,590 - $118,000 a year","Montréal, QC•Temporarily Remote",Genpact,,"Knowledge of best practices in data analysis and data science.
Maintains complex data pipeline supporting our team’s mission in democratizing data and enabling…",Montreal,data_scientist
Consultant,,"Montréal, QC•Temporarily Remote",Fusion Analytics,,"Team builders (e.g. BBQs, board game nights).
Work with the executive team of a pharmacy to rethink their overall strategy.
Job Types: Full-time, Permanent.",Montreal,data_scientist
Analytics Data Scientist,"$70,000 - $85,000 a year","Montréal, QC•Temporarily Remote",BrainFinance,4.2,Exploratory data analysis employing large data sets involving visualization and basic statistical techniques to develop intuitions and identify key variables in…,Montreal,data_scientist
"Data Scientist Technical Lead (Montreal), Intact Lab",,"Montréal, QC•Remote",Intact,3.8,Coaching and mentoring of senior data scientists on technical matters and act as a technical reference for management.,Montreal,data_scientist
,,"Brossard, QC•Remote",Power Factors,,"Interpreting data, analyzing results using statistical techniques;
Our platforms collect millions of IIoT and other data points, cleans data, detects issues,…",Montreal,data_scientist
Senior Data Scientist - Research Lab Management,,"Montréal, QC",Groom & Associes,4.3,This laboratory will work in close collaboration with research centers based in France for data intelligence and that of Xdev for blockchain.,Montreal,data_scientist
Data Scientist,,"Montréal, QC",ei3 Corporation,,"You will work as part of our international team of Data Scientists, developing and implementing data science algorithms in ei3 that work on machine data to.",Montreal,data_scientist
"Senior Data Scientist, Intact Lab",,"Montréal, QC",Intact,3.8,"Help maintain our data mining tools and platforms.
A multi-platform production experience with the following commercial and open-source data mining frameworks:",Montreal,data_scientist
Montreal - R&D Data Scientist,"$70,000 - $80,000 a year","Montréal, QC",Rubicon HR Canada,,"The job is an English-speaking position, but French-speaking would be a bonus.
For over five years they have been a growing and innovating enterprise in the TMS…",Montreal,data_scientist
Scientifique Principal Chargé Des Données | Senior Data Scie...,,"Montréal, QC",Sonder,3.3,The team creates and implements data-driven pricing strategies to optimize revenue and is responsible for the ongoing development of our forecasting models.,Montreal,data_scientist
Data Engineering Specialist,,"Montréal, QC",Maya HTT,4.3,"Collaborating with data scientist to create the right data pipelines.
Presenting data mining and early data finding results in a clear manner.",Montreal,data_scientist
Senior Sales Engineer,,"Montréal, QC",Forethought,,"Our products enable seamless customer experiences by infusing intelligence at each stage of the customer support journey: resolving common cases instantly,…",Montreal,data_scientist
