title,salary,location,employer,employer_rating,summary,search_city,search_role
Data Management Specialist,,"Montréal, QC",BNP Paribas,3.9,"Champion the value of data dictionaries, data ownership and metadata management to key business stakeholders.
Functional knowledge and skills in database design…",Montreal,data_analyst
Budget Analyst,"$69,160 - $82,608 a year","Montréal, QC",Universite Concordia,4.1,Analyze data and provide monthly reports and forecasts on the budget position; liaise with the various directorates as well as financial services to ensure…,Montreal,data_analyst
Qc - 2022 It Internship Program,,"Montréal, QC",Bell Canada,3.8,"Monitor and vet major architectural decisions, changes, and open issues (e.g. data placement, tool/technology product selection, interfaces, new data stores,…",Montreal,data_analyst
"Analyst, Application Development & Maintenance – Loyalty",,"Dorval, QC",Air Canada,3.8,"Reviewing and analyzing data from multiple internal and external stakeholders.
Work closely with relevant stakeholders to collect and use information for…",Montreal,data_analyst
Intern Credit Analyst - Summer 2022,,"Montréal, QC",Société Générale,3.9,"Working closely with and reporting to the Managing Director and Senior Banker of Canada’s Financial Institutions (FI) Group, the individual will support the FIG…",Montreal,data_analyst
,,"Montréal, QC",TELUS,3.9,"Montreal, Quebec, CA Edmonton, AB, CA Calgary, AB, CA Toronto, ON, CA Vancouver, British Columbia, CA.
L’équipe Marketing, stratégie et analyse de données,…",Montreal,data_analyst
"Analyst, Merchandising Support",,"Boucherville, QC",Lowe's Canada,3.5,"With this in mind, Lowe's is looking for analysts - merchandising operations support.
Reporting to the Master Data Management team, the analyst participates in…",Montreal,data_analyst
Devops Analyst,,"Montréal, QC",Talan,,"To promote agility, software craftmanship and DevOps practices in SG, the CDP team is providing all the tools and platforms for developers, as the IDE, the SDKs…",Montreal,data_analyst
Cybersecurity Endpoint Analyst / Analyste En Cybersécurité D...,,"Saint-Laurent, QC",CAE Inc.,3.6,"The CAE security operation team is looking for a Digital Security Endpoint analyst to be a part of the Secops team responsible for delivering, supporting, and…",Montreal,data_analyst
,,"Saint-Laurent, QC•Remote",CAE Inc.,3.6,"Préparer, analyser et vérifier les notes trimestrielles et annuelles des états financiers consolidés ainsi que toutes les présentations pertinentes.",Montreal,data_analyst
Analyste D'Affaires - Business Analyst,,"Saint-Laurent, QC",CAE Inc.,3.6,The Finance BI Reporting group receives requests from internal clients to create BI reports and dashboards using data stored within an enterprise data warehouse…,Montreal,data_analyst
Senior Data Analyst,,"Montréal, QC",BGIS,3.1,"Ensures business data and analysis requirements are met by properly applying data concepts, including data structures, collection and cleansing, and structured…",Montreal,data_analyst
,,"Montréal, QC",Rio Tinto,3.9,"Discuss with the various users to ensure data integrity in the database and suggest modifications to data ingestion.
Connaissance de SQL est un atout.",Montreal,data_analyst
,,"Montréal, QC",SSENSE,3.0,"Experience using data visualization tools (Tableau, Power BI).
Liaise with internal and external stakeholders to collect data in support of mandated analyses.",Montreal,data_analyst
Business Analyst,,"Montréal, QC•Remote",BNP Paribas,3.9,"Manage a small number of project resources (business analysts, developers and testers).
Access to social volunteer and recreational programs, via our many…",Montreal,data_analyst
Researcher Scientist - Industrial Data,,"Pointe-Claire, QC",FPInnovations,3.9,"Retrieve, prepare, and process a rich variety of data sources such as operational data from 3rd party database systems (build data pipeline).",Montreal,data_scientist
Pricing Data Scientist,,"Montréal, QC",Sonder,3.3,"Drive revenue growth by developing, deploying and testing optimal pricing algorithms and strategies across Sonder's portfolio of units.",Montreal,data_scientist
"Data Scientist, Ads Unit / Scientifique De Données, Ads Unit",,"Montréal, QC",Unity Technologies,,"Drive Unity's user acquisition product in close collaboration with other data scientists, product managers, and engineers.
Convey ideas and assist execution.",Montreal,data_scientist
Data Scientist,"$55,590 - $118,000 a year","Montréal, QC•Temporarily Remote",Genpact,,"Knowledge of best practices in data analysis and data science.
Maintains complex data pipeline supporting our team’s mission in democratizing data and enabling…",Montreal,data_scientist
Consultant,,"Montréal, QC•Temporarily Remote",Fusion Analytics,,"Team builders (e.g. BBQs, board game nights).
Work with the executive team of a pharmacy to rethink their overall strategy.
Job Types: Full-time, Permanent.",Montreal,data_scientist
Analytics Data Scientist,"$70,000 - $85,000 a year","Montréal, QC•Temporarily Remote",BrainFinance,4.2,Exploratory data analysis employing large data sets involving visualization and basic statistical techniques to develop intuitions and identify key variables in…,Montreal,data_scientist
"Data Scientist Technical Lead (Montreal), Intact Lab",,"Montréal, QC•Remote",Intact,3.8,Coaching and mentoring of senior data scientists on technical matters and act as a technical reference for management.,Montreal,data_scientist
,,"Brossard, QC•Remote",Power Factors,,"Interpreting data, analyzing results using statistical techniques;
Our platforms collect millions of IIoT and other data points, cleans data, detects issues,…",Montreal,data_scientist
Senior Data Scientist - Research Lab Management,,"Montréal, QC",Groom & Associes,4.3,This laboratory will work in close collaboration with research centers based in France for data intelligence and that of Xdev for blockchain.,Montreal,data_scientist
Data Scientist,,"Montréal, QC",ei3 Corporation,,"You will work as part of our international team of Data Scientists, developing and implementing data science algorithms in ei3 that work on machine data to.",Montreal,data_scientist
"Senior Data Scientist, Intact Lab",,"Montréal, QC",Intact,3.8,"Help maintain our data mining tools and platforms.
A multi-platform production experience with the following commercial and open-source data mining frameworks:",Montreal,data_scientist
Montreal - R&D Data Scientist,"$70,000 - $80,000 a year","Montréal, QC",Rubicon HR Canada,,"The job is an English-speaking position, but French-speaking would be a bonus.
For over five years they have been a growing and innovating enterprise in the TMS…",Montreal,data_scientist
Scientifique Principal Chargé Des Données | Senior Data Scie...,,"Montréal, QC",Sonder,3.3,The team creates and implements data-driven pricing strategies to optimize revenue and is responsible for the ongoing development of our forecasting models.,Montreal,data_scientist
Data Engineering Specialist,,"Montréal, QC",Maya HTT,4.3,"Collaborating with data scientist to create the right data pipelines.
Presenting data mining and early data finding results in a clear manner.",Montreal,data_scientist
Senior Sales Engineer,,"Montréal, QC",Forethought,,"Our products enable seamless customer experiences by infusing intelligence at each stage of the customer support journey: resolving common cases instantly,…",Montreal,data_scientist
"Senior Analyst, Basel Capital Adequacy Return",,"Montréal, QC",Laurentian Bank,3.6,"Bring expertise to the review of other reports, data, and various documents.
º Extract data and analyze and identify the sources of variance and improvement of…",Montreal,data_analyst
Senior Problem Management Analyst,"$87,300 - $131,000 a year","Montréal, QC•Remote",EDC,3.8,"Solve problems leveraging critical thinking concepts and data.
Recognize pro-actively where solutions impact related applications, business processes, or data…",Montreal,data_analyst
Financial Planning & Analysis (Fp&A) Analyst,,"Montréal, QC•Remote",BNP Paribas,3.9,"Management the data extraction from the system for different parties.
Fluency in MS PowerPoint and ability to present data in an organized visual manner to…",Montreal,data_analyst
It Infrastructure Manager,,"Montréal, QC",Services Conseils IntelliSoft inc.,,"Direct and administer conditional network analysts plus technicians to provide leadership and direction.
Supervise outsourced data center and telecom service…",Montreal,data_analyst
"Analyst, Demand Planning",,"Boucherville, QC",Lowe's Canada,3.5,"Strong ability to analyze data and make recommendations.
With a distinctive product and service offering and complementary store formats ranging from…",Montreal,data_analyst
Pricing Analyst Experienced,,"Montréal, QC",Tarkett,3.2,Gathers relevant data by working with our sales force to collect bid tabulations; input and manipulate the data to allow for complete analysis and…,Montreal,data_analyst
It Service Management Analyst,,"Montréal, QC",WSP,3.7,"Experience in data analysis, process documentation and performance reporting.
Perform regular compliance tasks on specific projects (ex GC Secret and Protected…",Montreal,data_analyst
Data Scientist Rotation Program,,"Montréal, QC",National Bank of Canada,3.9,Experience in operating high-volume data and complex environments used for the development of advanced analytical applications.,Montreal,data_analyst
Bi Developer Analyst (Microsoft),,"Montréal, QC",DELAN - IT Head Hunters,,"Translate business needs into data management solutions;
Ensure changes and improvements to data analysis systems;
Develop complex reports and dashboards;",Montreal,data_analyst
,,"Saint-Laurent, QC",CAE Inc.,3.6,"The responsible will analyse data, map and develop processes, provide training to users and build reports.
En vous joignant à notre équipe Projets, processus et…",Montreal,data_analyst
Finance Business Analyst (Hybrid Role),,"Montréal, QC",Valsoft,5.0,"Critical thinker with strong data gathering, manipulating, and reporting skills.
Collect, analyze, and synthesize accounting data for integration and…",Montreal,data_analyst
,,"Montréal, QC•Remote",BNP Paribas,3.9,Periodically reach out to vendors hosting our data regarding current threats to ensure they are taking necessary steps to reduce exposure.,Montreal,data_analyst
Business Analyst,,"Montréal, QC",CGI,3.6,Solicit and interpret conceptual business needs and document requirements collecting data from multiple sources.,Montreal,data_analyst
Application Support Analyst,,"Montréal, QC",Talan,,"Document technical knowledge in the form of notes and manuals, reviewing application data.
The consultant will be responsible for monitoring and troubleshooting…",Montreal,data_analyst
Business Intelligence Developer / Analyst - Remote - Canada,,"Montréal, QC•Remote",FullStack Labs,,"Work with clients to analyze their data and processes so you can build dashboards to expose their KPIs.
2+ years experience working with Amazon AWS, Microsoft…",Montreal,data_analyst
Researcher Scientist - Industrial Data,,"Pointe-Claire, QC",FPInnovations,3.9,"Retrieve, prepare, and process a rich variety of data sources such as operational data from 3rd party database systems (build data pipeline).",Montreal,data_scientist
Pricing Data Scientist,,"Montréal, QC",Sonder,3.3,"Drive revenue growth by developing, deploying and testing optimal pricing algorithms and strategies across Sonder's portfolio of units.",Montreal,data_scientist
"Data Scientist, Ads Unit / Scientifique De Données, Ads Unit",,"Montréal, QC",Unity Technologies,,"Drive Unity's user acquisition product in close collaboration with other data scientists, product managers, and engineers.
Convey ideas and assist execution.",Montreal,data_scientist
Data Scientist,"$55,590 - $118,000 a year","Montréal, QC•Temporarily Remote",Genpact,,"Knowledge of best practices in data analysis and data science.
Maintains complex data pipeline supporting our team’s mission in democratizing data and enabling…",Montreal,data_scientist
Consultant,,"Montréal, QC•Temporarily Remote",Fusion Analytics,,"Team builders (e.g. BBQs, board game nights).
Work with the executive team of a pharmacy to rethink their overall strategy.
Job Types: Full-time, Permanent.",Montreal,data_scientist
Analytics Data Scientist,"$70,000 - $85,000 a year","Montréal, QC•Temporarily Remote",BrainFinance,4.2,Exploratory data analysis employing large data sets involving visualization and basic statistical techniques to develop intuitions and identify key variables in…,Montreal,data_scientist
"Data Scientist Technical Lead (Montreal), Intact Lab",,"Montréal, QC•Remote",Intact,3.8,Coaching and mentoring of senior data scientists on technical matters and act as a technical reference for management.,Montreal,data_scientist
,,"Brossard, QC•Remote",Power Factors,,"Interpreting data, analyzing results using statistical techniques;
Our platforms collect millions of IIoT and other data points, cleans data, detects issues,…",Montreal,data_scientist
Senior Data Scientist - Research Lab Management,,"Montréal, QC",Groom & Associes,4.3,This laboratory will work in close collaboration with research centers based in France for data intelligence and that of Xdev for blockchain.,Montreal,data_scientist
Data Scientist,,"Montréal, QC",ei3 Corporation,,"You will work as part of our international team of Data Scientists, developing and implementing data science algorithms in ei3 that work on machine data to.",Montreal,data_scientist
"Senior Data Scientist, Intact Lab",,"Montréal, QC",Intact,3.8,"Help maintain our data mining tools and platforms.
A multi-platform production experience with the following commercial and open-source data mining frameworks:",Montreal,data_scientist
Montreal - R&D Data Scientist,"$70,000 - $80,000 a year","Montréal, QC",Rubicon HR Canada,,"The job is an English-speaking position, but French-speaking would be a bonus.
For over five years they have been a growing and innovating enterprise in the TMS…",Montreal,data_scientist
Scientifique Principal Chargé Des Données | Senior Data Scie...,,"Montréal, QC",Sonder,3.3,The team creates and implements data-driven pricing strategies to optimize revenue and is responsible for the ongoing development of our forecasting models.,Montreal,data_scientist
Data Engineering Specialist,,"Montréal, QC",Maya HTT,4.3,"Collaborating with data scientist to create the right data pipelines.
Presenting data mining and early data finding results in a clear manner.",Montreal,data_scientist
Senior Sales Engineer,,"Montréal, QC",Forethought,,"Our products enable seamless customer experiences by infusing intelligence at each stage of the customer support journey: resolving common cases instantly,…",Montreal,data_scientist
#601099 It Desktop Support Analyst (Contract),,"Montréal, QC","Insight Enterprises, Inc.",3.6,"As a Fortune 500-ranked global provider of digital innovation, cloud/data center transformation, connected workforce, and supply chain optimization solutions…",Montreal,data_analyst
"Analyst, Transaction Real Estate",,"Montréal, QC•Remote",EY,4.0,"Enabled by data and technology, diverse EY teams in over 150 countries provide trust through assurance and help clients grow, transform and operate.",Montreal,data_analyst
Devsecops ⁄ Cybersecurity Analyst,,"Montréal, QC",My Intelligent Machines,,"Do you want to join a rocket ship who is passionate about data protection, cybersecurity and privacy by design?
Test and evaluate security products.",Montreal,data_analyst
Onsite Technical Support Analyst,,"Montréal, QC",MMC Corporate,3.7,"With over 35,000 colleagues operating in more than 130 countries, Marsh serves commercial and individual clients with data driven risk solutions and advisory…",Montreal,data_analyst
Devops / Reliability Engineering Analyst (Application Observ...,,"Montréal, QC",Morgan Stanley,3.8,"Working experience of regular expressions in data extraction from log files.
Working with various streaming Technologies to handle TBs of data each day.",Montreal,data_analyst
,,"Montréal, QC",CGI,3.6,"Develop the different parts of the application from the user interface to data management.
Test automation practice implementation to run tests automatically,…",Montreal,data_analyst
"Analyst, Computer","$54,600 - $65,000 a year","Montréal, QC•Remote",Interfacing Technologies Corporation,5.0,"Assess physical and technical security risks to data, software and hardware.
Credentials (certificates, licences, memberships, courses, etc.).",Montreal,data_analyst
Data Scientist,,"Montréal, QC",DELAN - IT Head Hunters,,"The Data Scientist will be responsible of contributing to the creation of powerful new systems in the medical field, while being part of a new Artificial…",Montreal,data_analyst
Due Diligence Analyst,,"Montréal, QC",Castle Hall,,"Review and verification of fund and management company data maintained within Castle Hall’s extensive due diligence database.
Other duties may be assigned.",Montreal,data_analyst
Senior Data Analyst,,"Montréal, QC",National Bank of Canada,3.9,"Use and explore large volumes of data to meet various business needs, using Datahub and other data sources.
Ensure the quality and integrity of data used.",Montreal,data_analyst
Canada / Vie Data Engineer,,"Montréal, QC",Neoxia,,Participer à la mise en place de plateformes data sur le cloud et au déploiement des outils nécessaires pour le traitement et l’analyse des données.,Montreal,data_analyst
"Analyst, International Freight Systems & Operation",,"Montréal, QC",Aldo Groupe,3.6,"Lead on data extraction automation and reporting consolidation.
Build and maintain a clear data set and inbound orderbook for freight forwarding.",Montreal,data_analyst
Software Engineering Analyst,,"Montréal, QC•Remote",Leyton,,"Technical subject matter expertise across various software engineering fields, including but not limited to computer engineering, data science, hardware, or…",Montreal,data_analyst
"Analyst, Transportation",,"Boucherville, QC",Lowe's Canada,3.5,"Maintain and ensure accuracy of TMS data, business rules, and parameters.
Provide detailed operational data about the budget planning, forecasting, and variance…",Montreal,data_analyst
Analyst,,"Montréal, QC",Crowe BGK,3.6,"Executing financial due diligence mandates which include the preparation of data books, assessing the quality of earnings and working capital requirements;",Montreal,data_analyst
Researcher Scientist - Industrial Data,,"Pointe-Claire, QC",FPInnovations,3.9,"Retrieve, prepare, and process a rich variety of data sources such as operational data from 3rd party database systems (build data pipeline).",Montreal,data_scientist
Pricing Data Scientist,,"Montréal, QC",Sonder,3.3,"Drive revenue growth by developing, deploying and testing optimal pricing algorithms and strategies across Sonder's portfolio of units.",Montreal,data_scientist
"Data Scientist, Ads Unit / Scientifique De Données, Ads Unit",,"Montréal, QC",Unity Technologies,,"Drive Unity's user acquisition product in close collaboration with other data scientists, product managers, and engineers.
Convey ideas and assist execution.",Montreal,data_scientist
Data Scientist,"$55,590 - $118,000 a year","Montréal, QC•Temporarily Remote",Genpact,,"Knowledge of best practices in data analysis and data science.
Maintains complex data pipeline supporting our team’s mission in democratizing data and enabling…",Montreal,data_scientist
Consultant,,"Montréal, QC•Temporarily Remote",Fusion Analytics,,"Team builders (e.g. BBQs, board game nights).
Work with the executive team of a pharmacy to rethink their overall strategy.
Job Types: Full-time, Permanent.",Montreal,data_scientist
Analytics Data Scientist,"$70,000 - $85,000 a year","Montréal, QC•Temporarily Remote",BrainFinance,4.2,Exploratory data analysis employing large data sets involving visualization and basic statistical techniques to develop intuitions and identify key variables in…,Montreal,data_scientist
"Data Scientist Technical Lead (Montreal), Intact Lab",,"Montréal, QC•Remote",Intact,3.8,Coaching and mentoring of senior data scientists on technical matters and act as a technical reference for management.,Montreal,data_scientist
,,"Brossard, QC•Remote",Power Factors,,"Interpreting data, analyzing results using statistical techniques;
Our platforms collect millions of IIoT and other data points, cleans data, detects issues,…",Montreal,data_scientist
Senior Data Scientist - Research Lab Management,,"Montréal, QC",Groom & Associes,4.3,This laboratory will work in close collaboration with research centers based in France for data intelligence and that of Xdev for blockchain.,Montreal,data_scientist
Data Scientist,,"Montréal, QC",ei3 Corporation,,"You will work as part of our international team of Data Scientists, developing and implementing data science algorithms in ei3 that work on machine data to.",Montreal,data_scientist
"Senior Data Scientist, Intact Lab",,"Montréal, QC",Intact,3.8,"Help maintain our data mining tools and platforms.
A multi-platform production experience with the following commercial and open-source data mining frameworks:",Montreal,data_scientist
Montreal - R&D Data Scientist,"$70,000 - $80,000 a year","Montréal, QC",Rubicon HR Canada,,"The job is an English-speaking position, but French-speaking would be a bonus.
For over five years they have been a growing and innovating enterprise in the TMS…",Montreal,data_scientist
Scientifique Principal Chargé Des Données | Senior Data Scie...,,"Montréal, QC",Sonder,3.3,The team creates and implements data-driven pricing strategies to optimize revenue and is responsible for the ongoing development of our forecasting models.,Montreal,data_scientist
Data Engineering Specialist,,"Montréal, QC",Maya HTT,4.3,"Collaborating with data scientist to create the right data pipelines.
Presenting data mining and early data finding results in a clear manner.",Montreal,data_scientist
Senior Sales Engineer,,"Montréal, QC",Forethought,,"Our products enable seamless customer experiences by infusing intelligence at each stage of the customer support journey: resolving common cases instantly,…",Montreal,data_scientist
Analyste De La Croissance Des Affaires/Business Growth Analy...,,"Saint-Laurent, QC",CAE Inc.,3.6,"Use trade data subscriptions, internal data and other market research methods to identify and qualify leads;
Identify, consolidate and efficiently present data…",Montreal,data_analyst
"Senior Analyst, Trading Support And Operations",,"Montréal, QC",PSP Investments,4.4,"Ensure system data integrity by performing daily transactions and positions reconciliations.
Take charge of configurations of commission and data conformity…",Montreal,data_analyst
Canada / Data Engineer/Scientist,"$55,000 - $65,000 a year","Montréal, QC",Neoxia,,"Au sein de la Data Factory de Neoxia, tu pourras intégrer une équipe pluridisciplinaire (Data Analysts, Data Scientists, Data Ops, Data Architect, Scrum Master,…",Montreal,data_analyst
Fp&A Analyst,,"Montréal, QC",Stingray,3.8,"Fluency in PowerPoint and ability to present data in an organized visual manner.
Exposure to data visualization software a plus (e.g. Tableau, PowerBI, etc.).",Montreal,data_analyst
Analyste De La Stratégie/Strategy Analyst,,"Saint-Laurent, QC",CAE Inc.,3.6,"Support CAE International’s pipeline management activities which include monitoring data integrity and report generation.
3 ans et plus d’expérience pertinente.",Montreal,data_analyst
Accounts Payable Analyst,,"Dollard-Des Ormeaux, QC",Brother Canada,3.8,The Accounts Payable Settlement Analyst will receive all incoming invoices and prepare for data entry in accordance with processes.,Montreal,data_analyst
Senior Analyst,"$90,210 - $135,320 a year","Montréal, QC",McGill University,4.3,Demonstrated knowledge of functional analysis and data analysis; ability to understand and clarify business needs formulated by requesters and stakeholders.,Montreal,data_analyst
Bi Developer,,"Montréal, QC",Ubisoft,3.8,"Proven experience as a data scientist or ETL developer in a data ecosystem, with specific expertise in ETL development, working with large volumes of data, if…",Montreal,data_analyst
Senior Data Analyst // Analyste De Données Sénior,,"Montréal, QC",Mistplay,,"Experience working with very large data sets and distributed computing (Hive/Hadoop).
Extensive experience pulling highly dimensional and complex data, as well…",Montreal,data_analyst
"Analyst, Employee Relations (Recruitment)",,"Montréal, QC•Temporarily Remote",Canada Post - Postes Canada,3.6,"Supports legislative programs (Human Rights, Employment Equity, Official Languages and Privacy) by retrieving employment history from SAP and legacy systems for…",Montreal,data_analyst
"Analyst, Performance Measurement And Attribution",,"Montréal, QC",PSP Investments,4.4,The main objective of the analyst is to ensure that the data required to calculate PSP's return on investment is well integrated into the calculation tool.,Montreal,data_analyst
"Business Analyst, Sales Operations",,"Montréal, QC",Otsuka,3.7,"Experience with managing systems (data warehousing) and knowledge of SQL a plus.
Actively participate and make recommendation for refinement to business plans,…",Montreal,data_analyst
Application Production Support Analyst,,"Montréal, QC",BNP Paribas,3.9,"Ensure data protection regulations are implemented from a data security standpoint.
Understanding of data protection principles.
Knowledge of SQL/Pl SQL.",Montreal,data_analyst
