title,salary,location,employer,employer_rating,summary,search_city,search_role
Environmental Impact Analyst,"$50,000 a year","Montréal, QC",Habitat,4.0,"Engage in the design and development of new equipment and procedures for meteorological data collection, remote sensing, or for related applications.",Montreal,data_analyst
,,"Montréal, QC•Remote",Desjardins,3.9,"As a data analyst, you collect, process, analyze and use data that comes through different channels.
You provide data use guidance and support to stakeholders.",Montreal,data_analyst
,,"Montréal, QC",SSENSE,3.0,"Experience in working with data visualization tools such as Tableau or similar data discovery and visualization tools.
Analyze root causes of inventory issues.",Montreal,data_analyst
Amazon Analyst,,"Montréal, QC",L'Oreal,4.1,"Ability to translate large amounts of data into useful information and draw conclusions.
C. Build and maintain operational reporting to aggregate data across 5…",Montreal,data_analyst
,,"Montréal, QC",BNP Paribas,3.9,"The candidate will be supporting internal data clients.
Collaborate on projects in a business analyst or project management capacity.
Master’s degree is a plus.",Montreal,data_analyst
,,"Montréal, QC",BNP Paribas,3.9,CIB IT - Data Analytics Team focuses on advancing our Analytics capabilities with visualization tools and data engineering pipelines.,Montreal,data_analyst
Operational Data Analyst (User Research Lab),,"Montréal, QC",Ubisoft,3.8,"Perform data queries and KPI computations on in-game data.
As an operational data analyst within the Lab, you’ll transform raw in-game data into meaningful…",Montreal,data_analyst
Data Analyst,,"Montréal, QC",Levio,4.7,"We are looking for a creative and talented UI developer with strong Javascript/Typescript development skills using React.
Up to 6 weeks of vacation.",Montreal,data_analyst
,"$64,210 - $80,260 a year","Montréal, QC",McGill University,4.3,"Analyze and prepare and/or load data into Workday.
Thorough knowledge and understanding of Banner HR processes, data, tables, modules and functionality.",Montreal,data_analyst
,,"Montréal, QC",Canadian National Railway,3.1,"Analyze large quantities of data and display in graphical formats.
Canadian National Railway Company (CN) is looking for a highly motivated person to fulfill a…",Montreal,data_analyst
,,"Montréal, QC",SSENSE,3.0,"Analyze data to identify operational opportunities and risks.
The business analyst will be responsible for formulating clear recommendations on how to improve…",Montreal,data_analyst
,,"Montréal, QC",Autodesk,4.1,"Build a data pipeline to support data driven decision making.
Complete data analysis with SQL, Algorithms, Data Structures, Database Concepts, Machine Learning.",Montreal,data_analyst
Performance And Data Analyst - Telus Health Virtual Care,,"Montréal, QC•Remote",TELUS,3.9,"Coordinate new data development, ensuring consistency and integration with the existing data warehouse structure.
Hands-on Tableau and MS Office experience.",Montreal,data_analyst
Data Analyst,,"Montréal, QC",Talan,,"Web Analytics (Google Analytics, Google Data Studio, Power BI, Agency Analytics, etc.);
Plateformes média (Double Click, etc.) et CRM (Sales Force) ;",Montreal,data_analyst
Business Analyst Business Intelligence,,"Montréal, QC",Ubisoft,3.8,"Perform SQL queries in order to analyze data, perform tests, ensure data quality.
The focus will be on Quality control domain and around databases & data…",Montreal,data_analyst
Scientifique Des Données / Data Scientist,,"Saint-Laurent, QC",Ericsson,4.1,"Applied experience: 2+ years of Machine Learning experience in data science.
Conduct studies and find creative usage of new and/or existing data sources.",Montreal,data_scientist
Data Scientist,,"Montréal, QC",GSOFT,,"You will join GSoft's Data & Analytics team, a team composed of diverse data science expertise, including data engineers and data scientists.",Montreal,data_scientist
Scientifique Des Données / Data Scientist,,"Saint-Laurent, QC•Remote",CAE Inc.,3.6,"Develop custom data models and algorithms to apply to data sets.
Assess the effectiveness and accuracy of new data sources and data gathering techniques.",Montreal,data_scientist
,,"Montréal, QC",Alithya,4.0,"Data visualization tools — Tableau, Plotly, etc.
Proven ability to merge and transform disparate internal and external data sets together to create new features…",Montreal,data_scientist
,,"Montréal, QC",Mistplay,,Our teams leverage a wealth of in-game data and machine learning to recommend the right games to the right users - creating a completely tailored gaming…,Montreal,data_scientist
"Data Scientist, Data Valorization",,"Montréal, QC•Remote",Desjardins,3.9,"You lead different stakeholders in projects to meet a variety of business needs, by developing scalable data mining solutions and through complex, strategic…",Montreal,data_scientist
,,"Montréal, QC",TELUS,3.9,"Montreal, Quebec, CA Edmonton, AB, CA Calgary, AB, CA Toronto, ON, CA Vancouver, British Columbia, CA.
L’équipe Marketing, stratégie et analyse de données,…",Montreal,data_scientist
Data Scientist Rotation Program,,"Montréal, QC",National Bank of Canada,3.9,Experience in operating high-volume data and complex environments used for the development of advanced analytical applications.,Montreal,data_scientist
Data Scientist,,"Montréal, QC",DELAN - IT Head Hunters,,"The Data Scientist will be responsible of contributing to the creation of powerful new systems in the medical field, while being part of a new Artificial…",Montreal,data_scientist
Data Scientist,,"Brossard, QC",Newfold Digital,3.4,A posting already exists for the role: https://web.wd1.myworkdayjobs.com/ExternalCareerSite/job/Brossard-Quebec/Data-Scientist_R1209. Just tagged this on to…,Montreal,data_scientist
Data Scientist,,"Montréal, QC",Rizing,,"As a data scientist, with experience in Business and People Analytics, you will be responsible helping Rizing and its clients shift to data-driven decision…",Montreal,data_scientist
,,"Montréal, QC",CAA Québec,4.0,Le service Intelligence d’affaires valorise la donnée et développe la connaissance pour contribuer à la définition et à la réalisation d’initiatives d’affaires.,Montreal,data_scientist
Data Scientist – Automated Market Making Team,,"Montréal, QC",Morgan Stanley,3.8,"AMM is made up of software and hardware developers, traders, data scientists and quantitative strategist.
Interest in quantitative work and data analytics.",Montreal,data_scientist
Senior Data Scientist,,"Montréal, QC",Société Générale,3.9,"Strong data engineering skills (Python).
Relevant degree in a data science, computer science or related field.",Montreal,data_scientist
Data Scientist,,"Montréal, QC",National Bank of Canada,3.9,"Advise high-performance data teams and monitor new data enhancement developments and trends.
Reporting to the Analytics Adoption Manager, you will use the…",Montreal,data_scientist
,,"Montréal, QC",BNP Paribas,3.9,"Analytics – must know how to manipulate data and be comfortable with new tools /technologies.
We are looking for a smart, autonomous and energetic intern who…",Montreal,data_analyst
,,"Montréal, QC•Remote",BNP Paribas,3.9,"The candidate will be supporting internal data clients.
Collaborate on projects in a business analyst or project management capacity.
Master’s degree a plus.",Montreal,data_analyst
Delay Analyst,,"Montréal, QC",Systech International,,"As a Delay Analyst, you will be responsible for providing clients with effective and claims advice, based on detailed and thorough forensic examination and…",Montreal,data_analyst
Data Analyst,,"Montréal, QC",SharkNinja,3.2,"Critical thinking and problem-solving skills are essential for interpreting data.
Develop data governance, best practices, and processes with BI Tool vendor.",Montreal,data_analyst
Data Analyst - Latin America,,"Montréal, QC•Remote",Mino Games,,"Promote data-driven decision processes in the whole company.
Generate high-value insights from the data and communicate them in a meaningful way.",Montreal,data_analyst
,,"Montréal, QC",National Bank of Canada,3.9,"Collaborate with data scientists and data visualization experts in order to provide them with suitable data.
Experience in data flow design and development.",Montreal,data_analyst
"Analyst, Data & Analytics – Data Modeler",,"Dorval, QC",Air Canada,3.8,Perform data model consolidation and integration to integrate new silos of organizations source data to the data platform.,Montreal,data_analyst
Qa Analyst,,"Montréal, QC",TELUS International,3.8,"Implement and execute data extraction scripts and validate data integrity.
Compile and analyze statistical data.
Expérience avec le test des API REST.",Montreal,data_analyst
Data Analyst (6 Months),,"Dollard-Des Ormeaux, QC",Brother Canada,3.8,"Experience with big data tools like Apache Spark and Azure.
Migrate databases from local servers into cloud data warehouses (Azure).",Montreal,data_analyst
,,"Montréal, QC",BNP Paribas,3.9,Monitor data quality in the RISK systems and potentially represent RISK GM’s interests for projects that involve data quality improvement.,Montreal,data_analyst
"Data Analyst, Omnia Ai (Cdc)",,"Montréal, QC",Deloitte,4.0,"2+ years of experience in Data related projects like Modeling and ETL processes within Enterprise systems & Modern Analytic platforms: data lake, data warehouse…",Montreal,data_analyst
Data Business Analyst,,"Montréal, QC",BRP,3.9,"Develop deep understanding of the various HR and business processes, data sets and data deliverables.
5+ years of related to business and/or data analyst…",Montreal,data_analyst
"Analyste Des Données, Intelligence Artificielle / Ai Data An...",,"Montréal, QC",CAE Inc.,3.6,"Experience in data warehouse design and implementation with an emphasis on data preparation.
Develop data management tools to support data-driven decision from…",Montreal,data_analyst
Business Analyst,,"Saint-Laurent, QC",ABB,3.9,"A REPORTING, ANALYSIS AND PROCESS-FOCUSED ROLE The business analyst will help guide Electrification in improving processes, products, services and software…",Montreal,data_analyst
,,"Saint-Laurent, QC",Hypertec Systems,,"Extensive knowledge of data warehouses, data architecture modeling and multidimensional analysis;
Help maintain and support our corporate data warehouse system,…",Montreal,data_analyst
,,"Montréal, QC•Remote",SSENSE,3.0,"Coach more junior data scientists on best practices and machine learning solution design.
Contribute to data mining architecture, modeling standards and data…",Montreal,data_scientist
Data Scientist,,"Montréal, QC",Morgan Stanley,3.8,"Knowledge of best practices in data analysis and data science.
Maintains complex data pipeline supporting our team’s mission in democratizing data and enabling…",Montreal,data_scientist
Data Scientist,,"Montréal, QC•Remote",sharethrough,,"Present findings to data scientists and product managers to influence product roadmaps.
Work with our data engineering team to make the data needed for your…",Montreal,data_scientist
Data Scientist,,"Montréal, QC",Brain Finance,,"Developing data analysis and science solutions with Python.
Utilizing Apache Spark, Apache Kafka, and Apache Cassandra to develop scalable real-time and data…",Montreal,data_scientist
Expert En Science Des Données - Francophone / French Data Sc...,,"Montréal, QC",Equifax,3.5,"Structure and upgrade the data collected for economic analysis and various reports.
Collect the necessary data from the database, if necessary supplemented by…",Montreal,data_scientist
Data Scientist,,"Montréal, QC",Services Conseils IntelliSoft inc.,,"Extraire et analyser les données se trouvant dans les bases de données de l’entreprise afin d’optimiser et d’améliorer le développement des produits, les…",Montreal,data_scientist
Data Scientist,,"Montréal, QC",Koïos Intelligence,,"Analyze source data, working with structured and unstructured data.
As a technical lead candidate, you will be working with various team members such as data…",Montreal,data_scientist
Data Scientist,,"Montréal, QC","Analysis Group, Inc.",,"Using natural language processing methodologies to work with EMR data, social media data and other unstructured data.",Montreal,data_scientist
Product Data Scientist,,"Montréal, QC•Remote",sharethrough,,"Work closely with business leadership to integrate data into every part of the product.
Analyze Sharethrough data to discover patterns, abnormalities, and…",Montreal,data_scientist
Responsable Du Discours Et Des Données Scientifiques - Speec...,,"Montréal, QC",Nuance,3.2,"Passionate about managing and analysing large volumes of data to solve problems and improve system performance.
A minimum of 2+ years of related experience.",Montreal,data_scientist
Data Scientist Consultant,,"Montréal, QC•Remote",Rizing,,"Plans and executes data conversion activities.
The SAC Consultant is part of Rizing’s Analytics practice, responsible for helping Rizing and its clients shift…",Montreal,data_scientist
Analyste Intelligence D'Affaires (Data Scientist),,"Montréal, QC",SAQ - Société des Alcools du Québec,3.8,"Connaissance des techniques de data mining (Segmentations, modèles prédictifs, etc.);
Sous la supervision du Directeur adjoint Intelligence d’affaires et…",Montreal,data_scientist
,,"Montréal, QC",National Bank of Canada,3.9,"Work in SAS and coordinate data analytics and exploration, including the data transformation and visualization steps (reporting).
Knowledge of SAS and SQL.",Montreal,data_scientist
Data Science Intern / Stagiaire En Science Des Données,,"Montréal, QC",Unity Technologies,,"Implement real-time machine learning algorithms in production for Ads campaign optimization, with help from other data scientists, engineers and developers.",Montreal,data_scientist
"Data Scientist, Gestion Des Revenus",,"Montréal, QC",Intelcom Express,2.5,"Analyser et visualiser les opérations commerciales et les données du marché.
Comprendre le problème de l'entreprise, identifier les principaux défis, formuler…",Montreal,data_scientist
Product Data Analyst,,"Montréal, QC•Remote",Ruby Labs™,,"5+ years of experience as a product data analyst.
Designing ETL data processing to provide stable reporting in a dynamic data environment.",Montreal,data_analyst
,,"Montréal, QC",Sobeys,3.6,"Monitors and provides data required for monthly metrics and department dashboard;
Provides remote and onsite support for all Incidents, Requests and Changes for…",Montreal,data_analyst
Analyst - Decarbonization - Canada,,"Montréal, QC",Atos,3.5,"However, the successful applicant may be required to travel within North America and internationally on assignment.
Advanced knowledge of Excel and PowerPoint.",Montreal,data_analyst
,,"Montréal, QC",Ardene,3.3,"Monitor and track data quality and data flow dynamics;
Design, construct, install and maintain highly scalable data management systems that ingest and integrate…",Montreal,data_analyst
Sustainability Analyst,,"Montréal, QC•Temporarily Remote",Gildan,3.7,"Develop ESG data management best practices.
Support the Director, Global Sustainability in data collection and verification to develop various ESG disclosures:",Montreal,data_analyst
Data Analyst,,"Montréal, QC",Evercore,,"Extremely strong analytical and mathematical abilities.
Experience with NOSQL databases such as Elasticsearch.
Preferences will be given to candidates who have.",Montreal,data_analyst
Analyste De Données De L’Expérience Client /Customer Experie...,,"Notre-Dame-de-Grâce, QC",CAE Inc.,3.6,"Experience in data warehouse design and implementation with an emphasis on data preparation.
Experience in data warehouse design and implementation with an…",Montreal,data_analyst
Fraud Analyst,,"Montréal, QC",BMO Financial Group,3.8,"Analyzes data and information to provide insights and recommendations.
Gathers and formats data into regular and ad-hoc reports, and dashboards.",Montreal,data_analyst
Analyst,"$64,210 - $96,310 a year","Montréal, QC",McGill University,4.3,Demonstrated knowledge of functional analysis and data analysis - ability to understand and clarify business needs formulated by requesters and stakeholders.,Montreal,data_analyst
Data Privacy And Protection Analyst,,"Montréal, QC•Remote",BNP Paribas,3.9,"5 plus years of professional experience ideally in data governance or data privacy.
Data protection or data privacy certifications strongly recommended.",Montreal,data_analyst
,,"Montréal, QC",Accenture,4.0,"As part of our Summer Analyst Program, you’ll have a 10 week experience that mirrors the learning, networking and social events our Security Analysts enjoy…",Montreal,data_analyst
Impact Analyst (Junior),,"Montréal, QC•Temporarily Remote",Impak Finance,,"Experience in research, analysis and data processing.
Status: Full-time - 40 hours per week.
A full-time job that begins with a training period.",Montreal,data_analyst
"Data Analyst, Business Intelligence",,"Montréal, QC",Ivanhoe Cambridge,3.9,"Profile and mine data (analyze potential data sources, evaluate data quality, etc.);
Minimum five years of experience as a business/system analyst in business…",Montreal,data_analyst
Master Data Analyst,,"Montréal, QC",Aldo Groupe,3.6,"As a Master Data analyst, you will create and modify master data in our systems.
Create and update master data in SAP.
On campus gym with access to a trainer.",Montreal,data_analyst
Data Analyst | Analyste De Données,,"Montréal, QC",METRIO,,"Represent data in graphs in our SaaS web platform.
Work on client's data to define their metrics in Python using our internal tool.",Montreal,data_analyst
"Data Scientist, Revenue Management",,"Montréal, QC",Intelcom Express,2.5,"To support its technological transformation and enables data-driven decision, Intelcom is currently looking for a data scientist specialized in revenue…",Montreal,data_scientist
Bi Developer,,"Montréal, QC",Ubisoft,3.8,"Proven experience as a data scientist or ETL developer in a data ecosystem, with specific expertise in ETL development, working with large volumes of data, if…",Montreal,data_scientist
Digital Data Scientist,,"Dorval, QC",Bombardier,3.8,"You have experience designing and implementing AI/data science algorithms/systems and managing the associated data by leveraging, connecting and…",Montreal,data_scientist
"Data Scientist, Validation And Monitoring",,"Montréal, QC",Desjardins,3.9,"As a data scientist, risk model validation and monitoring, you provide the data needed to make business decisions, develop solutions and services adapted to…",Montreal,data_scientist
Senior Data Scientist (Remote),,"Montréal, QC•Remote",Sun Life Financial,3.9,"Demonstrated experience in data transformation & data manipulation.
You are a data scientist who is constantly updating their knowledge of data science state-of…",Montreal,data_scientist
,,"Montréal, QC",Canadian National Railway,3.1,"Perform research on efficient learning algorithms that require fewer manually labeled data sets such as Active Learning, Semi-Supervised learning, and Few-Shot…",Montreal,data_scientist
"(Remote) Senior Data Scientist, Growth - Personalization",,"Montréal, QC•Remote",Hopper,3.6,"A minimum of three years experience as a data scientist using data mining, machine learning, statistical modeling algorithms.",Montreal,data_scientist
Senior Data Scientist Ml & Nlp Expert,,"Montréal, QC",SITA,3.8,"5+ years of professional experience as a data scientist or related roles.
Learn from peers in data science and engineering community.",Montreal,data_scientist
Senior Data Scientist / Scientifique Principal Des Données,,"Dollard-Des Ormeaux, QC•Remote",Brother Canada,3.8,"Monitor data quality and issue recommendations.
Ability to analyze large data sets from multiple sources through efficient database tools and methods.",Montreal,data_scientist
"Analyst, Artificial Intelligence",,"Dorval, QC",Air Canada,3.8,"Design, undertake and analyze data to determine patterns and insights that can optimize data ingestion and data presentation.",Montreal,data_scientist
Data Scientist,,"Kirkland, QC",IQVIA,3.8,"BS degree with a specialty in data science, data analytics or related.
Improve existing client facing data visualizations and reports.",Montreal,data_scientist
,,"Montréal, QC",Microsoft,4.2,"Microsoft a pour mission de permettre à chaque personne et à chaque organisation de la planète de faire plus.
Nous recherchons un gestionnaire de compte client …",Montreal,data_scientist
Algorithm Engineer,,"Montréal, QC",Volta Charging,,"Actively performing data science analysis for an internal team on a weekly basis.
Is able to perform guided research and suggest viable algorithmic modules and…",Montreal,data_scientist
Machine Learning & Cloud Designer Summer Intern,,"Montréal, QC",ALÉO Canada,,"2 years of relevant work experience in data analysis or related fields (e.g., work experience as a statistician/data scientist).",Montreal,data_scientist
Développeur De Données / Data Developer,,"Montréal, QC",Bethesda Game Studios,,"Assist data scientists to wrangle data and build working tables to speed analysis;
Provide support related to all data tracking initiatives;",Montreal,data_scientist
Bi & Reporting Analyst,,"Montréal, QC",TD Bank,3.8,"Document business rules and validate data mappings;
Must be able to understand different operational systems: systems functioning (engineering concept), what…",Montreal,data_analyst
Spécialiste En Analyse Des Données / Data Analyst,,"Montréal, QC",Bethesda Game Studios,,"Previous experience as a data analyst for online services.
Previous experience as a data analyst for a game development studio and/or a strong interest and…",Montreal,data_analyst
,,"Montréal, QC•Remote",BNP Paribas,3.9,"Management the data extraction from the system for different parties.
Fluency in MS PowerPoint and ability to present data in an organized visual manner to…",Montreal,data_analyst
Quality Assurance Analyst (Fixed Income),,"Montréal, QC",Société Générale,3.9,"You will develop, document and maintain functional test cases and other test artifacts like the test data, data validation, harness scripts and automated…",Montreal,data_analyst
Intern Programmer Analyst - Winter 2022,,"Montréal, QC",Société Générale,3.9,"Collect needs and specify the functionalities to be implemented.
Implement, test and deliver functionalities according to our standards.",Montreal,data_analyst
"Analyst, Artificial Intelligence",,"Dorval, QC",Air Canada,3.8,"Design, undertake and analyze data to determine patterns and insights that can optimize data ingestion and data presentation.",Montreal,data_analyst
Analyst Compensation - Student Job,,"Montréal, QC",Sobeys,3.6,Validate employee data surrounding eligibility for targeted adjustments and the annual salary review process and communicate with HRBPs as required;,Montreal,data_analyst
Payroll Analyst,"$1,100 a week","Montréal, QC•Remote",BNP Paribas,3.9,"Carries out data entry for the creation, maintenance and termination of employee files in HR systems;
The analyst works in close collaboration with the payroll…",Montreal,data_analyst
"Developer Analyst, Bi And Data Visualization",,"Montréal, QC",National Bank of Canada,3.9,"Acting as a data management and mining expert and working closely with analytics partners, data analysts and data scientists to carry out various mandates that…",Montreal,data_analyst
Quality Assurance Analyst (Dna),,"Montréal, QC",Ubisoft,3.8,"Committed to knowledge sharing, we collect, process, and curate in-game data.
The DNA team develops and manages a variety of data services and tools for storing…",Montreal,data_analyst
,,"Montréal, QC",Alithya,4.0,"In data and business analysis;
Please note that candidates must have an eligible work permit for Canada and be fluent in French.",Montreal,data_analyst
Intern Risk Analyst - Summer 2022,,"Montréal, QC",Société Générale,3.9,"Assist MRM in running programs to retrieve data for the calculation of CMM metrics.
This role is within the Model Risk Governance Team of the Risk Management…",Montreal,data_analyst
Benchmark Analyst,,"Montréal, QC",IBS Software,,"Collect relevant data inputs, parameters and rules from airline clients for benchmark preparation.
Strong analytical capabilities and able to drill down…",Montreal,data_analyst
Operations Analyst,,"Montréal, QC",Artika,3.5,"Relevant experience in data management.
Master record o Price modification.
Purchasing project management - Logistics in support of the team.",Montreal,data_analyst
,,"Montréal, QC•Remote",National Bank of Canada,3.9,"Ability to analyze data and situations to provide recommendation to the management team.
You’ll also help the team to manage the change management and incident…",Montreal,data_analyst
,,"Montréal, QC",CAA Québec,4.0,"Agir en tant que référence auprès des autres rôles de l’équipe (data scientist, exploitation de données) en matière de requêtes SQL avancées.",Montreal,data_scientist
,,"Montréal, QC",National Bank of Canada,3.9,"Work in SAS and coordinate data analytics and exploration, including the data transformation and visualization steps (reporting).",Montreal,data_scientist
Expert Principal - Mégadonnées - Technologies 5G / Senior Da...,,"Montréal, QC",Syntronic,3.9,Partner with both internal & external sources to gather and examine data from disparate sources with the goal of discovering previously hidden insights.,Montreal,data_scientist
